rank,yearRank,candidateRank,year,title,authors,venue,publicationDate,citationCount,influentialCitationCount,importanceScore,category,methodTags,keywordTags,keyIdea,strengths,limitations,url,semanticScholarUrl,openAccessPdf,doi,arxiv,pubmed,corpusId,fieldsOfStudy,publicationTypes,sourceQueries,queryHitCount,importanceReasons,abstract
276,49,49,2022,Why do tree-based models still outperform deep learning on typical tabular data?,"Léo Grinsztajn, Edouard Oyallon, G. Varoquaux",Neural Information Processing Systems,,1646,107,244.497,"Trustworthy, Explainable, and Responsible AI",benchmark/dataset; trustworthy-ai,nlp; vision; trustworthy-ai,"While deep learning has enabled tremendous progress on text and image datasets, its superiority on tabular data is not clear.","high citation signal (1,646); influential citation signal (107)","Explanations can be persuasive without being faithful to model internals or decision processes.; Fairness, robustness, privacy, and safety metrics can conflict and require domain-specific tradeoffs.; Responsible AI results often need stronger deployment evidence beyond benchmark or synthetic settings.",https://doi.org/10.52202/068431-0037,https://www.semanticscholar.org/paper/5a00b32876f7d4869bce980500d4ccc978389315,,10.52202/068431-0037,,,252697222,Computer Science; Mathematics,JournalArticle,deep learning,1,citations=1646; influential=107; survey/benchmark signal; resource signal; translation/trustworthiness signal; open PDF metadata; title AI matches=1; AI term matches=2,"While deep learning has enabled tremendous progress on text and image datasets, its superiority on tabular data is not clear. We contribute extensive benchmarks of standard and novel deep learning methods as well as tree-based models such as XGBoost and Random Forests, across a large number of datasets and hyperparameter combinations. We define a standard set of 45 datasets from varied domains with clear characteristics of tabular data and a benchmarking methodology accounting for both fitting models and finding good hyperparameters. Results show that tree-based models remain state-of-the-art on medium-sized data ( ∼ 10K samples) even without accounting for their superior speed. To understand this gap, we conduct an empirical investigation into the differing inductive biases of tree-based models and Neural Networks (NNs). This leads to a series of challenges which should guide researchers aiming to build tabular-specific NNs: 1. be robust to uninformative features, 2. preserve the orientation of the data, and 3. be able to easily learn irregular functions. To stimulate research on tabular architectures, we contribute a standard benchmark and raw data for baselines: every point of a 20 000 compute hours hyperparameter search for each learner. Results Looking at the results as a function of random search time rather than random search iterations tree-based models superiority even more striking. Neural networks and tree-based models were close for some benchmarks after a small number of iterations, but for the same amount of time spent on random search, tree-based models scores are always high above neural networks."
281,50,50,2022,TotalSegmentator: Robust Segmentation of 104 Anatomic Structures in CT Images.,"J. Wasserthal, H. Breit, Manfred T. Meyer, M. Pradella, Daniel Hinck, A. Sauter, T. Heye, Daniel T Boll, et al.",Radiology: Artificial Intelligence,2022-08-11,1628,157,258.582,"AI for Science, Healthcare, and Robotics",benchmark/dataset; trustworthy-ai; ai4science,vision; reinforcement-learning; trustworthy-ai; ai4science,Purpose To present a deep learning segmentation model that can automatically and robustly segment all major anatomic structures on body CT images.,"high citation signal (1,628); influential citation signal (157); recognized venue; open-access PDF metadata","External validation, prospective testing, and domain expert review are often more important than retrospective benchmark scores.; Clinical, biological, or robotic deployment can fail when data collection protocols differ from training assumptions.; Safety, interpretability, uncertainty, and regulatory evidence remain essential for translation.",https://doi.org/10.1148/ryai.230024,https://www.semanticscholar.org/paper/586f5754f6825d445afa5026c0fede55a65290a1,http://arxiv.org/pdf/2208.05868,10.1148/ryai.230024,2208.05868,37795137,260790662,Computer Science; Engineering; Medicine,JournalArticle,deep learning,1,citations=1628; influential=157; recognized venue; survey/benchmark signal; resource signal; translation/trustworthiness signal; open PDF metadata; AI term matches=3,"Purpose To present a deep learning segmentation model that can automatically and robustly segment all major anatomic structures on body CT images. Materials and Methods In this retrospective study, 1204 CT examinations (from 2012, 2016, and 2020) were used to segment 104 anatomic structures (27 organs, 59 bones, 10 muscles, and eight vessels) relevant for use cases such as organ volumetry, disease characterization, and surgical or radiation therapy planning. The CT images were randomly sampled from routine clinical studies and thus represent a real-world dataset (different ages, abnormalities, scanners, body parts, sequences, and sites). The authors trained an nnU-Net segmentation algorithm on this dataset and calculated Dice similarity coefficients to evaluate the model's performance. The trained algorithm was applied to a second dataset of 4004 whole-body CT examinations to investigate age-dependent volume and attenuation changes. Results The proposed model showed a high Dice score (0.943) on the test set, which included a wide range of clinical data with major abnormalities. The model significantly outperformed another publicly available segmentation model on a separate dataset (Dice score, 0.932 vs 0.871; P < .001). The aging study demonstrated significant correlations between age and volume and mean attenuation for a variety of organ groups (eg, age and aortic volume [rs = 0.64; P < .001]; age and mean attenuation of the autochthonous dorsal musculature [rs = -0.74; P < .001]). Conclusion The developed model enables robust and accurate segmentation of 104 anatomic structures. The annotated dataset (https://doi.org/10.5281/zenodo.6802613) and toolkit (https://www.github.com/wasserth/TotalSegmentator) are publicly available.Keywords: CT, Segmentation, Neural Networks Supplemental material is available for this article. © RSNA, 2023See also commentary by Sebro and Mongan in this issue."
289,51,51,2022,Language Models as Zero-Shot Planners: Extracting Actionable Knowledge for Embodied Agents,"Wenlong Huang, P. Abbeel, Deepak Pathak, Igor Mordatch",International Conference on Machine Learning,2022-01-18,1605,98,247.725,Foundation Models and Large Language Models,metadata-ranked,foundation-models; nlp,Can world knowledge learned by large language models (LLMs) be used to act in interactive environments?,"high citation signal (1,605); influential citation signal (98); recognized venue","Capability gains are difficult to separate from data scale, benchmark leakage, and evaluation prompt sensitivity.; Alignment and safety claims often need stronger real-world and multilingual validation.; Compute-intensive training can limit reproducibility and concentrate follow-up work around a small number of institutions.",https://www.semanticscholar.org/paper/92a8f7f09f3705cb5a6009a42220a6f01ea084e8,https://www.semanticscholar.org/paper/92a8f7f09f3705cb5a6009a42220a6f01ea084e8,,,2201.07207,,246035276,Computer Science,JournalArticle; Conference,large language models,1,citations=1605; influential=98; recognized venue; open PDF metadata; title AI matches=2; AI term matches=6,"Can world knowledge learned by large language models (LLMs) be used to act in interactive environments? In this paper, we investigate the possibility of grounding high-level tasks, expressed in natural language (e.g.""make breakfast""), to a chosen set of actionable steps (e.g.""open fridge""). While prior work focused on learning from explicit step-by-step examples of how to act, we surprisingly find that if pre-trained LMs are large enough and prompted appropriately, they can effectively decompose high-level tasks into mid-level plans without any further training. However, the plans produced naively by LLMs often cannot map precisely to admissible actions. We propose a procedure that conditions on existing demonstrations and semantically translates the plans to admissible actions. Our evaluation in the recent VirtualHome environment shows that the resulting method substantially improves executability over the LLM baseline. The conducted human evaluation reveals a trade-off between executability and correctness but shows a promising sign towards extracting actionable knowledge from language models. Website at https://huangwl18.github.io/language-planner"
291,52,52,2022,Code as Policies: Language Model Programs for Embodied Control,"Jacky Liang, Wenlong Huang, F. Xia, Peng Xu, Karol Hausman, Brian Ichter, Peter R. Florence, Andy Zeng",IEEE International Conference on Robotics and Automation,2022-09-16,1604,110,245.313,Foundation Models and Large Language Models,benchmark/dataset; ai4science; reinforcement-learning,foundation-models; nlp; reinforcement-learning; ai4science,Large language models (LLMs) trained on code-completion have been shown to be capable of synthesizing simple Python programs from docstrings [1].,"high citation signal (1,604); influential citation signal (110); open-access PDF metadata","Capability gains are difficult to separate from data scale, benchmark leakage, and evaluation prompt sensitivity.; Alignment and safety claims often need stronger real-world and multilingual validation.; Compute-intensive training can limit reproducibility and concentrate follow-up work around a small number of institutions.",https://doi.org/10.1109/ICRA48891.2023.10160591,https://www.semanticscholar.org/paper/91deaf9d324c8feafc189da0da03e60a60287bca,https://arxiv.org/pdf/2209.07753,10.1109/ICRA48891.2023.10160591,2209.07753,,252355542,Computer Science,JournalArticle; Conference,large language models; natural language processing,2,citations=1604; influential=110; survey/benchmark signal; resource signal; open PDF metadata; title AI matches=1; AI term matches=4; query hits=2,"Large language models (LLMs) trained on code-completion have been shown to be capable of synthesizing simple Python programs from docstrings [1]. We find that these code-writing LLMs can be re-purposed to write robot policy code, given natural language commands. Specifically, policy code can express functions or feedback loops that process perception outputs (e.g., from object detectors [2], [3]) and parameterize control primitive APIs. When provided as input several example language commands (formatted as comments) followed by corresponding policy code (via few-shot prompting), LLMs can take in new commands and autonomously re-compose API calls to generate new policy code respectively. By chaining classic logic structures and referencing third-party libraries (e.g., NumPy, Shapely) to perform arithmetic, LLMs used in this way can write robot policies that (i) exhibit spatial-geometric reasoning, (ii) generalize to new instructions, and (iii) prescribe precise values (e.g., velocities) to ambiguous descriptions (‘faster’) depending on context (i.e., behavioral commonsense). This paper presents Code as Policies: a robot-centric formulation of language model generated programs (LMPs) that can represent reactive policies (e.g., impedance controllers), as well as waypoint-based policies (vision-based pick and place, trajectory-based control), demonstrated across multiple real robot platforms. Central to our approach is prompting hierarchical code-gen (recursively defining undefined functions), which can write more complex code and also improves state-of-the-art to solve 39.8% of problems on the HumanEval [1] benchmark. Code and videos are available at https://code-as-policies.github.io"
301,53,53,2022,Model soups: averaging weights of multiple fine-tuned models improves accuracy without increasing inference time,"Mitchell Wortsman, Gabriel Ilharco, S. Gadre, R. Roelofs, Raphael Gontijo-Lopes, Ari S. Morcos, Hongseok Namkoong, Ali Farhadi, et al.",International Conference on Machine Learning,2022-03-10,1569,192,256.572,Vision and Multimodal Learning,transformer,multimodal; nlp; vision,"The conventional recipe for maximizing model accuracy is to (1) train multiple models with various hyperparameters and (2) pick the individual model which performs best on a held-out validation set, discarding the remainder.","high citation signal (1,569); influential citation signal (192); recognized venue; open-access PDF metadata","Large-scale benchmark success can overstate robustness under distribution shift, rare classes, and real deployment constraints.; Multimodal alignment may inherit biases and spurious correlations from web-scale data.; High-performing systems often require data and compute resources that are hard for smaller labs to reproduce.",https://doi.org/10.48550/arXiv.2203.05482,https://www.semanticscholar.org/paper/54020e5fe48ebb250f27d744e20a63cac2988a84,http://arxiv.org/pdf/2203.05482,10.48550/arXiv.2203.05482,2203.05482,,247362886,Computer Science,JournalArticle; Conference,large language models; natural language processing,2,citations=1569; influential=192; recognized venue; resource signal; open PDF metadata; AI term matches=5; query hits=2,"The conventional recipe for maximizing model accuracy is to (1) train multiple models with various hyperparameters and (2) pick the individual model which performs best on a held-out validation set, discarding the remainder. In this paper, we revisit the second step of this procedure in the context of fine-tuning large pre-trained models, where fine-tuned models often appear to lie in a single low error basin. We show that averaging the weights of multiple models fine-tuned with different hyperparameter configurations often improves accuracy and robustness. Unlike a conventional ensemble, we may average many models without incurring any additional inference or memory costs -- we call the results""model soups.""When fine-tuning large pre-trained models such as CLIP, ALIGN, and a ViT-G pre-trained on JFT, our soup recipe provides significant improvements over the best model in a hyperparameter sweep on ImageNet. The resulting ViT-G model, which attains 90.94% top-1 accuracy on ImageNet, achieved a new state of the art. Furthermore, we show that the model soup approach extends to multiple image classification and natural language processing tasks, improves out-of-distribution performance, and improves zero-shot performance on new downstream tasks. Finally, we analytically relate the performance similarity of weight-averaging and logit-ensembling to flatness of the loss and confidence of the predictions, and validate this relation empirically. Code is available at https://github.com/mlfoundations/model-soups."
305,54,54,2022,Particle Swarm Optimization Algorithm and Its Applications: A Systematic Review,Ahmed G. Gad,Archives of Computational Methods in Engineering,2022-04-19,1564,32,217.775,"Graph Learning, Recommendation, and Core Methods",survey/review,graph-learning,"Throughout the centuries, nature has been a source of inspiration, with much still to learn from and discover about.","high citation signal (1,564); influential citation signal (32); open-access PDF metadata","Graph and recommender benchmarks can contain temporal leakage, popularity bias, or unrealistic train/test splits.; Algorithmic gains may be sensitive to hyperparameter budgets and implementation details.; Core methods need careful ablations before broad claims about generality or efficiency are accepted.",https://doi.org/10.1007/s11831-021-09694-4,https://www.semanticscholar.org/paper/a154a3fd60e1d47cfdadd9f2f310bd86cb9b6d20,https://link.springer.com/content/pdf/10.1007/s11831-021-09694-4.pdf,10.1007/s11831-021-09694-4,,,248274842,Computer Science,Review,artificial intelligence,1,citations=1564; influential=32; survey/benchmark signal; open PDF metadata; AI term matches=1,"Throughout the centuries, nature has been a source of inspiration, with much still to learn from and discover about. Among many others, Swarm Intelligence (SI), a substantial branch of Artificial Intelligence, is built on the intelligent collective behavior of social swarms in nature. One of the most popular SI paradigms, the Particle Swarm Optimization algorithm (PSO), is presented in this work. Many changes have been made to PSO since its inception in the mid 1990s. Since their learning about the technique, researchers and practitioners have developed new applications, derived new versions, and published theoretical studies on the potential influence of various parameters and aspects of the algorithm. Various perspectives are surveyed in this paper on existing and ongoing research, including algorithm methods, diverse application domains, open issues, and future perspectives, based on the Systematic Review (SR) process. More specifically, this paper analyzes the existing research on methods and applications published between 2017 and 2019 in a technical taxonomy of the picked content, including hybridization, improvement, and variants of PSO, as well as real-world applications of the algorithm categorized into: health-care, environmental, industrial, commercial, smart city, and general aspects applications. Some technical characteristics, including accuracy, evaluation environments, and proposed case study are involved to investigate the effectiveness of different PSO methods and applications. Each addressed study has some valuable advantages and unavoidable drawbacks which are discussed and has accordingly yielded some hints presented for addressing the weaknesses of those studies and highlighting the open issues and future research perspectives on the algorithm."
319,55,55,2022,Scaling Autoregressive Models for Content-Rich Text-to-Image Generation,"Jiahui Yu, Yuanzhong Xu, Jing Yu Koh, Thang Luong, Gunjan Baid, Zirui Wang, Vijay Vasudevan, Alexander Ku, et al.",Trans. Mach. Learn. Res.,2022-06-22,1516,114,241.568,Foundation Models and Large Language Models,benchmark/dataset; transformer; generative,foundation-models; generative-ai; nlp; vision,"We present the Pathways Autoregressive Text-to-Image (Parti) model, which generates high-fidelity photorealistic images and supports content-rich synthesis involving complex compositions and world knowledge.","high citation signal (1,516); influential citation signal (114); open-access PDF metadata","Capability gains are difficult to separate from data scale, benchmark leakage, and evaluation prompt sensitivity.; Alignment and safety claims often need stronger real-world and multilingual validation.; Compute-intensive training can limit reproducibility and concentrate follow-up work around a small number of institutions.",https://doi.org/10.48550/arXiv.2206.10789,https://www.semanticscholar.org/paper/1243e13254bb4ea1f71b4be8a3e4e54ffd02d2fe,https://arxiv.org/pdf/2206.10789,10.48550/arXiv.2206.10789,2206.10789,,249926846,Computer Science,JournalArticle,large language models,1,citations=1516; influential=114; survey/benchmark signal; resource signal; open PDF metadata; AI term matches=5,"We present the Pathways Autoregressive Text-to-Image (Parti) model, which generates high-fidelity photorealistic images and supports content-rich synthesis involving complex compositions and world knowledge. Parti treats text-to-image generation as a sequence-to-sequence modeling problem, akin to machine translation, with sequences of image tokens as the target outputs rather than text tokens in another language. This strategy can naturally tap into the rich body of prior work on large language models, which have seen continued advances in capabilities and performance through scaling data and model sizes. Our approach is simple: First, Parti uses a Transformer-based image tokenizer, ViT-VQGAN, to encode images as sequences of discrete tokens. Second, we achieve consistent quality improvements by scaling the encoder-decoder Transformer model up to 20B parameters, with a new state-of-the-art zero-shot FID score of 7.23 and finetuned FID score of 3.22 on MS-COCO. Our detailed analysis on Localized Narratives as well as PartiPrompts (P2), a new holistic benchmark of over 1600 English prompts, demonstrate the effectiveness of Parti across a wide variety of categories and difficulty aspects. We also explore and highlight limitations of our models in order to define and exemplify key areas of focus for further improvements. See https://parti.research.google/ for high-resolution images."
323,56,56,2022,CodeGen: An Open Large Language Model for Code with Multi-Turn Program Synthesis,"Erik Nijkamp, Bo Pang, Hiroaki Hayashi, Lifu Tu, Haiquan Wang, Yingbo Zhou, S. Savarese, Caiming Xiong",International Conference on Learning Representations,2022-03-25,1505,135,246.756,Foundation Models and Large Language Models,benchmark/dataset,foundation-models; nlp,"Program synthesis strives to generate a computer program as a solution to a given problem specification, expressed with input-output examples or natural language descriptions.","high citation signal (1,505); influential citation signal (135)","Capability gains are difficult to separate from data scale, benchmark leakage, and evaluation prompt sensitivity.; Alignment and safety claims often need stronger real-world and multilingual validation.; Compute-intensive training can limit reproducibility and concentrate follow-up work around a small number of institutions.",https://www.semanticscholar.org/paper/38115e80d805fb0fb8f090dc88ced4b24be07878,https://www.semanticscholar.org/paper/38115e80d805fb0fb8f090dc88ced4b24be07878,,,2203.13474,,252668917,Computer Science,JournalArticle,large language models,1,citations=1505; influential=135; survey/benchmark signal; resource signal; open PDF metadata; title AI matches=2; AI term matches=4,"Program synthesis strives to generate a computer program as a solution to a given problem specification, expressed with input-output examples or natural language descriptions. The prevalence of large language models advances the state-of-the-art for program synthesis, though limited training resources and data impede open access to such models. To democratize this, we train and release a family of large language models up to 16.1B parameters, called CODEGEN, on natural language and programming language data, and open source the training library JAXFORMER. We show the utility of the trained model by demonstrating that it is competitive with the previous state-of-the-art on zero-shot Python code generation on HumanEval. We further investigate the multi-step paradigm for program synthesis, where a single program is factorized into multiple prompts specifying subproblems. To this end, we construct an open benchmark, Multi-Turn Programming Benchmark (MTPB), consisting of 115 diverse problem sets that are factorized into multi-turn prompts. Our analysis on MTPB shows that the same intent provided to CODEGEN in multi-turn fashion significantly improves program synthesis over that provided as a single turn. We make the training library JAXFORMER and model checkpoints available as open source contribution: https://github.com/salesforce/CodeGen."
