rank,yearRank,candidateRank,year,title,authors,venue,publicationDate,citationCount,influentialCitationCount,importanceScore,category,methodTags,keywordTags,keyIdea,strengths,limitations,url,semanticScholarUrl,openAccessPdf,githubUrl,doi,arxiv,pubmed,corpusId,fieldsOfStudy,publicationTypes,sourceQueries,queryHitCount,importanceReasons,abstract
466,45,45,2015,Teaching Machines to Read and Comprehend,"Karl Moritz Hermann, Tomás Kociský, Edward Grefenstette, L. Espeholt, W. Kay, Mustafa Suleyman, Phil Blunsom",Neural Information Processing Systems,2015-06-10,3858,490,271.43,Natural Language Processing and Knowledge,transformer,nlp; github,Teaching machines to read natural language documents remains an elusive challenge.,"high citation signal (3,858); influential citation signal (490)","Benchmark scores can hide brittle reasoning, retrieval failures, hallucination, and domain transfer issues.; Language coverage is often uneven, with English and high-resource domains overrepresented.; Evaluation can be sensitive to annotation protocols, prompt wording, and changing model APIs.",https://www.semanticscholar.org/paper/d1505c6123c102e53eb19dff312cb25cea840b72,https://www.semanticscholar.org/paper/d1505c6123c102e53eb19dff312cb25cea840b72,,https://github.com/deepmind/rc-data,,1506.03340,,6203757,Computer Science; Linguistics,JournalArticle; Conference,neural networks,1,citations=3858; influential=490; open PDF metadata; AI term matches=2,"Teaching machines to read natural language documents remains an elusive challenge. Machine reading systems can be tested on their ability to answer questions posed on the contents of documents that they have seen, but until now large scale training and test datasets have been missing for this type of evaluation. In this work we define a new methodology that resolves this bottleneck and provides large scale supervised reading comprehension data. This allows us to develop a class of attention based deep neural networks that learn to read real documents and answer complex questions with minimal prior knowledge of language structure."
475,46,46,2015,End-to-End Training of Deep Visuomotor Policies,"S. Levine, Chelsea Finn, Trevor Darrell, P. Abbeel",Journal of machine learning research,2015-04-02,3816,111,265.498,Reinforcement Learning and Agents,ai4science; reinforcement-learning,machine-learning; vision; reinforcement-learning,"Policy search methods can allow robots to learn control policies for a wide range of tasks, but practical applications of policy search often require hand-engineered components for perception, state estimation, and low-level control.","high citation signal (3,816); influential citation signal (111); recognized venue","Sample efficiency, reward misspecification, simulator bias, and safety under exploration remain persistent barriers.; Benchmark performance may not transfer to physical robots, human-facing tools, or open-ended environments.; Agentic systems need stronger evidence on reliability, recovery from errors, and long-horizon oversight.",https://doi.org/10.5555/2946645.2946684,https://www.semanticscholar.org/paper/b6b8a1b80891c96c28cc6340267b58186157e536,,,10.5555/2946645.2946684,1504.00702,,7242892,Computer Science; Engineering; Mathematics,JournalArticle,deep learning; neural networks; reinforcement learning,3,citations=3816; influential=111; recognized venue; open PDF metadata; AI term matches=4; query hits=3,"Policy search methods can allow robots to learn control policies for a wide range of tasks, but practical applications of policy search often require hand-engineered components for perception, state estimation, and low-level control. In this paper, we aim to answer the following question: does training the perception and control systems jointly end-to-end provide better performance than training each component separately? To this end, we develop a method that can be used to learn policies that map raw image observations directly to torques at the robot's motors. The policies are represented by deep convolutional neural networks (CNNs) with 92,000 parameters, and are trained using a partially observed guided policy search method, which transforms policy search into supervised learning, with supervision provided by a simple trajectory-centric reinforcement learning method. We evaluate our method on a range of real-world manipulation tasks that require close coordination between vision and control, such as screwing a cap onto a bottle, and present simulated comparisons to a range of prior policy search methods."
491,47,47,2015,VoxNet: A 3D Convolutional Neural Network for real-time object recognition,"D. Maturana, S. Scherer",IEEE/RJS International Conference on Intelligent RObots and Systems,2015-09-01,3694,283,263.81,Reinforcement Learning and Agents,metadata-ranked,machine-learning,Positions VoxNet: A 3D Convolutional Neural Network for real-time object recognition within Reinforcement Learning and Agents.,"high citation signal (3,694); influential citation signal (283)","Sample efficiency, reward misspecification, simulator bias, and safety under exploration remain persistent barriers.; Benchmark performance may not transfer to physical robots, human-facing tools, or open-ended environments.; Agentic systems need stronger evidence on reliability, recovery from errors, and long-horizon oversight.",https://doi.org/10.1109/IROS.2015.7353481,https://www.semanticscholar.org/paper/3f1c6749edfaf4f89bac38b2d15a0493bd9aa253,,,10.1109/IROS.2015.7353481,,,14620252,Computer Science; Engineering,JournalArticle; Conference,neural networks,1,citations=3694; influential=283; open PDF metadata; title AI matches=1; AI term matches=1,
504,48,48,2015,Gated Graph Sequence Neural Networks,"Yujia Li, Daniel Tarlow, Marc Brockschmidt, R. Zemel",International Conference on Learning Representations,2015-11-17,3624,385,274.685,"Graph Learning, Recommendation, and Core Methods",graph-learning,machine-learning; nlp; graph-learning,"Abstract: Graph-structured data appears frequently in domains including chemistry, natural language semantics, social networks, and knowledge bases.","high citation signal (3,624); influential citation signal (385)","Graph and recommender benchmarks can contain temporal leakage, popularity bias, or unrealistic train/test splits.; Algorithmic gains may be sensitive to hyperparameter budgets and implementation details.; Core methods need careful ablations before broad claims about generality or efficiency are accepted.",https://www.semanticscholar.org/paper/492f57ee9ceb61fb5a47ad7aebfec1121887a175,https://www.semanticscholar.org/paper/492f57ee9ceb61fb5a47ad7aebfec1121887a175,,,,1511.05493,,8393918,Chemistry; Computer Science; Mathematics,JournalArticle,graph neural networks; neural networks,2,citations=3624; influential=385; open PDF metadata; title AI matches=2; AI term matches=4; query hits=2,"Abstract: Graph-structured data appears frequently in domains including chemistry, natural language semantics, social networks, and knowledge bases. In this work, we study feature learning techniques for graph-structured inputs. Our starting point is previous work on Graph Neural Networks (Scarselli et al., 2009), which we modify to use gated recurrent units and modern optimization techniques and then extend to output sequences. The result is a flexible and broadly useful class of neural network models that has favorable inductive biases relative to purely sequence-based models (e.g., LSTMs) when the problem is graph-structured. We demonstrate the capabilities on some simple AI (bAbI) and graph algorithm learning tasks. We then show it achieves state-of-the-art performance on a problem from program verification, in which subgraphs need to be matched to abstract data structures."
512,49,49,2015,Multi-view Convolutional Neural Networks for 3D Shape Recognition,"Hang Su, Subhransu Maji, E. Kalogerakis, E. Learned-Miller",IEEE International Conference on Computer Vision,2015-05-05,3602,438,275.352,Vision and Multimodal Learning,metadata-ranked,vision,"ding question in computer vision concerns the representation of 3D shapes for recognition: should 3D shapes be represented with descriptors operating on their native 3D formats, such as voxel grid or polygon mesh, or can they be effectively represented with view-based descriptors?","high citation signal (3,602); influential citation signal (438); open-access PDF metadata","Large-scale benchmark success can overstate robustness under distribution shift, rare classes, and real deployment constraints.; Multimodal alignment may inherit biases and spurious correlations from web-scale data.; High-performing systems often require data and compute resources that are hard for smaller labs to reproduce.",https://doi.org/10.1109/ICCV.2015.114,https://www.semanticscholar.org/paper/1ba8376f416e90fe434977ae9f300997667498d2,https://people.cs.umass.edu/%7Eelm/papers/HangSu_3D_arXiv.pdf,,10.1109/ICCV.2015.114,1505.00880,,2407217,Computer Science,JournalArticle; Conference,computer vision; neural networks,2,citations=3602; influential=438; open PDF metadata; title AI matches=2; AI term matches=3; query hits=2,"A longstanding question in computer vision concerns the representation of 3D shapes for recognition: should 3D shapes be represented with descriptors operating on their native 3D formats, such as voxel grid or polygon mesh, or can they be effectively represented with view-based descriptors? We address this question in the context of learning to recognize 3D shapes from a collection of their rendered views on 2D images. We first present a standard CNN architecture trained to recognize the shapes' rendered views independently of each other, and show that a 3D shape can be recognized even from a single view at an accuracy far higher than using state-of-the-art 3D shape descriptors. Recognition rates further increase when multiple views of the shapes are provided. In addition, we present a novel CNN architecture that combines information from multiple views of a 3D shape into a single and compact shape descriptor offering even better recognition performance. The same architecture can be applied to accurately recognize human hand-drawn sketches of shapes. We conclude that a collection of 2D views can be highly informative for 3D shape recognition and is amenable to emerging CNN architectures and their derivatives."
515,50,50,2015,Automatic differentiation in machine learning: a survey,"A. G. Baydin, Barak A. Pearlmutter, Alexey Radul, J. Siskind",Journal of machine learning research,2015-02-20,3585,146,268.931,"Graph Learning, Recommendation, and Core Methods",survey/review,machine-learning,"Derivatives, mostly in the form of gradients and Hessians, are ubiquitous in machine learning.","high citation signal (3,585); influential citation signal (146); recognized venue","Graph and recommender benchmarks can contain temporal leakage, popularity bias, or unrealistic train/test splits.; Algorithmic gains may be sensitive to hyperparameter budgets and implementation details.; Core methods need careful ablations before broad claims about generality or efficiency are accepted.",https://www.semanticscholar.org/paper/643da4c4de1954daeac571a82367241db012a8bf,https://www.semanticscholar.org/paper/643da4c4de1954daeac571a82367241db012a8bf,,,,1502.05767,,3766791,Computer Science; Mathematics,JournalArticle; Review,machine learning,1,citations=3585; influential=146; recognized venue; survey/benchmark signal; open PDF metadata; title AI matches=1; AI term matches=1,"Derivatives, mostly in the form of gradients and Hessians, are ubiquitous in machine learning. Automatic differentiation (AD), also called algorithmic differentiation or simply “auto-diff”, is a family of techniques similar to but more general than backpropagation for efficiently and accurately evaluating derivatives of numeric functions expressed as computer programs. AD is a small but established field with applications in areas including computational fluid dynamics, atmospheric sciences, and engineering design optimization. Until very recently, the fields of machine learning and AD have largely been unaware of each other and, in some cases, have independently discovered each other’s results. Despite its relevance, general-purpose AD has been missing from the machine learning toolbox, a situation slowly changing with its ongoing adoption under the names “dynamic computational graphs” and “differentiable programming”. We survey the intersection of AD and machine learning, cover applications where AD has direct relevance, and address the main imple- mentation techniques. By precisely defining the main differentiation techniques and their interrelationships, we aim to bring clarity to the usage of the terms “autodiff”, “automatic differentiation”, and “symbolic differentiation” as these are encountered more and more in machine learning settings."
536,51,51,2015,Unsupervised Deep Embedding for Clustering Analysis,"Junyuan Xie, Ross B. Girshick, Ali Farhadi",International Conference on Machine Learning,2015-11-19,3458,622,288.356,Vision and Multimodal Learning,metadata-ranked,machine-learning; nlp; vision; github,Clustering is central to many data-driven application domains and has been studied extensively in terms of distance functions and grouping algorithms.,"high citation signal (3,458); influential citation signal (622); recognized venue","Large-scale benchmark success can overstate robustness under distribution shift, rare classes, and real deployment constraints.; Multimodal alignment may inherit biases and spurious correlations from web-scale data.; High-performing systems often require data and compute resources that are hard for smaller labs to reproduce.",https://www.semanticscholar.org/paper/f44ff4fc0ed0142cb18472a5ba421bb538aa837e,https://www.semanticscholar.org/paper/f44ff4fc0ed0142cb18472a5ba421bb538aa837e,,https://github.com/piiswrong/dec,,1511.06335,,6779105,Computer Science; Mathematics,JournalArticle; Conference,deep learning; neural networks,2,citations=3458; influential=622; recognized venue; open PDF metadata; title AI matches=1; AI term matches=4; query hits=2,"Clustering is central to many data-driven application domains and has been studied extensively in terms of distance functions and grouping algorithms. Relatively little work has focused on learning representations for clustering. In this paper, we propose Deep Embedded Clustering (DEC), a method that simultaneously learns feature representations and cluster assignments using deep neural networks. DEC learns a mapping from the data space to a lower-dimensional feature space in which it iteratively optimizes a clustering objective. Our experimental evaluations on image and text corpora show significant improvement over state-of-the-art methods."
559,52,52,2015,Privacy Preserving Data Mining,"J. Vaidya, Yu Zhu, C. Clifton",Advances in Information Security,2015-03-15,3338,203,271.949,"Trustworthy, Explainable, and Responsible AI",benchmark/dataset; trustworthy-ai,machine-learning; trustworthy-ai,Recent interest in data collection and monitoring using data mining for security and business-related applications has raised privacy.,"high citation signal (3,338); influential citation signal (203); open-access PDF metadata","Explanations can be persuasive without being faithful to model internals or decision processes.; Fairness, robustness, privacy, and safety metrics can conflict and require domain-specific tradeoffs.; Responsible AI results often need stronger deployment evidence beyond benchmark or synthetic settings.",https://doi.org/10.1007/978-0-387-29489-6,https://www.semanticscholar.org/paper/123d00c6a664ea6d4da57d0d89d980dd02347c79,https://www.maxwellsci.com/announce/RJASET/9-616-621.pdf,,10.1007/978-0-387-29489-6,,,657888,Business; Computer Science,,data mining,1,citations=3338; influential=203; survey/benchmark signal; resource signal; translation/trustworthiness signal; open PDF metadata; title AI matches=2; AI term matches=3,Recent interest in data collection and monitoring using data mining for security and business-related applications has raised privacy. Privacy Preserving Data Mining (PPDM) techniques require data modification to disinfect them from sensitive information or to anonymize them at an uncertainty level. This study uses PPDM with adult dataset to investigate effects of K-anonymization for evaluation metrics. This study uses Artificial Bee Colony (ABC) algorithm for feature generalization and suppression where features are removed without affecting classification accuracy. Also k-anonymity is accomplished by original dataset generalization.
567,53,53,2015,Distillation as a Defense to Adversarial Perturbations Against Deep Neural Networks,"Nicolas Papernot, P. Mcdaniel, Xi Wu, S. Jha, A. Swami",IEEE Symposium on Security and Privacy,2015-11-14,3299,202,272.622,"Trustworthy, Explainable, and Responsible AI",trustworthy-ai,machine-learning; trustworthy-ai,Deep learning algorithms have been shown to perform extremely well on many classical machine learning problems.,"high citation signal (3,299); influential citation signal (202); open-access PDF metadata","Explanations can be persuasive without being faithful to model internals or decision processes.; Fairness, robustness, privacy, and safety metrics can conflict and require domain-specific tradeoffs.; Responsible AI results often need stronger deployment evidence beyond benchmark or synthetic settings.",https://doi.org/10.1109/SP.2016.41,https://www.semanticscholar.org/paper/6adf016e7531c91100d3cf4a74f5d4c87b26b528,http://arxiv.org/pdf/1511.04508,,10.1109/SP.2016.41,1511.04508,,2672720,Computer Science; Mathematics,JournalArticle,deep learning; machine learning; neural networks,3,citations=3299; influential=202; translation/trustworthiness signal; open PDF metadata; title AI matches=3; AI term matches=7; query hits=3,"Deep learning algorithms have been shown to perform extremely well on many classical machine learning problems. However, recent studies have shown that deep learning, like other machine learning techniques, is vulnerable to adversarial samples: inputs crafted to force a deep neural network (DNN) to provide adversary-selected outputs. Such attacks can seriously undermine the security of the system supported by the DNN, sometimes with devastating consequences. For example, autonomous vehicles can be crashed, illicit or illegal content can bypass content filters, or biometric authentication systems can be manipulated to allow improper access. In this work, we introduce a defensive mechanism called defensive distillation to reduce the effectiveness of adversarial samples on DNNs. We analytically investigate the generalizability and robustness properties granted by the use of defensive distillation when training DNNs. We also empirically study the effectiveness of our defense mechanisms on two DNNs placed in adversarial settings. The study shows that defensive distillation can reduce effectiveness of sample creation from 95% to less than 0.5% on a studied DNN. Such dramatic gains can be explained by the fact that distillation leads gradients used in adversarial sample creation to be reduced by a factor of 1030. We also find that distillation increases the average minimum number of features that need to be modified to create adversarial samples by about 800% on one of the DNNs we tested."
578,54,54,2015,Improved Semantic Representations From Tree-Structured Long Short-Term Memory Networks,"Kai Sheng Tai, R. Socher, Christopher D. Manning",Annual Meeting of the Association for Computational Linguistics,2015-02-27,3254,438,266.118,Natural Language Processing and Knowledge,metadata-ranked,machine-learning; nlp; github,"Because of their superior ability to preserve sequence information over time, Long Short-Term Memory (LSTM) networks, a type of recurrent neural network with a more complex computational unit, have obtained strong results on a variety of sequence modeling tasks.","high citation signal (3,254); influential citation signal (438); open-access PDF metadata","Benchmark scores can hide brittle reasoning, retrieval failures, hallucination, and domain transfer issues.; Language coverage is often uneven, with English and high-resource domains overrepresented.; Evaluation can be sensitive to annotation protocols, prompt wording, and changing model APIs.",https://doi.org/10.3115/v1/P15-1150,https://www.semanticscholar.org/paper/32de44f01a96d4473d21099d15e25bc2b9f08e2f,https://aclanthology.org/P15-1150.pdf,https://github.com/stanfordnlp/treelstm,10.3115/v1/P15-1150,1503.00075,,3033526,Computer Science,JournalArticle; Conference,neural networks,1,citations=3254; influential=438; open PDF metadata; AI term matches=2,"Because of their superior ability to preserve sequence information over time, Long Short-Term Memory (LSTM) networks, a type of recurrent neural network with a more complex computational unit, have obtained strong results on a variety of sequence modeling tasks. The only underlying LSTM structure that has been explored so far is a linear chain. However, natural language exhibits syntactic properties that would naturally combine words to phrases. We introduce the Tree-LSTM, a generalization of LSTMs to tree-structured network topologies. Tree-LSTMs outperform all existing systems and strong LSTM baselines on two tasks: predicting the semantic relatedness of two sentences (SemEval 2014, Task 1) and sentiment classification (Stanford Sentiment Treebank)."
587,55,55,2015,BinaryConnect: Training Deep Neural Networks with binary weights during propagations,"Matthieu Courbariaux, Yoshua Bengio, J. David",Neural Information Processing Systems,2015-11-02,3227,318,268.464,General AI Methods and Systems,metadata-ranked,machine-learning; github,"Deep Neural Networks (DNN) have achieved state-of-the-art results in a wide range of tasks, with the best results obtained with large training sets and large models.","high citation signal (3,227); influential citation signal (318)","Survey and infrastructure papers can dominate citations while empirical evidence remains distributed across subfields.; Broad claims need careful mapping to specific tasks, datasets, and operational constraints.; Metadata-driven ranking cannot replace expert reading of full papers and experimental details.",https://www.semanticscholar.org/paper/a5733ff08daff727af834345b9cfff1d0aa109ec,https://www.semanticscholar.org/paper/a5733ff08daff727af834345b9cfff1d0aa109ec,,https://github.com/MatthieuCourbariaux/BinaryConnect,,1511.00363,,1518846,Computer Science; Engineering; Mathematics,JournalArticle; Conference,deep learning; neural networks,2,citations=3227; influential=318; open PDF metadata; title AI matches=2; AI term matches=3; query hits=2,"Deep Neural Networks (DNN) have achieved state-of-the-art results in a wide range of tasks, with the best results obtained with large training sets and large models. In the past, GPUs enabled these breakthroughs because of their greater computational speed. In the future, faster computation at both training and test time is likely to be crucial for further progress and for consumer applications on low-power devices. As a result, there is much interest in research and development of dedicated hardware for Deep Learning (DL). Binary weights, i.e., weights which are constrained to only two possible values (e.g. -1 or 1), would bring great benefits to specialized DL hardware by replacing many multiply-accumulate operations by simple accumulations, as multipliers are the most space and power-hungry components of the digital implementation of neural networks. We introduce BinaryConnect, a method which consists in training a DNN with binary weights during the forward and backward propagations, while retaining precision of the stored weights in which gradients are accumulated. Like other dropout schemes, we show that BinaryConnect acts as regularizer and we obtain near state-of-the-art results with BinaryConnect on the permutation-invariant MNIST, CIFAR-10 and SVHN."
