rank,yearRank,candidateRank,year,title,authors,venue,publicationDate,citationCount,influentialCitationCount,importanceScore,category,methodTags,keywordTags,keyIdea,strengths,limitations,url,semanticScholarUrl,openAccessPdf,doi,arxiv,pubmed,corpusId,fieldsOfStudy,publicationTypes,sourceQueries,queryHitCount,importanceReasons,abstract
1666,31,31,2008,Hierarchical Models in the Brain,Karl J. Friston,PLoS Comput. Biol.,2008-11-01,944,87,221.409,Generative Models and Synthetic Media,survey/review; generative,machine-learning; generative-ai,This paper describes a general model that subsumes many parametric models for continuous data.,high citation signal (944); influential citation signal (87); open-access PDF metadata,"Image and media quality metrics may not capture factuality, controllability, provenance, or downstream harms.; Training data provenance and copyright constraints can be under-specified in highly cited generation work.; Robust evaluation across cultures, modalities, and adversarial uses remains difficult.",https://doi.org/10.1371/journal.pcbi.1000211,https://www.semanticscholar.org/paper/1a014a076cac3c7f5d81a084e296c095f9230437,https://journals.plos.org/ploscompbiol/article/file?id=10.1371/journal.pcbi.1000211&type=printable,10.1371/journal.pcbi.1000211,,18989391,13942547,Computer Science; Medicine,JournalArticle; Review,neural networks,1,citations=944; influential=87; survey/benchmark signal; open PDF metadata; AI term matches=2,"This paper describes a general model that subsumes many parametric models for continuous data. The model comprises hidden layers of state-space or dynamic causal models, arranged so that the output of one provides input to another. The ensuing hierarchy furnishes a model for many types of data, of arbitrary complexity. Special cases range from the general linear model for static data to generalised convolution models, with system noise, for nonlinear time-series analysis. Crucially, all of these models can be inverted using exactly the same scheme, namely, dynamic expectation maximization. This means that a single model and optimisation scheme can be used to invert a wide range of models. We present the model and a brief review of its inversion to disclose the relationships among, apparently, diverse generative models of empirical data. We then show that this inversion can be formulated as a simple neural network and may provide a useful metaphor for inference and learning in the brain."
1677,32,32,2008,Artificial intelligence techniques for photovoltaic applications: A review,"A. Mellit, S. Kalogirou",,2008-10-01,936,26,205.681,General AI Methods and Systems,survey/review,machine-learning,Positions Artificial intelligence techniques for photovoltaic applications: A review within General AI Methods and Systems.,high citation signal (936); influential citation signal (26),"Survey and infrastructure papers can dominate citations while empirical evidence remains distributed across subfields.; Broad claims need careful mapping to specific tasks, datasets, and operational constraints.; Metadata-driven ranking cannot replace expert reading of full papers and experimental details.",https://doi.org/10.1016/J.PECS.2008.01.001,https://www.semanticscholar.org/paper/f86b88e3eb0df51c9846512094b7562891c903ba,,10.1016/J.PECS.2008.01.001,,,110201854,Computer Science; Engineering; Environmental Science,Review,artificial intelligence,1,citations=936; influential=26; survey/benchmark signal; open PDF metadata; title AI matches=1; AI term matches=1,
1681,33,33,2008,Intelligent heart disease prediction system using data mining techniques,"S. Palaniappan, Rafiah Awang",2008 IEEE/ACS International Conference on Computer Systems and Applications,2008-03-31,932,37,207.371,General AI Methods and Systems,metadata-ranked,machine-learning,Positions Intelligent heart disease prediction system using data mining techniques within General AI Methods and Systems.,high citation signal (932); influential citation signal (37); open-access PDF metadata,"Survey and infrastructure papers can dominate citations while empirical evidence remains distributed across subfields.; Broad claims need careful mapping to specific tasks, datasets, and operational constraints.; Metadata-driven ranking cannot replace expert reading of full papers and experimental details.",https://doi.org/10.1109/AICCSA.2008.4493524,https://www.semanticscholar.org/paper/0a957fe9df02e59df12dfb568b22db5d9639cf4f,http://paper.ijcsns.org/07_book/200808/20080849.pdf?origin%3Dpublication_detail,10.1109/AICCSA.2008.4493524,,,17154699,Computer Science; Medicine,JournalArticle; Conference,data mining; neural networks,2,citations=932; influential=37; open PDF metadata; title AI matches=1; AI term matches=1; query hits=2,
1718,34,34,2008,MPCA: Multilinear Principal Component Analysis of Tensor Objects,"Haiping Lu, K. Plataniotis, A. Venetsanopoulos",IEEE Transactions on Neural Networks,,904,156,235.562,General AI Methods and Systems,metadata-ranked,machine-learning,Positions MPCA: Multilinear Principal Component Analysis of Tensor Objects within General AI Methods and Systems.,high citation signal (904); influential citation signal (156); recognized venue; open-access PDF metadata,"Survey and infrastructure papers can dominate citations while empirical evidence remains distributed across subfields.; Broad claims need careful mapping to specific tasks, datasets, and operational constraints.; Metadata-driven ranking cannot replace expert reading of full papers and experimental details.",https://doi.org/10.1109/TNN.2007.901277,https://www.semanticscholar.org/paper/74d381155143ec50a2de65769f16e54708f886c1,http://www.dsp.toronto.edu/~haiping/Publication/MPCA_TNN07.pdf,10.1109/TNN.2007.901277,,18269936,2082042,Computer Science; Mathematics; Medicine,JournalArticle,computer vision; pattern recognition,2,citations=904; influential=156; recognized venue; open PDF metadata; AI term matches=2; query hits=2,
1741,35,35,2008,Particle swarm optimization for parameter determination and feature selection of support vector machines,"Shih-Wei Lin, Kuo-Ching Ying, Shih-Chieh Chen, Z. Lee",Expert systems with applications,2008-11-01,886,44,206.626,"Graph Learning, Recommendation, and Core Methods",metadata-ranked,machine-learning,"Positions Particle swarm optimization for parameter determination and feature selection of support vector machines within Graph Learning, Recommendation, and Core Methods.",high citation signal (886); influential citation signal (44),"Graph and recommender benchmarks can contain temporal leakage, popularity bias, or unrealistic train/test splits.; Algorithmic gains may be sensitive to hyperparameter budgets and implementation details.; Core methods need careful ablations before broad claims about generality or efficiency are accepted.",https://doi.org/10.1016/j.eswa.2007.08.088,https://www.semanticscholar.org/paper/48732e566f1027b5dcc1e037fb0058a31acab438,,10.1016/j.eswa.2007.08.088,,,5628229,Computer Science; Mathematics,JournalArticle,support vector machines,1,citations=886; influential=44; open PDF metadata; title AI matches=1; AI term matches=1,
1745,36,36,2008,Neuroeconomics,"P. Glimcher, Colin Camerer, E. Fehr, R. Poldrack",Scholarpedia,,884,34,207.058,Generative Models and Synthetic Media,survey/review; generative; reinforcement-learning,generative-ai; reinforcement-learning,"Neuroeconomics is a young, interdisciplinary field dealing with the neurobiology of decision making and how it affects cognitive social interactions between humans and societies/economies.",high citation signal (884); influential citation signal (34); open-access PDF metadata,"Image and media quality metrics may not capture factuality, controllability, provenance, or downstream harms.; Training data provenance and copyright constraints can be under-specified in highly cited generation work.; Robust evaluation across cultures, modalities, and adversarial uses remains difficult.",https://doi.org/10.4249/scholarpedia.1759,https://www.semanticscholar.org/paper/b9a53832a8cbd726bca4c04d65b639ca765d25a0,https://doi.org/10.4249/scholarpedia.1759,10.4249/scholarpedia.1759,,,115600718,Computer Science; Economics; Psychology,JournalArticle; Review,reinforcement learning,1,citations=884; influential=34; survey/benchmark signal; open PDF metadata; AI term matches=2,"Neuroeconomics is a young, interdisciplinary field dealing with the neurobiology of decision making and how it affects cognitive social interactions between humans and societies/economies. It studies how economic behavior can shape our understanding of the brain, and how neuroscientific discoveries can constrain and guide models of economics. Neuroeconomics studies decision making by using a combination of tools from neuroscience, economics and psychology to avoid the shortcoming that arise from a single perspective approach. Offering the necessary interdisciplinary approach, ""Neuroeconomics ""2nd edition presents research from neuroscience, psychology, and behavioral economics. Edited by two of the founders of the field, this edition once again offers a current and comprehensive review of the field. With chapters authored by all the major figures, this new edition will serve to advance understanding of the following as related to the human brain through neoclassical economic approaches, behavioral economics, social decision making, valuation, and neural mechanism for choice. Editors and contributing authors are among the acknowledged experts and founders in the field, making this the authoritative reference for neuroeconomicsSuitable as an advanced undergraduate or graduate textbook as well as a thorough reference for active researchersIntroductory chapters on economics, psychology, neuroscience, and anthropology provide students and scholars from any discipline with the keys to understanding this interdisciplinary fieldDetailed chapters on subjects that include reinforcement learning, risk, inter-temporal choice, drift-diffusion models, game theory, and prospect theory make this an invaluable reference Published in association with the Society for Neuroeconomicswww.neuroeconomics.orgFull-color presentation throughout with numerous carefully selected illustrations to highlight key concepts"
1771,37,37,2008,Predictive data mining in clinical medicine: Current issues and guidelines,"R. Bellazzi, B. Zupan",Int. J. Medical Informatics,2008-02-01,867,32,209.807,"AI for Science, Healthcare, and Robotics",survey/review; ai4science,machine-learning; ai4science,BACKGROUND The widespread availability of new computational methods and tools for data analysis and predictive modeling requires medical informatics researchers and practitioners to systematically select the most appropriate strategy to cope with clinical prediction problems.,high citation signal (867); influential citation signal (32); open-access PDF metadata,"External validation, prospective testing, and domain expert review are often more important than retrospective benchmark scores.; Clinical, biological, or robotic deployment can fail when data collection protocols differ from training assumptions.; Safety, interpretability, uncertainty, and regulatory evidence remain essential for translation.",https://doi.org/10.1016/j.ijmedinf.2006.11.006,https://www.semanticscholar.org/paper/900876aa169e55b836411137c40efecb86fc50f2,http://eprints.fri.uni-lj.si/994/1/2008%2DIJMI%2DBellazziZupan.pdf,10.1016/j.ijmedinf.2006.11.006,,17188928,1358050,Computer Science; Medicine,Review; JournalArticle,data mining,1,citations=867; influential=32; survey/benchmark signal; translation/trustworthiness signal; open PDF metadata; title AI matches=1; AI term matches=1,"BACKGROUND The widespread availability of new computational methods and tools for data analysis and predictive modeling requires medical informatics researchers and practitioners to systematically select the most appropriate strategy to cope with clinical prediction problems. In particular, the collection of methods known as 'data mining' offers methodological and technical solutions to deal with the analysis of medical data and construction of prediction models. A large variety of these methods requires general and simple guidelines that may help practitioners in the appropriate selection of data mining tools, construction and validation of predictive models, along with the dissemination of predictive models within clinical environments. PURPOSE The goal of this review is to discuss the extent and role of the research area of predictive data mining and to propose a framework to cope with the problems of constructing, assessing and exploiting data mining models in clinical medicine. METHODS We review the recent relevant work published in the area of predictive data mining in clinical medicine, highlighting critical issues and summarizing the approaches in a set of learned lessons. RESULTS The paper provides a comprehensive review of the state of the art of predictive data mining in clinical medicine and gives guidelines to carry out data mining studies in this field. CONCLUSIONS Predictive data mining is becoming an essential instrument for researchers and clinical practitioners in medicine. Understanding the main issues underlying these methods and the application of agreed and standardized procedures is mandatory for their deployment and the dissemination of results. Thanks to the integration of molecular and clinical data taking place within genomic medicine, the area has recently not only gained a fresh impulse but also a new set of complex problems it needs to address."
1783,38,38,2008,Spatio-temporal Saliency detection using phase spectrum of quaternion fourier transform,"Chenlei Guo, Qi Ma, Liming Zhang",2008 IEEE Conference on Computer Vision and Pattern Recognition,2008-06-23,856,106,226.995,Vision and Multimodal Learning,metadata-ranked,machine-learning; vision,Positions Spatio-temporal Saliency detection using phase spectrum of quaternion fourier transform within Vision and Multimodal Learning.,high citation signal (856); influential citation signal (106); recognized venue,"Large-scale benchmark success can overstate robustness under distribution shift, rare classes, and real deployment constraints.; Multimodal alignment may inherit biases and spurious correlations from web-scale data.; High-performing systems often require data and compute resources that are hard for smaller labs to reproduce.",https://doi.org/10.1109/CVPR.2008.4587715,https://www.semanticscholar.org/paper/16f4cfd4cbf504a151827b5a94df5deafd4930ac,,10.1109/CVPR.2008.4587715,,,16493916,Computer Science; Mathematics,JournalArticle; Conference,computer vision,1,citations=856; influential=106; recognized venue; open PDF metadata; AI term matches=2,
1786,39,39,2008,Evaluation of random forest and adaboost tree-based ensemble classification and spectral band selection for ecotope mapping using airborne hyperspectral imagery,"J. Chan, D. Paelinckx",,2008-06-16,855,27,199.201,"Graph Learning, Recommendation, and Core Methods",metadata-ranked,machine-learning,"Positions Evaluation of random forest and adaboost tree-based ensemble classification and spectral band selection for ecotope mapping using airborne hyperspectral imagery within Graph Learning, Recommendation, and Core Methods.",high citation signal (855); influential citation signal (27),"Graph and recommender benchmarks can contain temporal leakage, popularity bias, or unrealistic train/test splits.; Algorithmic gains may be sensitive to hyperparameter budgets and implementation details.; Core methods need careful ablations before broad claims about generality or efficiency are accepted.",https://doi.org/10.1016/J.RSE.2008.02.011,https://www.semanticscholar.org/paper/b4b4a54f3817f24e0131dead3a0befbdcd8f3cd6,,10.1016/J.RSE.2008.02.011,,,5707430,Computer Science; Environmental Science,,neural networks,1,citations=855; influential=27; open PDF metadata; title AI matches=1; AI term matches=1,
1831,40,40,2008,Classification using discriminative restricted Boltzmann machines,"H. Larochelle, Yoshua Bengio",International Conference on Machine Learning,2008-07-05,821,85,228.019,General AI Methods and Systems,metadata-ranked,machine-learning,Positions Classification using discriminative restricted Boltzmann machines within General AI Methods and Systems.,high citation signal (821); influential citation signal (85); recognized venue,"Survey and infrastructure papers can dominate citations while empirical evidence remains distributed across subfields.; Broad claims need careful mapping to specific tasks, datasets, and operational constraints.; Metadata-driven ranking cannot replace expert reading of full papers and experimental details.",https://doi.org/10.1145/1390156.1390224,https://www.semanticscholar.org/paper/a53da9916b87fa295837617c16ef2ca6462cafb8,,10.1145/1390156.1390224,,,15584821,Computer Science,JournalArticle,deep learning; machine learning; neural networks,3,citations=821; influential=85; recognized venue; open PDF metadata; title AI matches=1; AI term matches=2; query hits=3,
1843,41,41,2008,"NetMHC-3.0: accurate web accessible predictions of human, mouse and monkey MHC class I affinities for peptides of length 8–11","C. Lundegaard, K. Lamberth, M. Harndahl, S. Buus, O. Lund, M. Nielsen",Nucleic Acids Res.,2008-05-07,813,55,206.798,Foundation Models and Large Language Models,metadata-ranked,machine-learning,NetMHC-3.0 is trained on a large number of quantitative peptide data using both affinity data from the Immune Epitope Database and Analysis Resource (IEDB) and elution data from SYFPEITHI.,high citation signal (813); influential citation signal (55); open-access PDF metadata,"Capability gains are difficult to separate from data scale, benchmark leakage, and evaluation prompt sensitivity.; Alignment and safety claims often need stronger real-world and multilingual validation.; Compute-intensive training can limit reproducibility and concentrate follow-up work around a small number of institutions.",https://doi.org/10.1093/nar/gkn202,https://www.semanticscholar.org/paper/2b60a7f6a75c3a8c6198d4e3af857d9fef139aa4,https://europepmc.org/articles/pmc2447772?pdf=render,10.1093/nar/gkn202,,18463140,18355449,Biology; Computer Science; Medicine,Study; JournalArticle,neural networks,1,citations=813; influential=55; open PDF metadata; AI term matches=2,"NetMHC-3.0 is trained on a large number of quantitative peptide data using both affinity data from the Immune Epitope Database and Analysis Resource (IEDB) and elution data from SYFPEITHI. The method generates high-accuracy predictions of major histocompatibility complex (MHC): peptide binding. The predictions are based on artificial neural networks trained on data from 55 MHC alleles (43 Human and 12 non-human), and position-specific scoring matrices (PSSMs) for additional 67 HLA alleles. As only the MHC class I prediction server is available, predictions are possible for peptides of length 8–11 for all 122 alleles. artificial neural network predictions are given as actual IC50 values whereas PSSM predictions are given as a log-odds likelihood scores. The output is optionally available as download for easy post-processing. The training method underlying the server is the best available, and has been used to predict possible MHC-binding peptides in a series of pathogen viral proteomes including SARS, Influenza and HIV, resulting in an average of 75–80% confirmed MHC binders. Here, the performance is further validated and benchmarked using a large set of newly published affinity data, non-redundant to the training set. The server is free of use and available at: http://www.cbs.dtu.dk/services/NetMHC."
1844,42,42,2008,Training neural network classifiers for medical decision making: The effects of imbalanced datasets on classification performance,"M. Mazurowski, P. Habas, J. Zurada, J. Lo, J. Baker, G. Tourassi",Neural Networks,2008-03-01,813,12,191.352,"AI for Science, Healthcare, and Robotics",ai4science,machine-learning; ai4science,"Positions Training neural network classifiers for medical decision making: The effects of imbalanced datasets on classification performance within AI for Science, Healthcare, and Robotics.",high citation signal (813); influential citation signal (12); open-access PDF metadata,"External validation, prospective testing, and domain expert review are often more important than retrospective benchmark scores.; Clinical, biological, or robotic deployment can fail when data collection protocols differ from training assumptions.; Safety, interpretability, uncertainty, and regulatory evidence remain essential for translation.",https://doi.org/10.1016/j.neunet.2007.12.031,https://www.semanticscholar.org/paper/7f5b88983f7364f5ce01876c52d5c4c88dc2a479,https://europepmc.org/articles/pmc2346433?pdf=render,10.1016/j.neunet.2007.12.031,,18272329,16539414,Computer Science; Medicine,JournalArticle,neural networks,1,citations=813; influential=12; open PDF metadata; title AI matches=2; AI term matches=3,
1847,43,43,2008,Machine Learning in Bioinformatics,"P. Larrañaga, Borja Calvo, Roberto Santana, C. Bielza, Josu Galdiano, Iñaki Inza, J. A. Lozano, Ruben Armañanzas, et al.",Encyclopedia of Database Systems,2008-12-03,812,20,197.039,General AI Methods and Systems,metadata-ranked,machine-learning,Positions Machine Learning in Bioinformatics within General AI Methods and Systems.,high citation signal (812); influential citation signal (20); open-access PDF metadata,"Survey and infrastructure papers can dominate citations while empirical evidence remains distributed across subfields.; Broad claims need careful mapping to specific tasks, datasets, and operational constraints.; Metadata-driven ranking cannot replace expert reading of full papers and experimental details.",https://doi.org/10.1007/978-0-387-39940-9_3007,https://www.semanticscholar.org/paper/035256a8a6d8a73af2adb38245f4130daa1f0535,http://www.ics.uci.edu/%7Exhx/courses/CS174/lectures/ML_in_Bioinform.pdf,10.1007/978-0-387-39940-9_3007,,,6944829,Biology; Computer Science,,machine learning; neural networks; support vector machines,3,citations=812; influential=20; open PDF metadata; title AI matches=1; AI term matches=1; query hits=3,
1852,44,44,2008,Support Vector Machine-Based Classification Scheme for Myoelectric Control Applied to Upper Limb,"M. A. Oskoei, Huosheng Hu",IEEE Transactions on Biomedical Engineering,2008-03-05,807,79,227.629,"AI for Science, Healthcare, and Robotics",metadata-ranked,machine-learning; reinforcement-learning; ai4science,"Positions Support Vector Machine-Based Classification Scheme for Myoelectric Control Applied to Upper Limb within AI for Science, Healthcare, and Robotics.",high citation signal (807); influential citation signal (79); recognized venue; open-access PDF metadata,"External validation, prospective testing, and domain expert review are often more important than retrospective benchmark scores.; Clinical, biological, or robotic deployment can fail when data collection protocols differ from training assumptions.; Safety, interpretability, uncertainty, and regulatory evidence remain essential for translation.",https://doi.org/10.1109/TBME.2008.919734,https://www.semanticscholar.org/paper/3440c5ec7e8a7c441c47330ae338f7ddb294b053,http://cswww.essex.ac.uk/staff/hhu/Papers/IEEE-TBME-V55-N8-2008.pdf,10.1109/TBME.2008.919734,,18632358,17162934,Computer Science; Engineering; Medicine,JournalArticle,neural networks; support vector machines,2,citations=807; influential=79; recognized venue; open PDF metadata; title AI matches=2; AI term matches=2; query hits=2,
1854,45,45,2008,Small codes and large image databases for recognition,"A. Torralba, R. Fergus, Yair Weiss",2008 IEEE Conference on Computer Vision and Pattern Recognition,2008-06-23,804,50,215.244,Vision and Multimodal Learning,metadata-ranked,machine-learning; vision,Positions Small codes and large image databases for recognition within Vision and Multimodal Learning.,high citation signal (804); influential citation signal (50); recognized venue; open-access PDF metadata,"Large-scale benchmark success can overstate robustness under distribution shift, rare classes, and real deployment constraints.; Multimodal alignment may inherit biases and spurious correlations from web-scale data.; High-performing systems often require data and compute resources that are hard for smaller labs to reproduce.",https://doi.org/10.1109/CVPR.2008.4587633,https://www.semanticscholar.org/paper/993cb3c7167b34b033c66cc4b2af87ff4781c6d4,http://www.cs.toronto.edu/%7Ehinton/csc2535/readings/spectralcodes.pdf,10.1109/CVPR.2008.4587633,,,14503028,Computer Science,JournalArticle; Conference,machine learning,1,citations=804; influential=50; recognized venue; open PDF metadata; AI term matches=2,
1870,46,46,2008,Discrimination-aware data mining,"D. Pedreschi, S. Ruggieri, F. Turini",Knowledge Discovery and Data Mining,2008-08-24,791,43,203.819,General AI Methods and Systems,metadata-ranked,machine-learning,Positions Discrimination-aware data mining within General AI Methods and Systems.,high citation signal (791); influential citation signal (43); open-access PDF metadata,"Survey and infrastructure papers can dominate citations while empirical evidence remains distributed across subfields.; Broad claims need careful mapping to specific tasks, datasets, and operational constraints.; Metadata-driven ranking cannot replace expert reading of full papers and experimental details.",https://doi.org/10.1145/1401890.1401959,https://www.semanticscholar.org/paper/c501acb1dbbab80212dc3ab005abf19560fe18f2,http://www.di.unipi.it/~ruggieri/Papers/kdd2008.pdf,10.1145/1401890.1401959,,,1430128,Computer Science; Law,JournalArticle; Conference,data mining,1,citations=791; influential=43; open PDF metadata; title AI matches=1; AI term matches=1,
