rank,yearRank,candidateRank,year,title,authors,venue,publicationDate,citationCount,influentialCitationCount,importanceScore,category,methodTags,keywordTags,keyIdea,strengths,limitations,url,semanticScholarUrl,openAccessPdf,doi,arxiv,pubmed,corpusId,fieldsOfStudy,publicationTypes,sourceQueries,queryHitCount,importanceReasons,abstract
70,19,19,2021,Switch Transformers: Scaling to Trillion Parameter Models with Simple and Efficient Sparsity,"W. Fedus, Barret Zoph, Noam Shazeer",Journal of machine learning research,2021-01-11,4121,542,293.29,Foundation Models and Large Language Models,benchmark/dataset; transformer; self-supervised,foundation-models,"In deep learning, models typically reuse the same parameters for all inputs.","high citation signal (4,121); influential citation signal (542); recognized venue","Capability gains are difficult to separate from data scale, benchmark leakage, and evaluation prompt sensitivity.; Alignment and safety claims often need stronger real-world and multilingual validation.; Compute-intensive training can limit reproducibility and concentrate follow-up work around a small number of institutions.",https://www.semanticscholar.org/paper/fdacf2a732f55befdc410ea927091cad3b791f13,https://www.semanticscholar.org/paper/fdacf2a732f55befdc410ea927091cad3b791f13,,,2101.03961,,231573431,Computer Science,JournalArticle,deep learning; large language models,2,citations=4121; influential=542; recognized venue; resource signal; open PDF metadata; title AI matches=1; AI term matches=4; query hits=2,"In deep learning, models typically reuse the same parameters for all inputs. Mixture of Experts (MoE) defies this and instead selects different parameters for each incoming example. The result is a sparsely-activated model -- with outrageous numbers of parameters -- but a constant computational cost. However, despite several notable successes of MoE, widespread adoption has been hindered by complexity, communication costs and training instability -- we address these with the Switch Transformer. We simplify the MoE routing algorithm and design intuitive improved models with reduced communication and computational costs. Our proposed training techniques help wrangle the instabilities and we show large sparse models may be trained, for the first time, with lower precision (bfloat16) formats. We design models based off T5-Base and T5-Large to obtain up to 7x increases in pre-training speed with the same computational resources. These improvements extend into multilingual settings where we measure gains over the mT5-Base version across all 101 languages. Finally, we advance the current scale of language models by pre-training up to trillion parameter models on the""Colossal Clean Crawled Corpus""and achieve a 4x speedup over the T5-XXL model."
71,20,20,2021,Learning to Prompt for Vision-Language Models,"Kaiyang Zhou, Jingkang Yang, Chen Change Loy, Ziwei Liu",International Journal of Computer Vision,2021-09-02,4037,718,289.767,Foundation Models and Large Language Models,self-supervised,foundation-models; multimodal; nlp; vision,Large pre-trained vision-language models like CLIP have shown great potential in learning representations that are transferable across a wide range of downstream tasks.,"high citation signal (4,037); influential citation signal (718)","Capability gains are difficult to separate from data scale, benchmark leakage, and evaluation prompt sensitivity.; Alignment and safety claims often need stronger real-world and multilingual validation.; Compute-intensive training can limit reproducibility and concentrate follow-up work around a small number of institutions.",https://doi.org/10.1007/s11263-022-01653-1,https://www.semanticscholar.org/paper/96ea07447d2f9adefe03852a878517a2a6d45b96,,10.1007/s11263-022-01653-1,2109.01134,,237386023,Computer Science,JournalArticle,large language models; natural language processing,2,citations=4037; influential=718; open PDF metadata; title AI matches=2; AI term matches=8; query hits=2,"Large pre-trained vision-language models like CLIP have shown great potential in learning representations that are transferable across a wide range of downstream tasks. Different from the traditional representation learning that is based mostly on discretized labels, vision-language pre-training aligns images and texts in a common feature space, which allows zero-shot transfer to a downstream task via prompting, i.e., classification weights are synthesized from natural language describing classes of interest. In this work, we show that a major challenge for deploying such models in practice is prompt engineering, which requires domain expertise and is extremely time-consuming—one needs to spend a significant amount of time on words tuning since a slight change in wording could have a huge impact on performance. Inspired by recent advances in prompt learning research in natural language processing (NLP), we propose Context Optimization (CoOp), a simple approach specifically for adapting CLIP-like vision-language models for downstream image recognition. Concretely, CoOp models a prompt’s context words with learnable vectors while the entire pre-trained parameters are kept fixed. To handle different image recognition tasks, we provide two implementations of CoOp: unified context and class-specific context. Through extensive experiments on 11 datasets, we demonstrate that CoOp requires as few as one or two shots to beat hand-crafted prompts with a decent margin and is able to gain significant improvements over prompt engineering with more shots, e.g., with 16 shots the average gain is around 15% (with the highest reaching over 45%). Despite being a learning-based approach, CoOp achieves superb domain generalization performance compared with the zero-shot model using hand-crafted prompts."
73,21,21,2021,Restormer: Efficient Transformer for High-Resolution Image Restoration,"Syed Waqas Zamir, Aditya Arora, Salman Hameed Khan, Munawar Hayat, F. Khan, Ming-Hsuan Yang",Computer Vision and Pattern Recognition,2021-11-18,4014,734,293.95,Vision and Multimodal Learning,transformer,nlp; vision,"Since convolutional neural networks (CNNs) perform well at learning generalizable image priors from large-scale data, these models have been extensively applied to image restoration and related tasks.","high citation signal (4,014); influential citation signal (734); recognized venue; open-access PDF metadata","Large-scale benchmark success can overstate robustness under distribution shift, rare classes, and real deployment constraints.; Multimodal alignment may inherit biases and spurious correlations from web-scale data.; High-performing systems often require data and compute resources that are hard for smaller labs to reproduce.",https://doi.org/10.1109/CVPR52688.2022.00564,https://www.semanticscholar.org/paper/1e88d5afe19aea324d33541f60a90b7036894c32,https://arxiv.org/pdf/2111.09881,10.1109/CVPR52688.2022.00564,2111.09881,,244346144,Computer Science; Engineering,JournalArticle; Conference,large language models,1,citations=4014; influential=734; recognized venue; resource signal; open PDF metadata; title AI matches=1; AI term matches=3,"Since convolutional neural networks (CNNs) perform well at learning generalizable image priors from large-scale data, these models have been extensively applied to image restoration and related tasks. Recently, another class of neural architectures, Transformers, have shown significant performance gains on natural language and high-level vision tasks. While the Transformer model mitigates the shortcomings of CNNs (i.e., limited receptive field and inadaptability to input content), its computational complexity grows quadratically with the spatial resolution, therefore making it infeasible to apply to most image restoration tasks involving high-resolution images. In this work, we propose an efficient Transformer model by making several key designs in the building blocks (multi-head attention and feed-forward network) such that it can capture long-range pixel interactions, while still remaining applicable to large images. Our model, named Restoration Transformer (Restormer), achieves state-of-the-art results on several image restoration tasks, including image deraining, single-image motion deblurring, defocus deblurring (single-image and dual-pixel data), and image denoising (Gaussian grayscale/color denoising, and real image denoising). The source code and pre-trained models are available at https://github.com/swz30/Restormer."
76,22,22,2021,Program Synthesis with Large Language Models,"Jacob Austin, Augustus Odena, Maxwell Nye, Maarten Bosma, H. Michalewski, David Dohan, Ellen Jiang, Carrie J. Cai, et al.",arXiv.org,2021-08-16,3877,593,288.204,Foundation Models and Large Language Models,benchmark/dataset; reinforcement-learning,foundation-models; nlp; reinforcement-learning,This paper explores the limits of the current generation of large language models for program synthesis in general purpose programming languages.,"high citation signal (3,877); influential citation signal (593)","Capability gains are difficult to separate from data scale, benchmark leakage, and evaluation prompt sensitivity.; Alignment and safety claims often need stronger real-world and multilingual validation.; Compute-intensive training can limit reproducibility and concentrate follow-up work around a small number of institutions.",https://www.semanticscholar.org/paper/a38e0f993e4805ba8a9beae4c275c91ffcec01df,https://www.semanticscholar.org/paper/a38e0f993e4805ba8a9beae4c275c91ffcec01df,,,2108.07732,,237142385,Computer Science,JournalArticle,large language models,1,citations=3877; influential=593; survey/benchmark signal; resource signal; open PDF metadata; title AI matches=2; AI term matches=4,"This paper explores the limits of the current generation of large language models for program synthesis in general purpose programming languages. We evaluate a collection of such models (with between 244M and 137B parameters) on two new benchmarks, MBPP and MathQA-Python, in both the few-shot and fine-tuning regimes. Our benchmarks are designed to measure the ability of these models to synthesize short Python programs from natural language descriptions. The Mostly Basic Programming Problems (MBPP) dataset contains 974 programming tasks, designed to be solvable by entry-level programmers. The MathQA-Python dataset, a Python version of the MathQA benchmark, contains 23914 problems that evaluate the ability of the models to synthesize code from more complex text. On both datasets, we find that synthesis performance scales log-linearly with model size. Our largest models, even without finetuning on a code dataset, can synthesize solutions to 59.6 percent of the problems from MBPP using few-shot learning with a well-designed prompt. Fine-tuning on a held-out portion of the dataset improves performance by about 10 percentage points across most model sizes. On the MathQA-Python dataset, the largest fine-tuned model achieves 83.8 percent accuracy. Going further, we study the model's ability to engage in dialog about code, incorporating human feedback to improve its solutions. We find that natural language feedback from a human halves the error rate compared to the model's initial prediction. Additionally, we conduct an error analysis to shed light on where these models fall short and what types of programs are most difficult to generate. Finally, we explore the semantic grounding of these models by fine-tuning them to predict the results of program execution. We find that even our best models are generally unable to predict the output of a program given a specific input."
79,23,23,2021,Efficiently Modeling Long Sequences with Structured State Spaces,"Albert Gu, Karan Goel, Christopher R'e",International Conference on Learning Representations,2021-10-31,3759,345,273.958,Foundation Models and Large Language Models,benchmark/dataset,vision,"A central goal of sequence modeling is designing a single principled model that can address sequence data across a range of modalities and tasks, particularly on long-range dependencies.","high citation signal (3,759); influential citation signal (345)","Capability gains are difficult to separate from data scale, benchmark leakage, and evaluation prompt sensitivity.; Alignment and safety claims often need stronger real-world and multilingual validation.; Compute-intensive training can limit reproducibility and concentrate follow-up work around a small number of institutions.",https://www.semanticscholar.org/paper/ac2618b2ce5cdcf86f9371bcca98bc5e37e46f51,https://www.semanticscholar.org/paper/ac2618b2ce5cdcf86f9371bcca98bc5e37e46f51,,,2111.00396,,240354066,Computer Science,JournalArticle,large language models,1,citations=3759; influential=345; survey/benchmark signal; resource signal; open PDF metadata; AI term matches=2,"A central goal of sequence modeling is designing a single principled model that can address sequence data across a range of modalities and tasks, particularly on long-range dependencies. Although conventional models including RNNs, CNNs, and Transformers have specialized variants for capturing long dependencies, they still struggle to scale to very long sequences of $10000$ or more steps. A promising recent approach proposed modeling sequences by simulating the fundamental state space model (SSM) \( x'(t) = Ax(t) + Bu(t), y(t) = Cx(t) + Du(t) \), and showed that for appropriate choices of the state matrix \( A \), this system could handle long-range dependencies mathematically and empirically. However, this method has prohibitive computation and memory requirements, rendering it infeasible as a general sequence modeling solution. We propose the Structured State Space sequence model (S4) based on a new parameterization for the SSM, and show that it can be computed much more efficiently than prior approaches while preserving their theoretical strengths. Our technique involves conditioning \( A \) with a low-rank correction, allowing it to be diagonalized stably and reducing the SSM to the well-studied computation of a Cauchy kernel. S4 achieves strong empirical results across a diverse range of established benchmarks, including (i) 91\% accuracy on sequential CIFAR-10 with no data augmentation or auxiliary losses, on par with a larger 2-D ResNet, (ii) substantially closing the gap to Transformers on image and language modeling tasks, while performing generation $60\times$ faster (iii) SoTA on every task from the Long Range Arena benchmark, including solving the challenging Path-X task of length 16k that all prior work fails on, while being as efficient as all competitors."
82,24,24,2021,BEiT: BERT Pre-Training of Image Transformers,"Hangbo Bao, Li Dong, Furu Wei",International Conference on Learning Representations,2021-06-15,3720,477,280.253,Vision and Multimodal Learning,transformer; self-supervised,foundation-models; nlp; vision,"We introduce a self-supervised vision representation model BEiT, which stands for Bidirectional Encoder representation from Image Transformers.","high citation signal (3,720); influential citation signal (477)","Large-scale benchmark success can overstate robustness under distribution shift, rare classes, and real deployment constraints.; Multimodal alignment may inherit biases and spurious correlations from web-scale data.; High-performing systems often require data and compute resources that are hard for smaller labs to reproduce.",https://www.semanticscholar.org/paper/722ad6ac92286507437b31486f47987d6ece05c9,https://www.semanticscholar.org/paper/722ad6ac92286507437b31486f47987d6ece05c9,,,2106.08254,,235436185,Computer Science,JournalArticle,large language models; natural language processing,2,citations=3720; influential=477; resource signal; open PDF metadata; title AI matches=1; AI term matches=5; query hits=2,"We introduce a self-supervised vision representation model BEiT, which stands for Bidirectional Encoder representation from Image Transformers. Following BERT developed in the natural language processing area, we propose a masked image modeling task to pretrain vision Transformers. Specifically, each image has two views in our pre-training, i.e, image patches (such as 16x16 pixels), and visual tokens (i.e., discrete tokens). We first""tokenize""the original image into visual tokens. Then we randomly mask some image patches and fed them into the backbone Transformer. The pre-training objective is to recover the original visual tokens based on the corrupted image patches. After pre-training BEiT, we directly fine-tune the model parameters on downstream tasks by appending task layers upon the pretrained encoder. Experimental results on image classification and semantic segmentation show that our model achieves competitive results with previous pre-training methods. For example, base-size BEiT achieves 83.2% top-1 accuracy on ImageNet-1K, significantly outperforming from-scratch DeiT training (81.8%) with the same setup. Moreover, large-size BEiT obtains 86.3% only using ImageNet-1K, even outperforming ViT-L with supervised pre-training on ImageNet-22K (85.2%). The code and pretrained models are available at https://aka.ms/beit."
86,25,25,2021,MLP-Mixer: An all-MLP Architecture for Vision,"I. Tolstikhin, N. Houlsby, Alexander Kolesnikov, Lucas Beyer, Xiaohua Zhai, Thomas Unterthiner, Jessica Yung, Daniel Keysers, et al.",Neural Information Processing Systems,2021-05-04,3639,403,269.414,Vision and Multimodal Learning,transformer; self-supervised,vision,Convolutional Neural Networks (CNNs) are the go-to model for computer vision.,"high citation signal (3,639); influential citation signal (403)","Large-scale benchmark success can overstate robustness under distribution shift, rare classes, and real deployment constraints.; Multimodal alignment may inherit biases and spurious correlations from web-scale data.; High-performing systems often require data and compute resources that are hard for smaller labs to reproduce.",https://www.semanticscholar.org/paper/67571d29190faea9fbd104acd16274f8c4edf254,https://www.semanticscholar.org/paper/67571d29190faea9fbd104acd16274f8c4edf254,,,2105.01601,,233714958,Computer Science,JournalArticle,computer vision,1,citations=3639; influential=403; open PDF metadata; AI term matches=4,"Convolutional Neural Networks (CNNs) are the go-to model for computer vision. Recently, attention-based networks, such as the Vision Transformer, have also become popular. In this paper we show that while convolutions and attention are both sufficient for good performance, neither of them are necessary. We present MLP-Mixer, an architecture based exclusively on multi-layer perceptrons (MLPs). MLP-Mixer contains two types of layers: one with MLPs applied independently to image patches (i.e.""mixing""the per-location features), and one with MLPs applied across patches (i.e.""mixing""spatial information). When trained on large datasets, or with modern regularization schemes, MLP-Mixer attains competitive scores on image classification benchmarks, with pre-training and inference cost comparable to state-of-the-art models. We hope that these results spark further research beyond the realms of well established CNNs and Transformers."
88,26,26,2021,Transformers in Vision: A Survey,"Salman Hameed Khan, Muzammal Naseer, Munawar Hayat, Syed Waqas Zamir, F. Khan, M. Shah",ACM Computing Surveys,2021-01-04,3599,64,254.593,Vision and Multimodal Learning,survey/review; transformer; self-supervised; generative,generative-ai; multimodal; nlp; vision,Astounding results from Transformer models on natural language tasks have intrigued the vision community to study their application to computer vision problems.,"high citation signal (3,599); influential citation signal (64); open-access PDF metadata","Large-scale benchmark success can overstate robustness under distribution shift, rare classes, and real deployment constraints.; Multimodal alignment may inherit biases and spurious correlations from web-scale data.; High-performing systems often require data and compute resources that are hard for smaller labs to reproduce.",https://doi.org/10.1145/3505244,https://www.semanticscholar.org/paper/3a906b77fa218adc171fecb28bb81c24c14dcc7b,https://arxiv.org/pdf/2101.01169,10.1145/3505244,2101.01169,,230435805,Computer Science,JournalArticle; Review,computer vision; large language models; natural language processing,3,citations=3599; influential=64; survey/benchmark signal; open PDF metadata; title AI matches=1; AI term matches=5; query hits=3,"Astounding results from Transformer models on natural language tasks have intrigued the vision community to study their application to computer vision problems. Among their salient benefits, Transformers enable modeling long dependencies between input sequence elements and support parallel processing of sequence as compared to recurrent networks, e.g., Long short-term memory. Different from convolutional networks, Transformers require minimal inductive biases for their design and are naturally suited as set-functions. Furthermore, the straightforward design of Transformers allows processing multiple modalities (e.g., images, videos, text, and speech) using similar processing blocks and demonstrates excellent scalability to very large capacity networks and huge datasets. These strengths have led to exciting progress on a number of vision tasks using Transformer networks. This survey aims to provide a comprehensive overview of the Transformer models in the computer vision discipline. We start with an introduction to fundamental concepts behind the success of Transformers, i.e., self-attention, large-scale pre-training, and bidirectional feature encoding. We then cover extensive applications of transformers in vision including popular recognition tasks (e.g., image classification, object detection, action recognition, and segmentation), generative modeling, multi-modal tasks (e.g., visual-question answering, visual reasoning, and visual grounding), video processing (e.g., activity recognition, video forecasting), low-level vision (e.g., image super-resolution, image enhancement, and colorization), and three-dimensional analysis (e.g., point cloud classification and segmentation). We compare the respective advantages and limitations of popular techniques both in terms of architectural design and their experimental value. Finally, we provide an analysis on open research directions and possible future works. We hope this effort will ignite further interest in the community to solve current challenges toward the application of transformer models in computer vision."
