rank,yearRank,candidateRank,year,title,authors,venue,publicationDate,citationCount,influentialCitationCount,importanceScore,category,methodTags,keywordTags,keyIdea,strengths,limitations,url,semanticScholarUrl,openAccessPdf,doi,arxiv,pubmed,corpusId,fieldsOfStudy,publicationTypes,sourceQueries,queryHitCount,importanceReasons,abstract
420,73,73,2022,"data2vec: A General Framework for Self-supervised Learning in Speech, Vision and Language","Alexei Baevski, Wei-Ning Hsu, Qiantong Xu, Arun Babu, Jiatao Gu, Michael Auli",International Conference on Machine Learning,2022-02-07,1157,204,249.72,Natural Language Processing and Knowledge,transformer; self-supervised,nlp; vision,"While the general idea of self-supervised learning is identical across modalities, the actual algorithms and objectives differ widely because they were developed with a single modality in mind.","high citation signal (1,157); influential citation signal (204); recognized venue","Benchmark scores can hide brittle reasoning, retrieval failures, hallucination, and domain transfer issues.; Language coverage is often uneven, with English and high-resource domains overrepresented.; Evaluation can be sensitive to annotation protocols, prompt wording, and changing model APIs.",https://www.semanticscholar.org/paper/8f2bca9d684005675e294b33c26481e36f528cdb,https://www.semanticscholar.org/paper/8f2bca9d684005675e294b33c26481e36f528cdb,,,2202.03555,,246652264,Computer Science; Linguistics,JournalArticle; Conference,computer vision,1,citations=1157; influential=204; recognized venue; open PDF metadata; title AI matches=1; AI term matches=7,"While the general idea of self-supervised learning is identical across modalities, the actual algorithms and objectives differ widely because they were developed with a single modality in mind. To get us closer to general self-supervised learning, we present data2vec, a framework that uses the same learning method for either speech, NLP or computer vision. The core idea is to predict latent representations of the full input data based on a masked view of the input in a self-distillation setup using a standard Transformer architecture. Instead of predicting modality-specific targets such as words, visual tokens or units of human speech which are local in nature, data2vec predicts contextualized latent representations that contain information from the entire input. Experiments on the major benchmarks of speech recognition, image classification, and natural language understanding demonstrate a new state of the art or competitive performance to predominant approaches."
422,74,74,2022,"CheckM2: a rapid, scalable and accurate tool for assessing microbial genome quality using machine learning","Alex Chklovski, Donovan H. Parks, B. Woodcroft, G. Tyson",bioRxiv,2022-07-11,1134,282,237.793,General AI Methods and Systems,metadata-ranked,foundation-models,"Positions CheckM2: a rapid, scalable and accurate tool for assessing microbial genome quality using machine learning within General AI Methods and Systems.","high citation signal (1,134); influential citation signal (282); open-access PDF metadata","Survey and infrastructure papers can dominate citations while empirical evidence remains distributed across subfields.; Broad claims need careful mapping to specific tasks, datasets, and operational constraints.; Metadata-driven ranking cannot replace expert reading of full papers and experimental details.",https://doi.org/10.1038/s41592-023-01940-w,https://www.semanticscholar.org/paper/78cfbe4203ede2d1f3437fbd91266823ac18cf07,https://doi.org/10.1101/2022.07.11.499243,10.1038/s41592-023-01940-w,,37500759,250534021,Biology; Computer Science; Environmental Science; Medicine,JournalArticle,machine learning,1,citations=1134; influential=282; open PDF metadata; title AI matches=1; AI term matches=1,
425,75,75,2022,InternImage: Exploring Large-Scale Vision Foundation Models with Deformable Convolutions,"Wenhai Wang, Jifeng Dai, Zhe Chen, Zhenhang Huang, Zhiqi Li, Xizhou Zhu, Xiaowei Hu, Tong Lu, et al.",Computer Vision and Pattern Recognition,2022-11-10,1117,97,238.614,Foundation Models and Large Language Models,trustworthy-ai,foundation-models; vision; trustworthy-ai,"Compared to the great progress of large-scale vision transformers (ViTs) in recent years, large-scale models based on convolutional neural networks (CNNs) are still in an early state.","high citation signal (1,117); influential citation signal (97); recognized venue; open-access PDF metadata","Capability gains are difficult to separate from data scale, benchmark leakage, and evaluation prompt sensitivity.; Alignment and safety claims often need stronger real-world and multilingual validation.; Compute-intensive training can limit reproducibility and concentrate follow-up work around a small number of institutions.",https://doi.org/10.1109/CVPR52729.2023.01385,https://www.semanticscholar.org/paper/26c80bd65baa90f5b18157de4951f4eb0b62ab69,https://arxiv.org/pdf/2211.05778,10.1109/CVPR52729.2023.01385,2211.05778,,253446956,Computer Science,JournalArticle; Conference,foundation models,1,citations=1117; influential=97; recognized venue; translation/trustworthiness signal; open PDF metadata; title AI matches=1; AI term matches=4,"Compared to the great progress of large-scale vision transformers (ViTs) in recent years, large-scale models based on convolutional neural networks (CNNs) are still in an early state. This work presents a new large-scale CNN-based foundation model, termed InternImage, which can obtain the gain from increasing parameters and training data like ViTs. Different from the recent CNNs that focus on large dense kernels, InternImage takes deformable convolution as the core operator, so that our model not only has the large effective receptive field required for downstream tasks such as detection and segmentation, but also has the adaptive spatial aggregation conditioned by input and task information. As a result, the proposed InternImage reduces the strict inductive bias of traditional CNNs and makes it possible to learn stronger and more robust patterns with large-scale parameters from massive data like ViTs. The effectiveness of our model is proven on challenging benchmarks including ImageNet, COCO, andADE20K. It is worth mentioning that InternImage-H achieved a new record 65.4 mAP on COCO test-dev and 62.9 mIoU on ADE20K, outperforming current leading CNNs and ViTs."
426,76,76,2022,WebShop: Towards Scalable Real-World Web Interaction with Grounded Language Agents,"Shunyu Yao, Howard Chen, John Yang, Karthik Narasimhan",Neural Information Processing Systems,2022-07-04,1111,182,230.239,Foundation Models and Large Language Models,reinforcement-learning,nlp; vision; reinforcement-learning,"Existing benchmarks for grounding language in interactive environments either lack real-world linguistic elements, or prove difficult to scale up due to substantial human involvement in the collection of data or feedback signals.","high citation signal (1,111); influential citation signal (182); open-access PDF metadata","Capability gains are difficult to separate from data scale, benchmark leakage, and evaluation prompt sensitivity.; Alignment and safety claims often need stronger real-world and multilingual validation.; Compute-intensive training can limit reproducibility and concentrate follow-up work around a small number of institutions.",https://doi.org/10.48550/arXiv.2207.01206,https://www.semanticscholar.org/paper/23525374cfd3af714f3ffb7a203b1ef3253333fe,http://arxiv.org/pdf/2207.01206,10.48550/arXiv.2207.01206,2207.01206,,250264533,Computer Science; Linguistics,JournalArticle,reinforcement learning,1,citations=1111; influential=182; open PDF metadata; AI term matches=2,"Existing benchmarks for grounding language in interactive environments either lack real-world linguistic elements, or prove difficult to scale up due to substantial human involvement in the collection of data or feedback signals. To bridge this gap, we develop WebShop -- a simulated e-commerce website environment with $1.18$ million real-world products and $12,087$ crowd-sourced text instructions. Given a text instruction specifying a product requirement, an agent needs to navigate multiple types of webpages and issue diverse actions to find, customize, and purchase an item. WebShop provides several challenges for language grounding including understanding compositional instructions, query (re-)formulation, comprehending and acting on noisy text in webpages, and performing strategic exploration. We collect over $1,600$ human demonstrations for the task, and train and evaluate a diverse range of agents using reinforcement learning, imitation learning, and pre-trained image and language models. Our best model achieves a task success rate of $29\%$, which outperforms rule-based heuristics ($9.6\%$) but is far lower than human expert performance ($59\%$). We also analyze agent and human trajectories and ablate various model components to provide insights for developing future agents with stronger language understanding and decision making abilities. Finally, we show that agents trained on WebShop exhibit non-trivial sim-to-real transfer when evaluated on amazon.com and ebay.com, indicating the potential value of WebShop in developing practical web-based agents that can operate in the wild."
427,77,77,2022,"Out of One, Many: Using Language Models to Simulate Human Samples","Lisa P. Argyle, E. Busby, Nancy Fulda, Joshua R Gubler, Christopher Rytting, David Wingate",Political Analysis,2022-09-14,1111,104,226.462,Foundation Models and Large Language Models,transformer,foundation-models; nlp; trustworthy-ai; ai4science,Abstract We propose and explore the possibility that language models can be studied as effective proxies for specific human subpopulations in social science research.,"high citation signal (1,111); influential citation signal (104); open-access PDF metadata","Capability gains are difficult to separate from data scale, benchmark leakage, and evaluation prompt sensitivity.; Alignment and safety claims often need stronger real-world and multilingual validation.; Compute-intensive training can limit reproducibility and concentrate follow-up work around a small number of institutions.",https://doi.org/10.1017/pan.2023.2,https://www.semanticscholar.org/paper/f4e612658bde9db88abfd455b99f181fdc536996,https://www.cambridge.org/core/services/aop-cambridge-core/content/view/035D7C8A55B237942FB6DBAD7CAA4E49/S1047198723000025a.pdf/div-class-title-out-of-one-many-using-language-models-to-simulate-human-samples-div.pdf,10.1017/pan.2023.2,2209.06899,,252280474,Computer Science; Sociology,JournalArticle; Review,artificial intelligence; large language models,2,citations=1111; influential=104; open PDF metadata; title AI matches=1; AI term matches=2; query hits=2,"Abstract We propose and explore the possibility that language models can be studied as effective proxies for specific human subpopulations in social science research. Practical and research applications of artificial intelligence tools have sometimes been limited by problematic biases (such as racism or sexism), which are often treated as uniform properties of the models. We show that the “algorithmic bias” within one such tool—the GPT-3 language model—is instead both fine-grained and demographically correlated, meaning that proper conditioning will cause it to accurately emulate response distributions from a wide variety of human subgroups. We term this property algorithmic fidelity and explore its extent in GPT-3. We create “silicon samples” by conditioning the model on thousands of sociodemographic backstories from real human participants in multiple large surveys conducted in the United States. We then compare the silicon and human samples to demonstrate that the information contained in GPT-3 goes far beyond surface similarity. It is nuanced, multifaceted, and reflects the complex interplay between ideas, attitudes, and sociocultural context that characterize human attitudes. We suggest that language models with sufficient algorithmic fidelity thus constitute a novel and powerful tool to advance understanding of humans and society across a variety of disciplines."
428,78,78,2022,Super-NaturalInstructions: Generalization via Declarative Instructions on 1600+ NLP Tasks,"Yizhong Wang, Swaroop Mishra, Pegah Alipoormolabashi, Yeganeh Kordi, Amirreza Mirzaei, Anjana Arunkumar, Arjun Ashok, Arut Selvan Dhanasekaran, et al.",Conference on Empirical Methods in Natural Language Processing,2022-04-16,1106,119,235.232,Natural Language Processing and Knowledge,benchmark/dataset; transformer,nlp,How well can NLP models generalize to a variety of unseen tasks when provided with task instructions?,"high citation signal (1,106); influential citation signal (119); open-access PDF metadata","Benchmark scores can hide brittle reasoning, retrieval failures, hallucination, and domain transfer issues.; Language coverage is often uneven, with English and high-resource domains overrepresented.; Evaluation can be sensitive to annotation protocols, prompt wording, and changing model APIs.",https://doi.org/10.18653/v1/2022.emnlp-main.340,https://www.semanticscholar.org/paper/06d7cb8c8816360feb33c3367073e0ef66d7d0b0,https://aclanthology.org/2022.emnlp-main.340.pdf,10.18653/v1/2022.emnlp-main.340,2204.07705,,253098274,Computer Science,JournalArticle; Conference,large language models,1,citations=1106; influential=119; survey/benchmark signal; resource signal; open PDF metadata; title AI matches=1; AI term matches=3,"How well can NLP models generalize to a variety of unseen tasks when provided with task instructions? To address this question, we first introduce Super-NaturalInstructions, a benchmark of 1,616 diverse NLP tasks and their expert-written instructions. Our collection covers 76 distinct task types, including but not limited to classification, extraction, infilling, sequence tagging, text rewriting, and text composition. This large and diverse collection of tasks enables rigorous benchmarking of cross-task generalization under instructions—training models to follow instructions on a subset of tasks and evaluating them on the remaining unseen ones.Furthermore, we build Tk-Instruct, a transformer model trained to follow a variety of in-context instructions (plain language task definitions or k-shot examples). Our experiments show that Tk-Instruct outperforms existing instruction-following models such as InstructGPT by over 9% on our benchmark despite being an order of magnitude smaller. We further analyze generalization as a function of various scaling parameters, such as the number of observed tasks, the number of instances per task, and model sizes. We hope our dataset and model facilitate future progress towards more general-purpose NLP models."
431,79,79,2022,MaPLe: Multi-modal Prompt Learning,"Muhammad Uzair Khattak, H. Rasheed, M. Maaz, Salman H. Khan, F. Khan",Computer Vision and Pattern Recognition,2022-10-06,1088,211,251.839,Foundation Models and Large Language Models,metadata-ranked,foundation-models; multimodal; nlp; vision,Pre-trained vision-language (V-L) models such as CLIP have shown excellent generalization ability to downstream tasks.,"high citation signal (1,088); influential citation signal (211); recognized venue; open-access PDF metadata","Capability gains are difficult to separate from data scale, benchmark leakage, and evaluation prompt sensitivity.; Alignment and safety claims often need stronger real-world and multilingual validation.; Compute-intensive training can limit reproducibility and concentrate follow-up work around a small number of institutions.",https://doi.org/10.1109/CVPR52729.2023.01832,https://www.semanticscholar.org/paper/0d0dbfb1b315a43216020abaf74d289456198219,https://arxiv.org/pdf/2210.03117,10.1109/CVPR52729.2023.01832,2210.03117,,252735181,Computer Science,JournalArticle; Conference,multimodal learning; natural language processing,2,citations=1088; influential=211; recognized venue; resource signal; open PDF metadata; title AI matches=1; AI term matches=5; query hits=2,"Pre-trained vision-language (V-L) models such as CLIP have shown excellent generalization ability to downstream tasks. However, they are sensitive to the choice of input text prompts and require careful selection of prompt templates to perform well. Inspired by the Natural Language Processing (NLP) literature, recent CLIP adaptation approaches learn prompts as the textual inputs to fine-tune CLIP for downstream tasks. We note that using prompting to adapt representations in a single branch of CLIP (language or vision) is sub-optimal since it does not allow the flexibility to dynamically adjust both representation spaces on a downstream task. In this work, we propose Multi-modal Prompt Learning (MaPLe) for both vision and language branches to improve alignment between the vision and language representations. Our design promotes strong coupling between the vision-language prompts to ensure mutual synergy and discourages learning independent uni-modal solutions. Further, we learn separate prompts across different early stages to progressively model the stage-wise feature relationships to allow rich context learning. We evaluate the effectiveness of our approach on three representative tasks of generalization to novel classes, new target datasets and unseen domain shifts. Compared with the state-of-the-art method Co-CoOp, MaPLe exhibits favorable performance and achieves an absolute gain of 3.45% on novel classes and 2.72% on overall harmonic-mean, averaged over 11 diverse image recognition datasets. Our code and pre-trained models are available at https://github.com/muzairkhattak/multimodal-prompt-learning."
432,80,80,2022,Target-aware Dual Adversarial Learning and a Multi-scenario Multi-Modality Benchmark to Fuse Infrared and Visible for Object Detection,"Jinyuan Liu, Xin Fan, Zhanbo Huang, Guanyao Wu, Risheng Liu, Wei Zhong, Zhongxuan Luo",Computer Vision and Pattern Recognition,2022-03-30,1078,138,248.726,Vision and Multimodal Learning,benchmark/dataset,vision; trustworthy-ai,This study addresses the issue of fusing infrared and visible images that appear differently for object detection.,"high citation signal (1,078); influential citation signal (138); recognized venue; open-access PDF metadata","Large-scale benchmark success can overstate robustness under distribution shift, rare classes, and real deployment constraints.; Multimodal alignment may inherit biases and spurious correlations from web-scale data.; High-performing systems often require data and compute resources that are hard for smaller labs to reproduce.",https://doi.org/10.1109/CVPR52688.2022.00571,https://www.semanticscholar.org/paper/b728dbb572b6437e95c1e5062df9c57ccb6f74b7,https://arxiv.org/pdf/2203.16220,10.1109/CVPR52688.2022.00571,2203.16220,,247793193,Computer Science; Engineering,JournalArticle; Conference,deep learning,1,citations=1078; influential=138; recognized venue; survey/benchmark signal; resource signal; open PDF metadata; title AI matches=2; AI term matches=3,"This study addresses the issue of fusing infrared and visible images that appear differently for object detection. Aiming at generating an image of high visual quality, previous approaches discover commons underlying the two modalities and fuse upon the common space either by iterative optimization or deep networks. These approaches neglect that modality differences implying the complementary information are extremely important for both fusion and subsequent detection task. This paper proposes a bilevel optimization formulation for the joint problem of fusion and detection, and then unrolls to a target-aware Dual Adversarial Learning (TarDAL) network for fusion and a commonly used detection network. The fusion network with one generator and dual discriminators seeks commons while learning from differences, which preserves structural information of targets from the infrared and textural details from the visible. Furthermore, we build a synchronized imaging system with calibrated infrared and optical sensors, and collect currently the most comprehensive benchmark covering a wide range of scenarios. Extensive experiments on several public datasets and our benchmark demonstrate that our method outputs not only visually appealing fusion but also higher detection mAP than the state-of-the-art approaches. The source code and benchmark are available at https://github.com/dlut-dimt/TarDAL."
433,81,81,2022,LLM.int8(): 8-bit Matrix Multiplication for Transformers at Scale,"Tim Dettmers, M. Lewis, Younes Belkada, Luke Zettlemoyer",Advances in Neural Information Processing Systems 35,2022-08-15,1074,105,230.85,Foundation Models and Large Language Models,transformer,foundation-models,Large language models have been widely adopted but require significant GPU memory for inference.,"high citation signal (1,074); influential citation signal (105); open-access PDF metadata","Capability gains are difficult to separate from data scale, benchmark leakage, and evaluation prompt sensitivity.; Alignment and safety claims often need stronger real-world and multilingual validation.; Compute-intensive training can limit reproducibility and concentrate follow-up work around a small number of institutions.",https://doi.org/10.48550/arXiv.2208.07339,https://www.semanticscholar.org/paper/4be7d1524edb0137599a5cc95f72844b85a52fe1,https://arxiv.org/pdf/2208.07339,10.48550/arXiv.2208.07339,2208.07339,,251564521,Computer Science,JournalArticle,large language models,1,citations=1074; influential=105; resource signal; open PDF metadata; title AI matches=2; AI term matches=4,"Large language models have been widely adopted but require significant GPU memory for inference. We develop a procedure for Int8 matrix multiplication for feed-forward and attention projection layers in transformers, which cut the memory needed for inference by half while retaining full precision performance. With our method, a 175B parameter 16/32-bit checkpoint can be loaded, converted to Int8, and used immediately without performance degradation. This is made possible by understanding and working around properties of highly systematic emergent features in transformer language models that dominate attention and transformer predictive performance. To cope with these features, we develop a two-part quantization procedure, LLM.int8(). We first use vector-wise quantization with separate normalization constants for each inner product in the matrix multiplication, to quantize most of the features. However, for the emergent outliers, we also include a new mixed-precision decomposition scheme, which isolates the outlier feature dimensions into a 16-bit matrix multiplication while still more than 99.9% of values are multiplied in 8-bit. Using LLM.int8(), we show empirically it is possible to perform inference in LLMs with up to 175B parameters without any performance degradation. This result makes such models much more accessible, for example making it possible to use OPT-175B/BLOOM on a single server with consumer GPUs. We open-source our software."
434,82,82,2022,Plug-and-Play Diffusion Features for Text-Driven Image-to-Image Translation,"Narek Tumanyan, Michal Geyer, Shai Bagon, Tali Dekel",Computer Vision and Pattern Recognition,2022-11-22,1073,138,238.624,Generative Models and Synthetic Media,transformer; generative,foundation-models; generative-ai; nlp; vision; reinforcement-learning,"Large-scale text-to-image generative models have been a revolutionary breakthrough in the evolution of generative AI, synthesizing diverse images with highly complex visual concepts.","high citation signal (1,073); influential citation signal (138); recognized venue; open-access PDF metadata","Image and media quality metrics may not capture factuality, controllability, provenance, or downstream harms.; Training data provenance and copyright constraints can be under-specified in highly cited generation work.; Robust evaluation across cultures, modalities, and adversarial uses remains difficult.",https://doi.org/10.1109/CVPR52729.2023.00191,https://www.semanticscholar.org/paper/b000d6865db824af1563708fb7a545ddd65c6b3a,https://arxiv.org/pdf/2211.12572,10.1109/CVPR52729.2023.00191,2211.12572,,253801961,Computer Science,JournalArticle; Conference,generative AI diffusion models,1,citations=1073; influential=138; recognized venue; open PDF metadata; AI term matches=5,"Large-scale text-to-image generative models have been a revolutionary breakthrough in the evolution of generative AI, synthesizing diverse images with highly complex visual concepts. However, a pivotal challenge in leveraging such models for real-world content creation is providing users with control over the generated content. In this paper, we present a new framework that takes text-to- image synthesis to the realm of image-to-image translation - given a guidance image and a target text prompt as input, our method harnesses the power of a pre-trained text-to-image diffusion model to generate a new image that complies with the target text, while preserving the semantic layout of the guidance image. Specifically, we observe and empirically demonstrate that fine-grained control over the generated structure can be achieved by manipulating spatial features and their self-attention inside the model. This results in a simple and effective approach, where features extracted from the guidance image are directly injected into the generation process of the translated image, requiring no training or fine-tuning. We demonstrate high-quality results on versatile text-guided image translation tasks, including translating sketches, rough drawings and animations into realistic images, changing the class and appearance of objects in a given image, and modifying global qualities such as lighting and color."
