rank,yearRank,candidateRank,year,title,authors,venue,publicationDate,citationCount,influentialCitationCount,importanceScore,category,methodTags,keywordTags,keyIdea,strengths,limitations,url,semanticScholarUrl,openAccessPdf,githubUrl,doi,arxiv,pubmed,corpusId,fieldsOfStudy,publicationTypes,sourceQueries,queryHitCount,importanceReasons,abstract
182,22,22,2015,Spatial Transformer Networks,"Max Jaderberg, K. Simonyan, Andrew Zisserman, K. Kavukcuoglu",Neural Information Processing Systems,2015-06-05,8100,764,296.953,Natural Language Processing and Knowledge,transformer,nlp,"Convolutional Neural Networks define an exceptionally powerful class of models, but are still limited by the lack of ability to be spatially invariant to the input data in a computationally and parameter efficient manner.","high citation signal (8,100); influential citation signal (764)","Benchmark scores can hide brittle reasoning, retrieval failures, hallucination, and domain transfer issues.; Language coverage is often uneven, with English and high-resource domains overrepresented.; Evaluation can be sensitive to annotation protocols, prompt wording, and changing model APIs.",https://www.semanticscholar.org/paper/dbb6ded623159c867fbeca0772db7b2eb9489523,https://www.semanticscholar.org/paper/dbb6ded623159c867fbeca0772db7b2eb9489523,,,,1506.02025,,6099034,Computer Science; Mathematics,JournalArticle; Conference,neural networks,1,citations=8100; influential=764; open PDF metadata; title AI matches=1; AI term matches=3,"Convolutional Neural Networks define an exceptionally powerful class of models, but are still limited by the lack of ability to be spatially invariant to the input data in a computationally and parameter efficient manner. In this work we introduce a new learnable module, the Spatial Transformer, which explicitly allows the spatial manipulation of data within the network. This differentiable module can be inserted into existing convolutional architectures, giving neural networks the ability to actively spatially transform feature maps, conditional on the feature map itself, without any extra training supervision or modification to the optimisation process. We show that the use of spatial transformers results in models which learn invariance to translation, scale, rotation and more generic warping, resulting in state-of-the-art performance on several benchmarks, and for a number of classes of transformations."
183,23,23,2015,Trust Region Policy Optimization,"John Schulman, S. Levine, P. Abbeel, Michael I. Jordan, Philipp Moritz",International Conference on Machine Learning,2015-02-19,8047,1159,313.636,Reinforcement Learning and Agents,trustworthy-ai; reinforcement-learning,machine-learning; reinforcement-learning; trustworthy-ai,"In this article, we describe a method for optimizing control policies, with guaranteed monotonic improvement.","high citation signal (8,047); influential citation signal (1,159); recognized venue","Sample efficiency, reward misspecification, simulator bias, and safety under exploration remain persistent barriers.; Benchmark performance may not transfer to physical robots, human-facing tools, or open-ended environments.; Agentic systems need stronger evidence on reliability, recovery from errors, and long-horizon oversight.",https://www.semanticscholar.org/paper/449532187c94af3dd3aa55e16d2c50f7854d2199,https://www.semanticscholar.org/paper/449532187c94af3dd3aa55e16d2c50f7854d2199,,,,1502.05477,,16046818,Computer Science; Mathematics,JournalArticle; Conference,neural networks,1,citations=8047; influential=1159; recognized venue; translation/trustworthiness signal; open PDF metadata; AI term matches=3,"In this article, we describe a method for optimizing control policies, with guaranteed monotonic improvement. By making several approximations to the theoretically-justified scheme, we develop a practical algorithm, called Trust Region Policy Optimization (TRPO). This algorithm is effective for optimizing large nonlinear policies such as neural networks. Our experiments demonstrate its robust performance on a wide variety of tasks: learning simulated robotic swimming, hopping, and walking gaits; and playing Atari games using images of the screen as input. Despite its approximations that deviate from the theory, TRPO tends to give monotonic improvement, with little tuning of hyperparameters."
191,24,24,2015,Learning both Weights and Connections for Efficient Neural Network,"Song Han, Jeff Pool, J. Tran, W. Dally",Neural Information Processing Systems,2015-06-08,7746,739,302.504,Foundation Models and Large Language Models,benchmark/dataset,machine-learning,"Neural networks are both computationally intensive and memory intensive, making them difficult to deploy on embedded systems.","high citation signal (7,746); influential citation signal (739)","Capability gains are difficult to separate from data scale, benchmark leakage, and evaluation prompt sensitivity.; Alignment and safety claims often need stronger real-world and multilingual validation.; Compute-intensive training can limit reproducibility and concentrate follow-up work around a small number of institutions.",https://www.semanticscholar.org/paper/1ff9a37d766e3a4f39757f5e1b235a42dacf18ff,https://www.semanticscholar.org/paper/1ff9a37d766e3a4f39757f5e1b235a42dacf18ff,,,,1506.02626,,2238772,Computer Science,JournalArticle; Conference,neural networks,1,citations=7746; influential=739; survey/benchmark signal; resource signal; open PDF metadata; title AI matches=1; AI term matches=2,"Neural networks are both computationally intensive and memory intensive, making them difficult to deploy on embedded systems. Also, conventional networks fix the architecture before training starts; as a result, training cannot improve the architecture. To address these limitations, we describe a method to reduce the storage and computation required by neural networks by an order of magnitude without affecting their accuracy by learning only the important connections. Our method prunes redundant connections using a three-step method. First, we train the network to learn which connections are important. Next, we prune the unimportant connections. Finally, we retrain the network to fine tune the weights of the remaining connections. On the ImageNet dataset, our method reduced the number of parameters of AlexNet by a factor of 9x, from 61 million to 6.7 million, without incurring accuracy loss. Similar experiments with VGG-16 found that the number of parameters can be reduced by 13x, from 138 million to 10.3 million, again with no loss of accuracy."
209,25,25,2015,Character-level Convolutional Networks for Text Classification,"Xiang Zhang, J. Zhao, Yann LeCun",Neural Information Processing Systems,2015-09-04,7121,1048,301.539,Natural Language Processing and Knowledge,metadata-ranked,machine-learning; nlp,This article offers an empirical exploration on the use of character-level convolutional networks (ConvNets) for text classification.,"high citation signal (7,121); influential citation signal (1,048)","Benchmark scores can hide brittle reasoning, retrieval failures, hallucination, and domain transfer issues.; Language coverage is often uneven, with English and high-resource domains overrepresented.; Evaluation can be sensitive to annotation protocols, prompt wording, and changing model APIs.",https://www.semanticscholar.org/paper/51a55df1f023571a7e07e338ee45a3e3d66ef73e,https://www.semanticscholar.org/paper/51a55df1f023571a7e07e338ee45a3e3d66ef73e,,,,1509.01626,,368182,Computer Science; Mathematics,JournalArticle; Conference,deep learning; neural networks,2,citations=7121; influential=1048; open PDF metadata; title AI matches=1; AI term matches=4; query hits=2,"This article offers an empirical exploration on the use of character-level convolutional networks (ConvNets) for text classification. We constructed several large-scale datasets to show that character-level convolutional networks could achieve state-of-the-art or competitive results. Comparisons are offered against traditional models such as bag of words, n-grams and their TFIDF variants, and deep learning models such as word-based ConvNets and recurrent neural networks."
213,26,26,2015,Accurate Image Super-Resolution Using Very Deep Convolutional Networks,"Jiwon Kim, Jung Kwon Lee, Kyoung Mu Lee",Computer Vision and Pattern Recognition,2015-11-14,7027,1122,307.201,Vision and Multimodal Learning,metadata-ranked,machine-learning; vision,We present a highly accurate single-image superresolution (SR) method.,"high citation signal (7,027); influential citation signal (1,122); recognized venue; open-access PDF metadata","Large-scale benchmark success can overstate robustness under distribution shift, rare classes, and real deployment constraints.; Multimodal alignment may inherit biases and spurious correlations from web-scale data.; High-performing systems often require data and compute resources that are hard for smaller labs to reproduce.",https://doi.org/10.1109/CVPR.2016.182,https://www.semanticscholar.org/paper/b5f3e5d2912bedbcd9458952d664b08db6aed962,https://arxiv.org/pdf/1511.04587,,10.1109/CVPR.2016.182,1511.04587,,9971732,Computer Science; Engineering,JournalArticle; Conference,deep learning,1,citations=7027; influential=1122; recognized venue; open PDF metadata; AI term matches=3,"We present a highly accurate single-image superresolution (SR) method. Our method uses a very deep convolutional network inspired by VGG-net used for ImageNet classification [19]. We find increasing our network depth shows a significant improvement in accuracy. Our final model uses 20 weight layers. By cascading small filters many times in a deep network structure, contextual information over large image regions is exploited in an efficient way. With very deep networks, however, convergence speed becomes a critical issue during training. We propose a simple yet effective training procedure. We learn residuals only and use extremely high learning rates (104 times higher than SRCNN [6]) enabled by adjustable gradient clipping. Our proposed method performs better than existing methods in accuracy and visual improvements in our results are easily noticeable."
242,27,27,2015,LSTM: A Search Space Odyssey,"Klaus Greff, R. Srivastava, Jan Koutník, Bas R. Steunebrink, J. Schmidhuber",IEEE Transactions on Neural Networks and Learning Systems,2015-03-13,6214,308,289.431,Natural Language Processing and Knowledge,metadata-ranked,machine-learning; nlp,Several variants of the long short-term memory (LSTM) architecture for recurrent neural networks have been proposed since its inception in 1995.,"high citation signal (6,214); influential citation signal (308); recognized venue; open-access PDF metadata","Benchmark scores can hide brittle reasoning, retrieval failures, hallucination, and domain transfer issues.; Language coverage is often uneven, with English and high-resource domains overrepresented.; Evaluation can be sensitive to annotation protocols, prompt wording, and changing model APIs.",https://doi.org/10.1109/tnnls.2016.2582924,https://www.semanticscholar.org/paper/a7976c2bacfbb194ddbe7fd10c2e50a545cf4081,https://arxiv.org/pdf/1503.04069,,10.1109/tnnls.2016.2582924,1503.04069,27411231,3356463,Computer Science; Medicine,JournalArticle,machine learning; neural networks,2,citations=6214; influential=308; recognized venue; open PDF metadata; AI term matches=4; query hits=2,"Several variants of the long short-term memory (LSTM) architecture for recurrent neural networks have been proposed since its inception in 1995. In recent years, these networks have become the state-of-the-art models for a variety of machine learning problems. This has led to a renewed interest in understanding the role and utility of various computational components of typical LSTM variants. In this paper, we present the first large-scale analysis of eight LSTM variants on three representative tasks: speech recognition, handwriting recognition, and polyphonic music modeling. The hyperparameters of all LSTM variants for each task were optimized separately using random search, and their importance was assessed using the powerful functional ANalysis Of VAriance framework. In total, we summarize the results of 5400 experimental runs ( $\approx 15$ years of CPU time), which makes our study the largest of its kind on LSTM networks. Our results show that none of the variants can improve upon the standard LSTM architecture significantly, and demonstrate the forget gate and the output activation function to be its most critical components. We further observe that the studied hyperparameters are virtually independent and derive guidelines for their efficient adjustment."
248,28,28,2015,Fast and Accurate Deep Network Learning by Exponential Linear Units (ELUs),"Djork-Arné Clevert, Thomas Unterthiner, Sepp Hochreiter",International Conference on Learning Representations,2015-11-23,6108,569,292.624,"Trustworthy, Explainable, and Responsible AI",trustworthy-ai,machine-learning; trustworthy-ai,"We introduce the ""exponential linear unit"" (ELU) which speeds up learning in deep neural networks and leads to higher classification accuracies.","high citation signal (6,108); influential citation signal (569)","Explanations can be persuasive without being faithful to model internals or decision processes.; Fairness, robustness, privacy, and safety metrics can conflict and require domain-specific tradeoffs.; Responsible AI results often need stronger deployment evidence beyond benchmark or synthetic settings.",https://www.semanticscholar.org/paper/f63e917638553414526a0cc8550de4ad2d83fe7a,https://www.semanticscholar.org/paper/f63e917638553414526a0cc8550de4ad2d83fe7a,,,,1511.07289,,5273326,Computer Science; Mathematics,JournalArticle,deep learning; neural networks,2,citations=6108; influential=569; resource signal; translation/trustworthiness signal; open PDF metadata; AI term matches=3; query hits=2,"We introduce the ""exponential linear unit"" (ELU) which speeds up learning in deep neural networks and leads to higher classification accuracies. Like rectified linear units (ReLUs), leaky ReLUs (LReLUs) and parametrized ReLUs (PReLUs), ELUs alleviate the vanishing gradient problem via the identity for positive values. However, ELUs have improved learning characteristics compared to the units with other activation functions. In contrast to ReLUs, ELUs have negative values which allows them to push mean unit activations closer to zero like batch normalization but with lower computational complexity. Mean shifts toward zero speed up learning by bringing the normal gradient closer to the unit natural gradient because of a reduced bias shift effect. While LReLUs and PReLUs have negative values, too, they do not ensure a noise-robust deactivation state. ELUs saturate to a negative value with smaller inputs and thereby decrease the forward propagated variation and information. Therefore, ELUs code the degree of presence of particular phenomena in the input, while they do not quantitatively model the degree of their absence. In experiments, ELUs lead not only to faster learning, but also to significantly better generalization performance than ReLUs and LReLUs on networks with more than 5 layers. On CIFAR-100 ELUs networks significantly outperform ReLU networks with batch normalization while batch normalization does not improve ELU networks. ELU networks are among the top 10 reported CIFAR-10 results and yield the best published result on CIFAR-100, without resorting to multi-view evaluation or model averaging. On ImageNet, ELU networks considerably speed up learning compared to a ReLU network with the same architecture, obtaining less than 10% classification error for a single crop, single model network."
260,29,29,2015,Recent advances in convolutional neural networks,"Jiuxiang Gu, Zhenhua Wang, Jason Kuen, Lianyang Ma, Amir Shahroudy, Bing Shuai, Ting Liu, Xingxing Wang, et al.",Pattern Recognition,2015-12-22,5977,182,295.241,Vision and Multimodal Learning,survey/review,machine-learning; nlp; vision,"In the last few years, deep learning has led to very good performance on a variety of problems, such as visual recognition, speech recognition and natural language processing.","high citation signal (5,977); influential citation signal (182); recognized venue; open-access PDF metadata","Large-scale benchmark success can overstate robustness under distribution shift, rare classes, and real deployment constraints.; Multimodal alignment may inherit biases and spurious correlations from web-scale data.; High-performing systems often require data and compute resources that are hard for smaller labs to reproduce.",https://doi.org/10.1016/J.PATCOG.2017.10.013,https://www.semanticscholar.org/paper/1193317829bfcc9b9dffa5ae85a2e2114254b37e,http://arxiv.org/pdf/1512.07108,,10.1016/J.PATCOG.2017.10.013,1512.07108,,3879949,Computer Science,JournalArticle; Review,computer vision; deep learning; natural language processing; neural networks,4,citations=5977; influential=182; recognized venue; survey/benchmark signal; open PDF metadata; title AI matches=2; AI term matches=7; query hits=4,"In the last few years, deep learning has led to very good performance on a variety of problems, such as visual recognition, speech recognition and natural language processing. Among different types of deep neural networks, convolutional neural networks have been most extensively studied. Leveraging on the rapid growth in the amount of the annotated data and the great improvements in the strengths of graphics processor units, the research on convolutional neural networks has been emerged swiftly and achieved state-of-the-art results on various tasks. In this paper, we provide a broad survey of the recent advances in convolutional neural networks. We detailize the improvements of CNN on different aspects, including layer design, activation function, loss function, regularization, optimization and fast computation. Besides, we also introduce various applications of convolutional neural networks in computer vision, speech and natural language processing."
266,30,30,2015,Learning Transferable Features with Deep Adaptation Networks,"Mingsheng Long, Yue Cao, Jianmin Wang, Michael I. Jordan",International Conference on Machine Learning,2015-02-09,5954,741,308.755,"Representation, Self-Supervised, and Transfer Learning",benchmark/dataset,machine-learning; vision; trustworthy-ai,Recent studies reveal that a deep neural network can learn transferable features which generalize well to novel tasks for domain adaptation.,"high citation signal (5,954); influential citation signal (741); recognized venue","Transfer claims depend heavily on downstream task choice, data overlap, and evaluation protocol.; Contrastive and self-supervised methods can learn spurious shortcuts when augmentations or negatives are poorly matched.; Representation quality is hard to compare when model size, data scale, and training recipes differ.",https://www.semanticscholar.org/paper/7340f090f8a0df5b109682e9f6d57e4b8ca1a2f7,https://www.semanticscholar.org/paper/7340f090f8a0df5b109682e9f6d57e4b8ca1a2f7,,,,1502.02791,,556999,Computer Science; Mathematics,JournalArticle; Conference,deep learning; neural networks,2,citations=5954; influential=741; recognized venue; survey/benchmark signal; resource signal; open PDF metadata; AI term matches=4; query hits=2,"Recent studies reveal that a deep neural network can learn transferable features which generalize well to novel tasks for domain adaptation. However, as deep features eventually transition from general to specific along the network, the feature transferability drops significantly in higher layers with increasing domain discrepancy. Hence, it is important to formally reduce the dataset bias and enhance the transferability in task-specific layers. In this paper, we propose a new Deep Adaptation Network (DAN) architecture, which generalizes deep convolutional neural network to the domain adaptation scenario. In DAN, hidden representations of all task-specific layers are embedded in a reproducing kernel Hilbert space where the mean embeddings of different domain distributions can be explicitly matched. The domain discrepancy is further reduced using an optimal multikernel selection method for mean embedding matching. DAN can learn transferable features with statistical guarantees, and can scale linearly by unbiased estimate of kernel embedding. Extensive empirical evidence shows that the proposed architecture yields state-of-the-art image classification error rates on standard domain adaptation benchmarks."
287,31,31,2015,DeepFool: A Simple and Accurate Method to Fool Deep Neural Networks,"Seyed-Mohsen Moosavi-Dezfooli, Alhussein Fawzi, P. Frossard",Computer Vision and Pattern Recognition,2015-11-14,5434,572,304.126,Vision and Multimodal Learning,trustworthy-ai,machine-learning; vision; trustworthy-ai; github,State-of-the-art deep neural networks have achieved impressive results on many image classification tasks.,"high citation signal (5,434); influential citation signal (572); recognized venue; open-access PDF metadata","Large-scale benchmark success can overstate robustness under distribution shift, rare classes, and real deployment constraints.; Multimodal alignment may inherit biases and spurious correlations from web-scale data.; High-performing systems often require data and compute resources that are hard for smaller labs to reproduce.",https://doi.org/10.1109/CVPR.2016.282,https://www.semanticscholar.org/paper/52693bcf4627bdbc31734e7f3dbcf5ea7eef4d35,https://arxiv.org/pdf/1511.04599,https://github.com/LTS4/DeepFool,10.1109/CVPR.2016.282,1511.04599,,12387176,Computer Science,JournalArticle; Conference,neural networks,1,citations=5434; influential=572; recognized venue; translation/trustworthiness signal; open PDF metadata; title AI matches=2; AI term matches=8,"State-of-the-art deep neural networks have achieved impressive results on many image classification tasks. However, these same architectures have been shown to be unstable to small, well sought, perturbations of the images. Despite the importance of this phenomenon, no effective methods have been proposed to accurately compute the robustness of state-of-the-art deep classifiers to such perturbations on large-scale datasets. In this paper, we fill this gap and propose the DeepFool algorithm to efficiently compute perturbations that fool deep networks, and thus reliably quantify the robustness of these classifiers. Extensive experimental results show that our approach outperforms recent methods in the task of computing adversarial perturbations and making classifiers more robust."
333,32,32,2015,On Pixel-Wise Explanations for Non-Linear Classifier Decisions by Layer-Wise Relevance Propagation,"Sebastian Bach, Alexander Binder, G. Montavon, Frederick Klauschen, K. Müller, W. Samek",PLoS ONE,2015-07-10,4933,527,282.853,Vision and Multimodal Learning,metadata-ranked,machine-learning; generative-ai; vision,"Understanding and interpreting classification decisions of automated image classification systems is of high value in many applications, as it allows to verify the reasoning of the system and provides additional information to the human expert.","high citation signal (4,933); influential citation signal (527); open-access PDF metadata","Large-scale benchmark success can overstate robustness under distribution shift, rare classes, and real deployment constraints.; Multimodal alignment may inherit biases and spurious correlations from web-scale data.; High-performing systems often require data and compute resources that are hard for smaller labs to reproduce.",https://doi.org/10.1371/journal.pone.0130140,https://www.semanticscholar.org/paper/17a273bbd4448083b01b5a9389b3c37f5425aac0,https://journals.plos.org/plosone/article/file?id=10.1371/journal.pone.0130140&type=printable,,10.1371/journal.pone.0130140,,26161953,9327892,Computer Science; Medicine,JournalArticle,machine learning; neural networks,2,citations=4933; influential=527; open PDF metadata; AI term matches=5; query hits=2,"Understanding and interpreting classification decisions of automated image classification systems is of high value in many applications, as it allows to verify the reasoning of the system and provides additional information to the human expert. Although machine learning methods are solving very successfully a plethora of tasks, they have in most cases the disadvantage of acting as a black box, not providing any information about what made them arrive at a particular decision. This work proposes a general solution to the problem of understanding classification decisions by pixel-wise decomposition of nonlinear classifiers. We introduce a methodology that allows to visualize the contributions of single pixels to predictions for kernel-based classifiers over Bag of Words features and for multilayered neural networks. These pixel contributions can be visualized as heatmaps and are provided to a human expert who can intuitively not only verify the validity of the classification decision, but also focus further analysis on regions of potential interest. We evaluate our method for classifiers trained on PASCAL VOC 2009 images, synthetic image data containing geometric shapes, the MNIST handwritten digits data set and for the pre-trained ImageNet model available as part of the Caffe open source package."
