rank,yearRank,candidateRank,year,title,authors,venue,publicationDate,citationCount,influentialCitationCount,importanceScore,category,methodTags,keywordTags,keyIdea,strengths,limitations,url,semanticScholarUrl,openAccessPdf,doi,arxiv,pubmed,corpusId,fieldsOfStudy,publicationTypes,sourceQueries,queryHitCount,importanceReasons,abstract
252,48,48,2021,Generalizing to Unseen Domains: A Survey on Domain Generalization,"Jindong Wang, Cuiling Lan, Chang Liu, Yidong Ouyang, Tao Qin",IEEE Transactions on Knowledge and Data Engineering,2021-03-02,1749,86,244.805,"Representation, Self-Supervised, and Transfer Learning",survey/review,foundation-models,Machine learning systems generally assume that the training and testing distributions are the same.,"high citation signal (1,749); influential citation signal (86); recognized venue; open-access PDF metadata","Transfer claims depend heavily on downstream task choice, data overlap, and evaluation protocol.; Contrastive and self-supervised methods can learn spurious shortcuts when augmentations or negatives are poorly matched.; Representation quality is hard to compare when model size, data scale, and training recipes differ.",https://doi.org/10.1109/TKDE.2022.3178128,https://www.semanticscholar.org/paper/93884d89dfc8c3886f642018227a43fb7b58044f,https://arxiv.org/pdf/2103.03097,10.1109/TKDE.2022.3178128,2103.03097,,232110832,Computer Science,JournalArticle; Review,machine learning,1,citations=1749; influential=86; recognized venue; survey/benchmark signal; open PDF metadata; AI term matches=2,"Machine learning systems generally assume that the training and testing distributions are the same. To this end, a key requirement is to develop models that can generalize to unseen distributions. Domain generalization (DG), i.e., out-of-distribution generalization, has attracted increasing interests in recent years. Domain generalization deals with a challenging setting where one or several different but related domain(s) are given, and the goal is to learn a model that can generalize to an unseen test domain. Great progress has been made in the area of domain generalization for years. This paper presents the first review of recent advances in this area. First, we provide a formal definition of domain generalization and discuss several related fields. We then thoroughly review the theories related to domain generalization and carefully analyze the theory behind generalization. We categorize recent algorithms into three classes: data manipulation, representation learning, and learning strategy, and present several popular algorithms in detail for each category. Third, we introduce the commonly used datasets, applications, and our open-sourced codebase for fair evaluation. Finally, we summarize existing literature and present some potential research topics for the future."
254,49,49,2021,CLIP-Adapter: Better Vision-Language Models with Feature Adapters,"Peng Gao, Shijie Geng, Renrui Zhang, Teli Ma, Rongyao Fang, Yongfeng Zhang, Hongsheng Li, Y. Qiao",International Journal of Computer Vision,2021-10-09,1747,193,250.007,Foundation Models and Large Language Models,self-supervised,foundation-models; multimodal; nlp; vision,Large-scale contrastive vision-language pretraining has shown significant progress in visual representation learning.,"high citation signal (1,747); influential citation signal (193)","Capability gains are difficult to separate from data scale, benchmark leakage, and evaluation prompt sensitivity.; Alignment and safety claims often need stronger real-world and multilingual validation.; Compute-intensive training can limit reproducibility and concentrate follow-up work around a small number of institutions.",https://doi.org/10.1007/s11263-023-01891-x,https://www.semanticscholar.org/paper/c04067f03fba2df0c14ea51a170f213eb2983708,,10.1007/s11263-023-01891-x,2110.04544,,238583492,Computer Science,JournalArticle,large language models; machine learning,2,citations=1747; influential=193; open PDF metadata; title AI matches=1; AI term matches=7; query hits=2,"Large-scale contrastive vision-language pretraining has shown significant progress in visual representation learning. Unlike traditional visual systems trained by a fixed set of discrete labels, a new paradigm was introduced in Radford et al. (International conference on machine learning, PMLR, 2021) to directly learn to align images with raw texts in an open-vocabulary setting. On downstream tasks, a carefully chosen text prompt is employed to make zero-shot predictions. To avoid non-trivial prompt engineering, context optimization (Zhou et al. in Int J Comput Vis 130(9):2337–2348, 2022) has been proposed to learn continuous vectors as task-specific prompts with few-shot training examples. In this paper, we show that there is an alternative path to achieve better vision-language models other than prompt tuning. While prompt tuning is for the textual inputs, we propose CLIP-Adapter to conduct fine-tuning with feature adapters on either visual or language branch. Specifically, CLIP-Adapter adopts an additional bottleneck layer to learn new features and performs residual-style feature blending with the original pretrained features. As a consequence, CLIP-Adapter is able to outperform context optimization while maintaining a simple design. Experiments and extensive ablation studies on various visual classification tasks demonstrate the effectiveness of our approach."
260,50,50,2021,Improving language models by retrieving from trillions of tokens,"Sebastian Borgeaud, Arthur Mensch, Jordan Hoffmann, Trevor Cai, Eliza Rutherford, Katie Millican, George van den Driessche, Jean-Baptiste Lespiau, et al.",International Conference on Machine Learning,2021-12-08,1730,111,249.101,Foundation Models and Large Language Models,benchmark/dataset; transformer; retrieval,foundation-models; nlp,"We enhance auto-regressive language models by conditioning on document chunks retrieved from a large corpus, based on local similarity with preceding tokens.","high citation signal (1,730); influential citation signal (111); recognized venue","Capability gains are difficult to separate from data scale, benchmark leakage, and evaluation prompt sensitivity.; Alignment and safety claims often need stronger real-world and multilingual validation.; Compute-intensive training can limit reproducibility and concentrate follow-up work around a small number of institutions.",https://www.semanticscholar.org/paper/002c256d30d6be4b23d365a8de8ae0e67e4c9641,https://www.semanticscholar.org/paper/002c256d30d6be4b23d365a8de8ae0e67e4c9641,,,2112.04426,,244954723,Computer Science,JournalArticle; Conference,large language models,1,citations=1730; influential=111; recognized venue; resource signal; open PDF metadata; title AI matches=1; AI term matches=3,"We enhance auto-regressive language models by conditioning on document chunks retrieved from a large corpus, based on local similarity with preceding tokens. With a $2$ trillion token database, our Retrieval-Enhanced Transformer (RETRO) obtains comparable performance to GPT-3 and Jurassic-1 on the Pile, despite using 25$\times$ fewer parameters. After fine-tuning, RETRO performance translates to downstream knowledge-intensive tasks such as question answering. RETRO combines a frozen Bert retriever, a differentiable encoder and a chunked cross-attention mechanism to predict tokens based on an order of magnitude more data than what is typically consumed during training. We typically train RETRO from scratch, yet can also rapidly RETROfit pre-trained transformers with retrieval and still achieve good performance. Our work opens up new avenues for improving language models through explicit memory at unprecedented scale."
265,51,51,2021,Model-Contrastive Federated Learning,"Qinbin Li, Bingsheng He, D. Song",Computer Vision and Pattern Recognition,2021-03-30,1696,250,261.962,"Representation, Self-Supervised, and Transfer Learning",self-supervised,vision,Federated learning enables multiple parties to collaboratively train a machine learning model without communicating their local data.,"high citation signal (1,696); influential citation signal (250); recognized venue; open-access PDF metadata","Transfer claims depend heavily on downstream task choice, data overlap, and evaluation protocol.; Contrastive and self-supervised methods can learn spurious shortcuts when augmentations or negatives are poorly matched.; Representation quality is hard to compare when model size, data scale, and training recipes differ.",https://doi.org/10.1109/CVPR46437.2021.01057,https://www.semanticscholar.org/paper/748c4f1945b0d994ecef38c8aac01db1c6dc7029,https://arxiv.org/pdf/2103.16257,10.1109/CVPR46437.2021.01057,2103.16257,,232417422,Computer Science,JournalArticle; Conference,deep learning; machine learning,2,citations=1696; influential=250; recognized venue; open PDF metadata; title AI matches=1; AI term matches=6; query hits=2,"Federated learning enables multiple parties to collaboratively train a machine learning model without communicating their local data. A key challenge in federated learning is to handle the heterogeneity of local data distribution across parties. Although many studies have been proposed to address this challenge, we find that they fail to achieve high performance in image datasets with deep learning models. In this paper, we propose MOON: model-contrastive federated learning. MOON is a simple and effective federated learning framework. The key idea of MOON is to utilize the similarity between model representations to correct the local training of individual parties, i.e., conducting contrastive learning in model-level. Our extensive experiments show that MOON significantly outperforms the other state-of-the-art federated learning algorithms on various image classification tasks."
270,52,52,2021,A guide to machine learning for biologists,"Joe G. Greener, S. Kandathil, Lewis Moffat, David T. Jones",Nature reviews. Molecular cell biology,2021-09-13,1666,33,228.582,"AI for Science, Healthcare, and Robotics",ai4science,ai4science,"Positions A guide to machine learning for biologists within AI for Science, Healthcare, and Robotics.","high citation signal (1,666); influential citation signal (33); recognized venue; open-access PDF metadata","External validation, prospective testing, and domain expert review are often more important than retrospective benchmark scores.; Clinical, biological, or robotic deployment can fail when data collection protocols differ from training assumptions.; Safety, interpretability, uncertainty, and regulatory evidence remain essential for translation.",https://doi.org/10.1038/s41580-021-00407-0,https://www.semanticscholar.org/paper/80d9f0eb47b712988d19cbe29a7bfa63f2a175d0,https://discovery.ucl.ac.uk/10134478/1/NRMCB-review-accepted-forRPS.pdf,10.1038/s41580-021-00407-0,,34518686,237504441,Biology; Computer Science; Medicine,Review; JournalArticle,deep learning; machine learning,2,citations=1666; influential=33; recognized venue; open PDF metadata; title AI matches=1; AI term matches=1; query hits=2,
280,53,53,2021,CoAtNet: Marrying Convolution and Attention for All Data Sizes,"Zihang Dai, Hanxiao Liu, Quoc V. Le, Mingxing Tan",Neural Information Processing Systems,2021-06-09,1630,141,235.114,Vision and Multimodal Learning,transformer,vision; trustworthy-ai,"Transformers have attracted increasing interests in computer vision, but they still fall behind state-of-the-art convolutional networks.","high citation signal (1,630); influential citation signal (141)","Large-scale benchmark success can overstate robustness under distribution shift, rare classes, and real deployment constraints.; Multimodal alignment may inherit biases and spurious correlations from web-scale data.; High-performing systems often require data and compute resources that are hard for smaller labs to reproduce.",https://www.semanticscholar.org/paper/9f4b69762ffb1ba42b573fd4ced996f3153e21c0,https://www.semanticscholar.org/paper/9f4b69762ffb1ba42b573fd4ced996f3153e21c0,,,2106.04803,,235376986,Computer Science,JournalArticle,computer vision,1,citations=1630; influential=141; open PDF metadata; AI term matches=2,"Transformers have attracted increasing interests in computer vision, but they still fall behind state-of-the-art convolutional networks. In this work, we show that while Transformers tend to have larger model capacity, their generalization can be worse than convolutional networks due to the lack of the right inductive bias. To effectively combine the strengths from both architectures, we present CoAtNets(pronounced""coat""nets), a family of hybrid models built from two key insights: (1) depthwise Convolution and self-Attention can be naturally unified via simple relative attention; (2) vertically stacking convolution layers and attention layers in a principled way is surprisingly effective in improving generalization, capacity and efficiency. Experiments show that our CoAtNets achieve state-of-the-art performance under different resource constraints across various datasets: Without extra data, CoAtNet achieves 86.0% ImageNet top-1 accuracy; When pre-trained with 13M images from ImageNet-21K, our CoAtNet achieves 88.56% top-1 accuracy, matching ViT-huge pre-trained with 300M images from JFT-300M while using 23x less data; Notably, when we further scale up CoAtNet with JFT-3B, it achieves 90.88% top-1 accuracy on ImageNet, establishing a new state-of-the-art result."
282,54,54,2021,"Scaling Language Models: Methods, Analysis & Insights from Training Gopher","Jack W. Rae, Sebastian Borgeaud, Trevor Cai, Katie Millican, Jordan Hoffmann, Francis Song, John Aslanides, Sarah Henderson, et al.",arXiv.org,2021-12-08,1625,97,243.855,Foundation Models and Large Language Models,benchmark/dataset; transformer; trustworthy-ai,foundation-models; nlp; trustworthy-ai,Language modelling provides a step towards intelligent communication systems by harnessing large repositories of written human knowledge to better predict and understand the world.,"high citation signal (1,625); influential citation signal (97)","Capability gains are difficult to separate from data scale, benchmark leakage, and evaluation prompt sensitivity.; Alignment and safety claims often need stronger real-world and multilingual validation.; Compute-intensive training can limit reproducibility and concentrate follow-up work around a small number of institutions.",https://www.semanticscholar.org/paper/68f141724814839d556a989646194be88641b143,https://www.semanticscholar.org/paper/68f141724814839d556a989646194be88641b143,,,2112.11446,,245353475,Computer Science; Linguistics,JournalArticle,large language models,1,citations=1625; influential=97; survey/benchmark signal; resource signal; translation/trustworthiness signal; open PDF metadata; title AI matches=1; AI term matches=3,"Language modelling provides a step towards intelligent communication systems by harnessing large repositories of written human knowledge to better predict and understand the world. In this paper, we present an analysis of Transformer-based language model performance across a wide range of model scales -- from models with tens of millions of parameters up to a 280 billion parameter model called Gopher. These models are evaluated on 152 diverse tasks, achieving state-of-the-art performance across the majority. Gains from scale are largest in areas such as reading comprehension, fact-checking, and the identification of toxic language, but logical and mathematical reasoning see less benefit. We provide a holistic analysis of the training dataset and model's behaviour, covering the intersection of model scale with bias and toxicity. Finally we discuss the application of language models to AI safety and the mitigation of downstream harms."
286,55,55,2021,Classification Based on Decision Tree Algorithm for Machine Learning,"Bahzad Charbuty, A. Abdulazeez",Journal of Applied Science and Technology Trends,2021-03-24,1614,42,229.173,"AI for Science, Healthcare, and Robotics",ai4science,nlp; ai4science,Decision tree classifiers are regarded to be a standout of the most well-known methods to data classification representation of classifiers.,"high citation signal (1,614); influential citation signal (42); recognized venue; open-access PDF metadata","External validation, prospective testing, and domain expert review are often more important than retrospective benchmark scores.; Clinical, biological, or robotic deployment can fail when data collection protocols differ from training assumptions.; Safety, interpretability, uncertainty, and regulatory evidence remain essential for translation.",https://doi.org/10.38094/JASTT20165,https://www.semanticscholar.org/paper/0d6ef817813d04a3b3ec6c3ce008e104fb3e587a,https://www.jastt.org/index.php/jasttpath/article/download/65/24,10.38094/JASTT20165,,,233421415,Computer Science,,machine learning,1,citations=1614; influential=42; recognized venue; open PDF metadata; title AI matches=1; AI term matches=1,"Decision tree classifiers are regarded to be a standout of the most well-known methods to data classification representation of classifiers. Different researchers from various fields and backgrounds have considered the problem of extending a decision tree from available data, such as machine study, pattern recognition, and statistics. In various fields such as medical disease analysis, text classification, user smartphone classification, images, and many more the employment of Decision tree classifiers has been proposed in many ways. This paper provides a detailed approach to the decision trees. Furthermore, paper specifics, such as algorithms/approaches used, datasets, and outcomes achieved, are evaluated and outlined comprehensively. In addition, all of the approaches analyzed were discussed to illustrate the themes of the authors and identify the most accurate classifiers. As a result, the uses of different types of datasets are discussed and their findings are analyzed."
287,56,56,2021,"Geometric Deep Learning: Grids, Groups, Graphs, Geodesics, and Gauges","M. Bronstein, Joan Bruna, Taco Cohen, Petar Velivckovi'c",arXiv.org,2021-04-27,1613,102,239.389,"AI for Science, Healthcare, and Robotics",ai4science,nlp; vision; ai4science,"The last decade has witnessed an experimental revolution in data science and machine learning, epitomised by deep learning methods.","high citation signal (1,613); influential citation signal (102)","External validation, prospective testing, and domain expert review are often more important than retrospective benchmark scores.; Clinical, biological, or robotic deployment can fail when data collection protocols differ from training assumptions.; Safety, interpretability, uncertainty, and regulatory evidence remain essential for translation.",https://www.semanticscholar.org/paper/14014c024674991149f3ecf9314c93f7e029ef1a,https://www.semanticscholar.org/paper/14014c024674991149f3ecf9314c93f7e029ef1a,,,2104.13478,,233423603,Computer Science; Mathematics,JournalArticle,computer vision; deep learning; graph neural networks; machine learning,4,citations=1613; influential=102; open PDF metadata; title AI matches=1; AI term matches=5; query hits=4,"The last decade has witnessed an experimental revolution in data science and machine learning, epitomised by deep learning methods. Indeed, many high-dimensional learning tasks previously thought to be beyond reach -- such as computer vision, playing Go, or protein folding -- are in fact feasible with appropriate computational scale. Remarkably, the essence of deep learning is built from two simple algorithmic principles: first, the notion of representation or feature learning, whereby adapted, often hierarchical, features capture the appropriate notion of regularity for each task, and second, learning by local gradient-descent type methods, typically implemented as backpropagation. While learning generic functions in high dimensions is a cursed estimation problem, most tasks of interest are not generic, and come with essential pre-defined regularities arising from the underlying low-dimensionality and structure of the physical world. This text is concerned with exposing these regularities through unified geometric principles that can be applied throughout a wide spectrum of applications. Such a 'geometric unification' endeavour, in the spirit of Felix Klein's Erlangen Program, serves a dual purpose: on one hand, it provides a common mathematical framework to study the most successful neural network architectures, such as CNNs, RNNs, GNNs, and Transformers. On the other hand, it gives a constructive procedure to incorporate prior physical knowledge into neural architectures and provide principled way to build future architectures yet to be invented."
297,57,57,2021,A Survey of Quantization Methods for Efficient Neural Network Inference,"A. Gholami, Sehoon Kim, Zhen Dong, Z. Yao, Michael W. Mahoney, K. Keutzer",Low-Power Computer Vision,2021-03-25,1595,103,240.277,Generative Models and Synthetic Media,survey/review,nlp; vision,"As soon as abstract mathematical computations were adapted to computation on digital computers, the problem of efficient representation, manipulation, and communication of the numerical values in those computations arose.","high citation signal (1,595); influential citation signal (103); open-access PDF metadata","Image and media quality metrics may not capture factuality, controllability, provenance, or downstream harms.; Training data provenance and copyright constraints can be under-specified in highly cited generation work.; Robust evaluation across cultures, modalities, and adversarial uses remains difficult.",https://doi.org/10.1201/9781003162810-13,https://www.semanticscholar.org/paper/093253653cd0b55970c390d77b75137c4095dc29,https://arxiv.org/pdf/2103.13630,10.1201/9781003162810-13,2103.13630,,232352683,Computer Science; Mathematics,JournalArticle; Review,computer vision; natural language processing,2,citations=1595; influential=103; survey/benchmark signal; open PDF metadata; title AI matches=1; AI term matches=3; query hits=2,"As soon as abstract mathematical computations were adapted to computation on digital computers, the problem of efficient representation, manipulation, and communication of the numerical values in those computations arose. Strongly related to the problem of numerical representation is the problem of quantization: in what manner should a set of continuous real-valued numbers be distributed over a fixed discrete set of numbers to minimize the number of bits required and also to maximize the accuracy of the attendant computations? This perennial problem of quantization is particularly relevant whenever memory and/or computational resources are severely restricted, and it has come to the forefront in recent years due to the remarkable performance of Neural Network models in computer vision, natural language processing, and related areas. Moving from floating-point representations to low-precision fixed integer values represented in four bits or less holds the potential to reduce the memory footprint and latency by a factor of 16x; and, in fact, reductions of 4x to 8x are often realized in practice in these applications. Thus, it is not surprising that quantization has emerged recently as an important and very active sub-area of research in the efficient implementation of computations associated with Neural Networks. In this article, we survey approaches to the problem of quantizing the numerical values in deep Neural Network computations, covering the advantages/disadvantages of current methods. With this survey and its organization, we hope to have presented a useful snapshot of the current research in quantization for Neural Networks and to have given an intelligent organization to ease the evaluation of future research in this area."
