rank,yearRank,candidateRank,year,title,authors,venue,publicationDate,citationCount,influentialCitationCount,importanceScore,category,methodTags,keywordTags,keyIdea,strengths,limitations,url,semanticScholarUrl,openAccessPdf,githubUrl,doi,arxiv,pubmed,corpusId,fieldsOfStudy,publicationTypes,sourceQueries,queryHitCount,importanceReasons,abstract
1340,34,34,2009,Head Pose Estimation in Computer Vision: A Survey,"Erik Murphy-Chutorian, M. Trivedi",IEEE Transactions on Pattern Analysis and Machine Intelligence,2009-04-01,1404,92,241.908,Vision and Multimodal Learning,survey/review,vision,Positions Head Pose Estimation in Computer Vision: A Survey within Vision and Multimodal Learning.,"high citation signal (1,404); influential citation signal (92); recognized venue","Large-scale benchmark success can overstate robustness under distribution shift, rare classes, and real deployment constraints.; Multimodal alignment may inherit biases and spurious correlations from web-scale data.; High-performing systems often require data and compute resources that are hard for smaller labs to reproduce.",https://doi.org/10.1109/TPAMI.2008.106,https://www.semanticscholar.org/paper/cf87e167446bd22e9422445dfed4f74a3f0579f9,,,10.1109/TPAMI.2008.106,,19229078,6575064,Computer Science; Medicine,Review; JournalArticle,computer vision,1,citations=1404; influential=92; recognized venue; survey/benchmark signal; open PDF metadata; title AI matches=1; AI term matches=1,
1387,35,35,2009,Reinforcement learning and adaptive dynamic programming for feedback control,"F. Lewis, D. Vrabie",IEEE Circuits and Systems Magazine,2009-09-01,1326,81,223.889,Reinforcement Learning and Agents,reinforcement-learning,reinforcement-learning,Positions Reinforcement learning and adaptive dynamic programming for feedback control within Reinforcement Learning and Agents.,"high citation signal (1,326); influential citation signal (81)","Sample efficiency, reward misspecification, simulator bias, and safety under exploration remain persistent barriers.; Benchmark performance may not transfer to physical robots, human-facing tools, or open-ended environments.; Agentic systems need stronger evidence on reliability, recovery from errors, and long-horizon oversight.",https://doi.org/10.1109/MCAS.2009.933854,https://www.semanticscholar.org/paper/642b89cdc165de1b9dac019c76e2cac6efdc5f37,,,10.1109/MCAS.2009.933854,,,5947874,Computer Science; Engineering,,reinforcement learning,1,citations=1326; influential=81; open PDF metadata; title AI matches=1; AI term matches=1,
1403,36,36,2009,Application of data mining techniques in customer relationship management: A literature review and classification,"E. Ngai, Xiu Li, D. Chau",Expert systems with applications,2009-03-01,1303,55,226.165,General AI Methods and Systems,survey/review,machine-learning,Positions Application of data mining techniques in customer relationship management: A literature review and classification within General AI Methods and Systems.,"high citation signal (1,303); influential citation signal (55); open-access PDF metadata","Survey and infrastructure papers can dominate citations while empirical evidence remains distributed across subfields.; Broad claims need careful mapping to specific tasks, datasets, and operational constraints.; Metadata-driven ranking cannot replace expert reading of full papers and experimental details.",https://doi.org/10.1016/j.eswa.2008.02.021,https://www.semanticscholar.org/paper/b0300ea708c8115a6540fb183d49916c0fd4ae15,http://hdl.handle.net/10397/10212,,10.1016/j.eswa.2008.02.021,,,10198239,Business; Computer Science,JournalArticle; Review,data mining,1,citations=1303; influential=55; survey/benchmark signal; open PDF metadata; title AI matches=2; AI term matches=2,
1432,37,37,2009,Exploring Strategies for Training Deep Neural Networks,"H. Larochelle, Yoshua Bengio, J. Louradour, Pascal Lamblin",Journal of machine learning research,2009-06-01,1256,43,230.981,General AI Methods and Systems,metadata-ranked,machine-learning,Positions Exploring Strategies for Training Deep Neural Networks within General AI Methods and Systems.,"high citation signal (1,256); influential citation signal (43); recognized venue","Survey and infrastructure papers can dominate citations while empirical evidence remains distributed across subfields.; Broad claims need careful mapping to specific tasks, datasets, and operational constraints.; Metadata-driven ranking cannot replace expert reading of full papers and experimental details.",https://doi.org/10.5555/1577069.1577070,https://www.semanticscholar.org/paper/05fd1da7b2e34f86ec7f010bef068717ae964332,,,10.5555/1577069.1577070,,,996073,Computer Science; Mathematics,JournalArticle,deep learning; machine learning; neural networks,3,citations=1256; influential=43; recognized venue; open PDF metadata; title AI matches=2; AI term matches=3; query hits=3,
1436,38,38,2009,"Clustering high-dimensional data: A survey on subspace clustering, pattern-based clustering, and correlation clustering","H. Kriegel, Peer Kröger, Arthur Zimek",TKDD,2009-03-01,1251,52,231.499,General AI Methods and Systems,survey/review,machine-learning,"Positions Clustering high-dimensional data: A survey on subspace clustering, pattern-based clustering, and correlation clustering within General AI Methods and Systems.","high citation signal (1,251); influential citation signal (52); recognized venue","Survey and infrastructure papers can dominate citations while empirical evidence remains distributed across subfields.; Broad claims need careful mapping to specific tasks, datasets, and operational constraints.; Metadata-driven ranking cannot replace expert reading of full papers and experimental details.",https://doi.org/10.1145/1497577.1497578,https://www.semanticscholar.org/paper/bc20444f09186991b2b5f05a174c7aac4ec1dd25,,,10.1145/1497577.1497578,,,17363900,Computer Science; Mathematics,JournalArticle; Review,data mining,1,citations=1251; influential=52; recognized venue; survey/benchmark signal; open PDF metadata; title AI matches=1; AI term matches=1,
1470,39,39,2009,How to Explain Individual Classification Decisions,"D. Baehrens, T. Schroeter, S. Harmeling, M. Kawanabe, K. Hansen, K. Müller",Journal of machine learning research,2009-12-06,1182,62,228.672,"Graph Learning, Recommendation, and Core Methods",metadata-ranked,machine-learning,After building a classifier with modern tools of machine learning we typically have a black box at hand that is able to predict well for unseen data.,"high citation signal (1,182); influential citation signal (62); recognized venue","Graph and recommender benchmarks can contain temporal leakage, popularity bias, or unrealistic train/test splits.; Algorithmic gains may be sensitive to hyperparameter budgets and implementation details.; Core methods need careful ablations before broad claims about generality or efficiency are accepted.",https://doi.org/10.5555/1756006.1859912,https://www.semanticscholar.org/paper/4e6238c8613b5b81f81552939bce33296aedfbfe,,,10.5555/1756006.1859912,0912.1128,,14664111,Computer Science; Mathematics,JournalArticle,machine learning,1,citations=1182; influential=62; recognized venue; open PDF metadata; title AI matches=1; AI term matches=2,"After building a classifier with modern tools of machine learning we typically have a black box at hand that is able to predict well for unseen data. Thus, we get an answer to the question what is the most likely label of a given unseen data point. However, most methods will provide no answer why the model predicted a particular label for a single instance and what features were most influential for that particular instance. The only method that is currently able to provide such explanations are decision trees. This paper proposes a procedure which (based on a set of assumptions) allows to explain the decisions of any classification method."
1477,40,40,2009,Unsupervised feature learning for audio classification using convolutional deep belief networks,"Honglak Lee, Peter T. Pham, Yan Largman, A. Ng",Neural Information Processing Systems,2009-12-07,1174,49,214.287,General AI Methods and Systems,metadata-ranked,machine-learning,Positions Unsupervised feature learning for audio classification using convolutional deep belief networks within General AI Methods and Systems.,"high citation signal (1,174); influential citation signal (49)","Survey and infrastructure papers can dominate citations while empirical evidence remains distributed across subfields.; Broad claims need careful mapping to specific tasks, datasets, and operational constraints.; Metadata-driven ranking cannot replace expert reading of full papers and experimental details.",https://www.semanticscholar.org/paper/bf38dfb13352449b965c08282b66d3ffc5a0539f,https://www.semanticscholar.org/paper/bf38dfb13352449b965c08282b66d3ffc5a0539f,,,,,,12219023,Computer Science,JournalArticle; Conference,deep learning,1,citations=1174; influential=49; open PDF metadata; title AI matches=1; AI term matches=1,
1481,41,41,2009,Time series shapelets: a new primitive for data mining,"Lexiang Ye, Eamonn J. Keogh",Knowledge Discovery and Data Mining,2009-06-28,1167,150,229.629,General AI Methods and Systems,metadata-ranked,machine-learning,Positions Time series shapelets: a new primitive for data mining within General AI Methods and Systems.,"high citation signal (1,167); influential citation signal (150)","Survey and infrastructure papers can dominate citations while empirical evidence remains distributed across subfields.; Broad claims need careful mapping to specific tasks, datasets, and operational constraints.; Metadata-driven ranking cannot replace expert reading of full papers and experimental details.",https://doi.org/10.1145/1557019.1557122,https://www.semanticscholar.org/paper/9c40543348fef37369c5b19ea26994ca1db8d9e8,,,10.1145/1557019.1557122,,,5144823,Computer Science; Mathematics,JournalArticle; Conference,data mining,1,citations=1167; influential=150; open PDF metadata; title AI matches=1; AI term matches=1,
1500,42,42,2009,Reflex control of immunity,K. Tracey,Nature reviews. Immunology,2009-06-01,1138,59,225.155,Reinforcement Learning and Agents,metadata-ranked,reinforcement-learning,Inflammation can cause damage and even death.,"high citation signal (1,138); influential citation signal (59); recognized venue; open-access PDF metadata","Sample efficiency, reward misspecification, simulator bias, and safety under exploration remain persistent barriers.; Benchmark performance may not transfer to physical robots, human-facing tools, or open-ended environments.; Agentic systems need stronger evidence on reliability, recovery from errors, and long-horizon oversight.",https://doi.org/10.1038/nri2566,https://www.semanticscholar.org/paper/102018300acd7893209830cc2dd6c1e33924020f,https://europepmc.org/articles/pmc4535331?pdf=render,,10.1038/nri2566,,19461672,16354143,Biology; Medicine,Review; JournalArticle,neural networks,1,citations=1138; influential=59; recognized venue; open PDF metadata; AI term matches=2,"Inflammation can cause damage and even death. What controls this primitive and potentially lethal innate immune response to injury and infection? Molecular and neurophysiological studies during the past decade have revealed a pivotal answer: immunity is coordinated by neural circuits that operate reflexively. The afferent arc of the reflex consists of nerves that sense injury and infection. This activates efferent neural circuits, including the cholinergic anti-inflammatory pathway, that modulate immune responses and the progression of inflammatory diseases. It might be possible to develop therapeutics that target neural networks for the treatment of inflammatory disorders."
1501,43,43,2009,Machine Learning - An Algorithmic Perspective,S. Marsland,Chapman and Hall / CRC machine learning and pattern recognition series,,1135,129,237.921,General AI Methods and Systems,metadata-ranked,machine-learning,Positions Machine Learning - An Algorithmic Perspective within General AI Methods and Systems.,"high citation signal (1,135); influential citation signal (129); recognized venue","Survey and infrastructure papers can dominate citations while empirical evidence remains distributed across subfields.; Broad claims need careful mapping to specific tasks, datasets, and operational constraints.; Metadata-driven ranking cannot replace expert reading of full papers and experimental details.",https://www.semanticscholar.org/paper/ea86b804a5f4536d9646e4ac26898a43e35c6bc4,https://www.semanticscholar.org/paper/ea86b804a5f4536d9646e4ac26898a43e35c6bc4,,,,,,47125649,Computer Science,,machine learning,1,citations=1135; influential=129; recognized venue; open PDF metadata; title AI matches=1; AI term matches=2,
1510,44,44,2009,Generating Coherent Patterns of Activity from Chaotic Neural Networks,"David Sussillo, L. Abbott",Neuron,2009-08-27,1126,112,227.784,Reinforcement Learning and Agents,metadata-ranked,machine-learning; reinforcement-learning,Neural circuits display complex activity patterns both spontaneously and when responding to a stimulus or generating a motor output.,"high citation signal (1,126); influential citation signal (112); open-access PDF metadata","Sample efficiency, reward misspecification, simulator bias, and safety under exploration remain persistent barriers.; Benchmark performance may not transfer to physical robots, human-facing tools, or open-ended environments.; Agentic systems need stronger evidence on reliability, recovery from errors, and long-horizon oversight.",https://doi.org/10.1016/j.neuron.2009.07.018,https://www.semanticscholar.org/paper/5e01be6b9cd090d207e91d953c6e901be179f8c1,http://www.cell.com/article/S0896627309005479/pdf,,10.1016/j.neuron.2009.07.018,,19709635,2908076,Computer Science; Medicine; Physics,JournalArticle; Study,neural networks,1,citations=1126; influential=112; open PDF metadata; title AI matches=2; AI term matches=2,"Neural circuits display complex activity patterns both spontaneously and when responding to a stimulus or generating a motor output. How are these two forms of activity related? We develop a procedure called FORCE learning for modifying synaptic strengths either external to or within a model neural network to change chaotic spontaneous activity into a wide variety of desired activity patterns. FORCE learning works even though the networks we train are spontaneously chaotic and we leave feedback loops intact and unclamped during learning. Using this approach, we construct networks that produce a wide variety of complex output patterns, input-output transformations that require memory, multiple outputs that can be switched by control inputs, and motor patterns matching human motion capture data. Our results reproduce data on pre-movement activity in motor and premotor cortex, and suggest that synaptic plasticity may be a more rapid and powerful modulator of network activity than generally appreciated."
1579,45,45,2009,Time Series Prediction Using Support Vector Machines: A Survey,"Nicholas I. Sapankevych, R. Sankar",IEEE Computational Intelligence Magazine,2009-05-01,1046,33,214.35,General AI Methods and Systems,survey/review,machine-learning,Positions Time Series Prediction Using Support Vector Machines: A Survey within General AI Methods and Systems.,"high citation signal (1,046); influential citation signal (33)","Survey and infrastructure papers can dominate citations while empirical evidence remains distributed across subfields.; Broad claims need careful mapping to specific tasks, datasets, and operational constraints.; Metadata-driven ranking cannot replace expert reading of full papers and experimental details.",https://doi.org/10.1109/MCI.2009.932254,https://www.semanticscholar.org/paper/40927c5d81988a1151639fad150cbc74f64e0d68,,,10.1109/MCI.2009.932254,,,19977,Computer Science; Engineering,JournalArticle; Review,machine learning; neural networks; support vector machines,3,citations=1046; influential=33; survey/benchmark signal; open PDF metadata; title AI matches=1; AI term matches=1; query hits=3,
1584,46,46,2009,Experimental demonstration of associative memory with memristive neural networks,"Y. Pershin, M. Ventra",Neural Networks,2009-05-18,1037,15,198.607,Foundation Models and Large Language Models,metadata-ranked,machine-learning,Synapses are essential elements for computation and information storage in both real and artificial neural systems.,"high citation signal (1,037); influential citation signal (15); open-access PDF metadata","Capability gains are difficult to separate from data scale, benchmark leakage, and evaluation prompt sensitivity.; Alignment and safety claims often need stronger real-world and multilingual validation.; Compute-intensive training can limit reproducibility and concentrate follow-up work around a small number of institutions.",https://doi.org/10.1016/j.neunet.2010.05.001,https://www.semanticscholar.org/paper/1bb490fcd384c4bcda60cd8d1c592b266da5dbd1,https://link.springer.com/content/pdf/10.1038%2Fnpre.2009.3258.1.pdf,,10.1016/j.neunet.2010.05.001,0905.2935,20605401,2357756,Biology; Computer Science; Engineering; Medicine; Physics,JournalArticle,neural networks,1,citations=1037; influential=15; open PDF metadata; title AI matches=2; AI term matches=2,"Synapses are essential elements for computation and information storage in both real and artificial neural systems. An artificial synapse needs to remember its past dynamical history, store a continuous set of states, and be ""plastic"" according to the pre-synaptic and post-synaptic neuronal activity. Here we show that all this can be accomplished by a memory-resistor (memristor for short). In particular, by using simple and inexpensive off-the-shelf components we have built a memristor emulator which realizes all required synaptic properties. Most importantly, we have demonstrated experimentally the formation of associative memory in a simple neural network consisting of three electronic neurons connected by two memristor-emulator synapses. This experimental demonstration opens up new possibilities in the understanding of neural processes using memory devices, an important step forward to reproduce complex learning, adaptive and spontaneous behavior with electronic neural networks."
1589,47,47,2009,Intrusion detection by machine learning: A review,"Chih-Fong Tsai, Yu-Feng Hsu, Chia-Ying Lin, Wei-Yang Lin",Expert systems with applications,2009-12-01,1031,36,212.216,General AI Methods and Systems,survey/review,machine-learning,Positions Intrusion detection by machine learning: A review within General AI Methods and Systems.,"high citation signal (1,031); influential citation signal (36)","Survey and infrastructure papers can dominate citations while empirical evidence remains distributed across subfields.; Broad claims need careful mapping to specific tasks, datasets, and operational constraints.; Metadata-driven ranking cannot replace expert reading of full papers and experimental details.",https://doi.org/10.1016/j.eswa.2009.05.029,https://www.semanticscholar.org/paper/727f14e94f33f7bf9d1fa9d3d4649cc828a30ba6,,,10.1016/j.eswa.2009.05.029,,,29605054,Computer Science,JournalArticle; Review,machine learning,1,citations=1031; influential=36; survey/benchmark signal; open PDF metadata; title AI matches=1; AI term matches=1,
1605,48,48,2009,The comparisons of data mining techniques for the predictive accuracy of probability of default of credit card clients,"I. Yeh, Che-hui Lien",Expert systems with applications,2009-03-01,1011,63,216.457,General AI Methods and Systems,metadata-ranked,machine-learning,Positions The comparisons of data mining techniques for the predictive accuracy of probability of default of credit card clients within General AI Methods and Systems.,"high citation signal (1,011); influential citation signal (63)","Survey and infrastructure papers can dominate citations while empirical evidence remains distributed across subfields.; Broad claims need careful mapping to specific tasks, datasets, and operational constraints.; Metadata-driven ranking cannot replace expert reading of full papers and experimental details.",https://doi.org/10.1016/J.ESWA.2007.12.020,https://www.semanticscholar.org/paper/1cacac4f0ea9fdff3cd88c151c94115a9fddcf33,,,10.1016/J.ESWA.2007.12.020,,,15696161,Business; Computer Science; Economics,JournalArticle,data mining; neural networks,2,citations=1011; influential=63; open PDF metadata; title AI matches=1; AI term matches=1; query hits=2,
1606,49,49,2009,Innate immunity in plants: An arms race between pattern recognition receptors in plants and effectors in microbial pathogens,"T. Boller, S. He",Science,2009-05-08,1011,44,219.526,Generative Models and Synthetic Media,self-supervised,machine-learning; ai4science,"earch on a suite of plant defense responses that begin when plants are exposed to general microbial elicitors was underappreciated, for a good reason: There has been no critical experimental demonstration of their importance in mediating plant resistance during pathogen infection.","high citation signal (1,011); influential citation signal (44); recognized venue; open-access PDF metadata","Image and media quality metrics may not capture factuality, controllability, provenance, or downstream harms.; Training data provenance and copyright constraints can be under-specified in highly cited generation work.; Robust evaluation across cultures, modalities, and adversarial uses remains difficult.",https://doi.org/10.1126/science.1171647,https://www.semanticscholar.org/paper/bd64f461bf8bdfa837d8e2c25a3e6b21961e3893,https://europepmc.org/articles/pmc2729760?pdf=render,,10.1126/science.1171647,,19423812,206518898,Biology; Environmental Science; Medicine,JournalArticle,pattern recognition,1,citations=1011; influential=44; recognized venue; open PDF metadata; title AI matches=1; AI term matches=1,"For many years, research on a suite of plant defense responses that begin when plants are exposed to general microbial elicitors was underappreciated, for a good reason: There has been no critical experimental demonstration of their importance in mediating plant resistance during pathogen infection. Today, these microbial elicitors are named pathogen- or microbe-associated molecular patterns (PAMPs or MAMPs) and the plant responses are known as PAMP-triggered immunity (PTI). Recent studies provide an elegant explanation for the difficulty of demonstrating the role of PTI in plant disease resistance. It turns out that the important contribution of PTI to disease resistance is masked by pathogen virulence effectors that have evolved to suppress it."
1627,50,50,2009,Multilayer perceptron and neural networks,"M. Popescu, V. Balas, Liliana Perescu-Popescu, N. Mastorakis",,2009-07-01,985,44,211.954,General AI Methods and Systems,metadata-ranked,machine-learning,Positions Multilayer perceptron and neural networks within General AI Methods and Systems.,high citation signal (985); influential citation signal (44),"Survey and infrastructure papers can dominate citations while empirical evidence remains distributed across subfields.; Broad claims need careful mapping to specific tasks, datasets, and operational constraints.; Metadata-driven ranking cannot replace expert reading of full papers and experimental details.",https://doi.org/10.5555/1639537.1639542,https://www.semanticscholar.org/paper/af3fbee1cc4db03df8b050fb59d3517828d87617,,,10.5555/1639537.1639542,,,13978378,Computer Science,,neural networks,1,citations=985; influential=44; open PDF metadata; title AI matches=2; AI term matches=2,
1631,51,51,2009,Application of machine learning to epileptic seizure onset detection and treatment,Ali H. Shoeb,,,980,118,222.456,General AI Methods and Systems,metadata-ranked,machine-learning,Positions Application of machine learning to epileptic seizure onset detection and treatment within General AI Methods and Systems.,high citation signal (980); influential citation signal (118),"Survey and infrastructure papers can dominate citations while empirical evidence remains distributed across subfields.; Broad claims need careful mapping to specific tasks, datasets, and operational constraints.; Metadata-driven ranking cannot replace expert reading of full papers and experimental details.",https://www.semanticscholar.org/paper/432e5d09f080c95286dc461f419b0685b41eb7e3,https://www.semanticscholar.org/paper/432e5d09f080c95286dc461f419b0685b41eb7e3,,,,,,142894564,Computer Science; Medicine; Psychology,,machine learning,1,citations=980; influential=118; open PDF metadata; title AI matches=1; AI term matches=1,
1674,52,52,2009,Pictorial structures revisited: People detection and articulated pose estimation,"Mykhaylo Andriluka, S. Roth, B. Schiele",2009 IEEE Conference on Computer Vision and Pattern Recognition,2009-06-20,938,99,228.058,Vision and Multimodal Learning,metadata-ranked,machine-learning; vision,Positions Pictorial structures revisited: People detection and articulated pose estimation within Vision and Multimodal Learning.,high citation signal (938); influential citation signal (99); recognized venue,"Large-scale benchmark success can overstate robustness under distribution shift, rare classes, and real deployment constraints.; Multimodal alignment may inherit biases and spurious correlations from web-scale data.; High-performing systems often require data and compute resources that are hard for smaller labs to reproduce.",https://doi.org/10.1109/CVPR.2009.5206754,https://www.semanticscholar.org/paper/d9279fe29ae1e4ecd0ee34d546560f8a70d17d1d,,,10.1109/CVPR.2009.5206754,,,1430002,Computer Science,JournalArticle; Conference,computer vision,1,citations=938; influential=99; recognized venue; open PDF metadata; AI term matches=2,
