rank,yearRank,candidateRank,year,title,authors,venue,publicationDate,citationCount,influentialCitationCount,importanceScore,category,methodTags,keywordTags,keyIdea,strengths,limitations,url,semanticScholarUrl,openAccessPdf,githubUrl,doi,arxiv,pubmed,corpusId,fieldsOfStudy,publicationTypes,sourceQueries,queryHitCount,importanceReasons,abstract
742,67,67,2015,Deeply-Recursive Convolutional Network for Image Super-Resolution,"Jiwon Kim, Jung Kwon Lee, Kyoung Mu Lee",Computer Vision and Pattern Recognition,2015-11-14,2760,324,268.287,Vision and Multimodal Learning,metadata-ranked,machine-learning; vision,We propose an image super-resolution method (SR) using a deeply-recursive convolutional network (DRCN).,"high citation signal (2,760); influential citation signal (324); recognized venue; open-access PDF metadata","Large-scale benchmark success can overstate robustness under distribution shift, rare classes, and real deployment constraints.; Multimodal alignment may inherit biases and spurious correlations from web-scale data.; High-performing systems often require data and compute resources that are hard for smaller labs to reproduce.",https://doi.org/10.1109/CVPR.2016.181,https://www.semanticscholar.org/paper/06c06885fd53b2cbd407704cf14f658842ed48e5,https://arxiv.org/pdf/1511.04491,,10.1109/CVPR.2016.181,1511.04491,,206593506,Computer Science,JournalArticle; Conference,deep learning,1,citations=2760; influential=324; recognized venue; open PDF metadata; AI term matches=2,"We propose an image super-resolution method (SR) using a deeply-recursive convolutional network (DRCN). Our network has a very deep recursive layer (up to 16 recursions). Increasing recursion depth can improve performance without introducing new parameters for additional convolutions. Albeit advantages, learning a DRCN is very hard with a standard gradient descent method due to exploding/ vanishing gradients. To ease the difficulty of training, we propose two extensions: recursive-supervision and skip-connection. Our method outperforms previous methods by a large margin."
762,68,68,2015,Predicting the sequence specificities of DNA- and RNA-binding proteins by deep learning,"Babak Alipanahi, Andrew Delong, M. Weirauch, B. Frey",Nature Biotechnology,2015-07-27,2686,214,262.905,"AI for Science, Healthcare, and Robotics",metadata-ranked,ai4science,"Positions Predicting the sequence specificities of DNA- and RNA-binding proteins by deep learning within AI for Science, Healthcare, and Robotics.","high citation signal (2,686); influential citation signal (214); recognized venue; open-access PDF metadata","External validation, prospective testing, and domain expert review are often more important than retrospective benchmark scores.; Clinical, biological, or robotic deployment can fail when data collection protocols differ from training assumptions.; Safety, interpretability, uncertainty, and regulatory evidence remain essential for translation.",https://doi.org/10.1038/nbt.3300,https://www.semanticscholar.org/paper/42d3ae61ca296558cba61446bd95b8a6e5b1082d,https://www.nature.com/articles/nbt.3300.pdf,,10.1038/nbt.3300,,26213851,3204652,Biology; Computer Science; Medicine,JournalArticle,deep learning,1,citations=2686; influential=214; recognized venue; open PDF metadata; title AI matches=1; AI term matches=1,
766,69,69,2015,Privacy-preserving deep learning,"R. Shokri, Vitaly Shmatikov","Allerton Conference on Communication, Control, and Computing",2015-09-01,2680,189,271.125,"AI for Science, Healthcare, and Robotics",benchmark/dataset; trustworthy-ai; ai4science,machine-learning; nlp; reinforcement-learning; trustworthy-ai; ai4science,"Deep learning based on artificial neural networks is a very popular approach to modeling, classifying, and recognizing complex data such as images, speech, and text.","high citation signal (2,680); influential citation signal (189)","External validation, prospective testing, and domain expert review are often more important than retrospective benchmark scores.; Clinical, biological, or robotic deployment can fail when data collection protocols differ from training assumptions.; Safety, interpretability, uncertainty, and regulatory evidence remain essential for translation.",https://doi.org/10.1145/2810103.2813687,https://www.semanticscholar.org/paper/f2f8f7a2ec1b2ede48cbcd189b376ab9fa0735ef,,,10.1145/2810103.2813687,,,20714,Computer Science,Book; JournalArticle; Conference,deep learning; foundation models; neural networks,3,citations=2680; influential=189; survey/benchmark signal; resource signal; translation/trustworthiness signal; open PDF metadata; title AI matches=2; AI term matches=5; query hits=3,"Deep learning based on artificial neural networks is a very popular approach to modeling, classifying, and recognizing complex data such as images, speech, and text. The unprecedented accuracy of deep learning methods has turned them into the foundation of new AI-based services on the Internet. Commercial companies that collect user data on a large scale have been the main beneficiaries of this trend since the success of deep learning techniques is directly proportional to the amount of data available for training. Massive data collection required for deep learning presents obvious privacy issues. Users' personal, highly sensitive data such as photos and voice recordings is kept indefinitely by the companies that collect it. Users can neither delete it, nor restrict the purposes for which it is used. Furthermore, centrally kept data is subject to legal subpoenas and extrajudicial surveillance. Many data owners-for example, medical institutions that may want to apply deep learning methods to clinical records-are prevented by privacy and confidentiality concerns from sharing the data and thus benefitting from large-scale deep learning. In this paper, we present a practical system that enables multiple parties to jointly learn an accurate neural-network model for a given objective without sharing their input datasets. We exploit the fact that the optimization algorithms used in modern deep learning, namely, those based on stochastic gradient descent, can be parallelized and executed asynchronously. Our system lets participants train independently on their own datasets and selectively share small subsets of their models' key parameters during training. This offers an attractive point in the utility/privacy tradeoff space: participants preserve the privacy of their respective data while still benefitting from other participants' models and thus boosting their learning accuracy beyond what is achievable solely on their own inputs. We demonstrate the accuracy of our privacy-preserving deep learning on benchmark datasets."
773,70,70,2015,LSUN: Construction of a Large-scale Image Dataset using Deep Learning with Humans in the Loop,"F. Yu, Yinda Zhang, Shuran Song, Ari Seff, Jianxiong Xiao",arXiv.org,2015-06-10,2660,368,269.253,Vision and Multimodal Learning,benchmark/dataset,machine-learning; vision,"While there has been remarkable progress in the performance of visual recognition algorithms, the state-of-the-art models tend to be exceptionally data-hungry.","high citation signal (2,660); influential citation signal (368)","Large-scale benchmark success can overstate robustness under distribution shift, rare classes, and real deployment constraints.; Multimodal alignment may inherit biases and spurious correlations from web-scale data.; High-performing systems often require data and compute resources that are hard for smaller labs to reproduce.",https://www.semanticscholar.org/paper/4dcdae25a5e33682953f0853ee4cf7ca93be58a9,https://www.semanticscholar.org/paper/4dcdae25a5e33682953f0853ee4cf7ca93be58a9,,,,1506.03365,,8317437,Computer Science; Engineering,JournalArticle,deep learning,1,citations=2660; influential=368; survey/benchmark signal; resource signal; open PDF metadata; title AI matches=1; AI term matches=2,"While there has been remarkable progress in the performance of visual recognition algorithms, the state-of-the-art models tend to be exceptionally data-hungry. Large labeled training datasets, expensive and tedious to produce, are required to optimize millions of parameters in deep network models. Lagging behind the growth in model capacity, the available datasets are quickly becoming outdated in terms of size and density. To circumvent this bottleneck, we propose to amplify human effort through a partially automated labeling scheme, leveraging deep learning with humans in the loop. Starting from a large set of candidate images for each category, we iteratively sample a subset, ask people to label them, classify the others with a trained model, split the set into positives, negatives, and unlabeled based on the classification confidence, and then iterate with the unlabeled set. To assess the effectiveness of this cascading procedure and enable further progress in visual recognition research, we construct a new image dataset, LSUN. It contains around one million labeled images for each of 10 scene categories and 20 object categories. We experiment with training popular convolutional networks and find that they achieve substantial performance gains when trained on this dataset."
782,71,71,2015,A Critical Review of Recurrent Neural Networks for Sequence Learning,Zachary Chase Lipton,arXiv.org,2015-05-29,2633,155,257.976,Natural Language Processing and Knowledge,survey/review; retrieval; ai4science,nlp; vision; reinforcement-learning,Countless learning tasks require dealing with sequential data.,"high citation signal (2,633); influential citation signal (155)","Benchmark scores can hide brittle reasoning, retrieval failures, hallucination, and domain transfer issues.; Language coverage is often uneven, with English and high-resource domains overrepresented.; Evaluation can be sensitive to annotation protocols, prompt wording, and changing model APIs.",https://www.semanticscholar.org/paper/a6336fa1bcdeb7c84d2c4189728f0c1b2b7d0883,https://www.semanticscholar.org/paper/a6336fa1bcdeb7c84d2c4189728f0c1b2b7d0883,,,,1506.00019,,5837849,Computer Science,JournalArticle; Review,large language models; neural networks,2,citations=2633; influential=155; survey/benchmark signal; open PDF metadata; title AI matches=2; AI term matches=2; query hits=2,"Countless learning tasks require dealing with sequential data. Image captioning, speech synthesis, and music generation all require that a model produce outputs that are sequences. In other domains, such as time series prediction, video analysis, and musical information retrieval, a model must learn from inputs that are sequences. Interactive tasks, such as translating natural language, engaging in dialogue, and controlling a robot, often demand both capabilities. Recurrent neural networks (RNNs) are connectionist models that capture the dynamics of sequences via cycles in the network of nodes. Unlike standard feedforward neural networks, recurrent networks retain a state that can represent information from an arbitrarily long context window. Although recurrent neural networks have traditionally been dicult to train, and often contain millions of parameters, recent advances in network architectures, optimization techniques, and parallel computation have enabled successful large-scale learning with them. In recent years, systems based on long short-term memory (LSTM) and bidirectional (BRNN) architectures have demonstrated ground-breaking performance on tasks as varied as image captioning, language translation, and handwriting recognition. In this survey, we review and synthesize the research that over the past three decades rst yielded and then made practical these powerful learning models. When appropriate, we reconcile conicting notation and nomenclature. Our goal is to provide a selfcontained explication of the state of the art together with a historical perspective and references to primary research."
792,72,72,2015,Learning Multi-domain Convolutional Neural Networks for Visual Tracking,"Hyeonseob Nam, Bohyung Han",Computer Vision and Pattern Recognition,2015-10-27,2612,465,279.12,Vision and Multimodal Learning,metadata-ranked,machine-learning; vision; trustworthy-ai,We propose a novel visual tracking algorithm based on the representations from a discriminatively trained Convolutional Neural Network (CNN).,"high citation signal (2,612); influential citation signal (465); recognized venue; open-access PDF metadata","Large-scale benchmark success can overstate robustness under distribution shift, rare classes, and real deployment constraints.; Multimodal alignment may inherit biases and spurious correlations from web-scale data.; High-performing systems often require data and compute resources that are hard for smaller labs to reproduce.",https://doi.org/10.1109/CVPR.2016.465,https://www.semanticscholar.org/paper/2ce63d77eecc35faef85a3b752a314c93a077ac9,https://arxiv.org/pdf/1510.07945,,10.1109/CVPR.2016.465,1510.07945,,973101,Computer Science,JournalArticle; Conference,neural networks,1,citations=2612; influential=465; recognized venue; open PDF metadata; title AI matches=2; AI term matches=5,"We propose a novel visual tracking algorithm based on the representations from a discriminatively trained Convolutional Neural Network (CNN). Our algorithm pretrains a CNN using a large set of videos with tracking ground-truths to obtain a generic target representation. Our network is composed of shared layers and multiple branches of domain-specific layers, where domains correspond to individual training sequences and each branch is responsible for binary classification to identify target in each domain. We train each domain in the network iteratively to obtain generic target representations in the shared layers. When tracking a target in a new sequence, we construct a new network by combining the shared layers in the pretrained CNN with a new binary classification layer, which is updated online. Online tracking is performed by evaluating the candidate windows randomly sampled around the previous target state. The proposed algorithm illustrates outstanding performance in existing tracking benchmarks."
805,73,73,2015,Conditional Random Fields as Recurrent Neural Networks,"Shuai Zheng, Sadeep Jayasumana, B. Romera-Paredes, Vibhav Vineet, Zhizhong Su, Dalong Du, Chang Huang, Philip H. S. Torr",IEEE International Conference on Computer Vision,2015-02-11,2591,321,274.768,Vision and Multimodal Learning,benchmark/dataset,machine-learning; vision; github,"Pixel-level labelling tasks, such as semantic segmentation, play a central role in image understanding.","high citation signal (2,591); influential citation signal (321); open-access PDF metadata","Large-scale benchmark success can overstate robustness under distribution shift, rare classes, and real deployment constraints.; Multimodal alignment may inherit biases and spurious correlations from web-scale data.; High-performing systems often require data and compute resources that are hard for smaller labs to reproduce.",https://doi.org/10.1109/ICCV.2015.179,https://www.semanticscholar.org/paper/ca5c766b2d31a1f5ce8896a0a42b40a2bff9323a,http://arxiv.org/pdf/1502.03240,https://github.com/torrvision/crfasrnn,10.1109/ICCV.2015.179,1502.03240,,1318262,Computer Science,JournalArticle; Conference,deep learning; neural networks,2,citations=2591; influential=321; survey/benchmark signal; resource signal; open PDF metadata; title AI matches=2; AI term matches=6; query hits=2,"Pixel-level labelling tasks, such as semantic segmentation, play a central role in image understanding. Recent approaches have attempted to harness the capabilities of deep learning techniques for image recognition to tackle pixel-level labelling tasks. One central issue in this methodology is the limited capacity of deep learning techniques to delineate visual objects. To solve this problem, we introduce a new form of convolutional neural network that combines the strengths of Convolutional Neural Networks (CNNs) and Conditional Random Fields (CRFs)-based probabilistic graphical modelling. To this end, we formulate Conditional Random Fields with Gaussian pairwise potentials and mean-field approximate inference as Recurrent Neural Networks. This network, called CRF-RNN, is then plugged in as a part of a CNN to obtain a deep network that has desirable properties of both CNNs and CRFs. Importantly, our system fully integrates CRF modelling with CNNs, making it possible to train the whole deep network end-to-end with the usual back-propagation algorithm, avoiding offline post-processing methods for object delineation. We apply the proposed method to the problem of semantic image segmentation, obtaining top results on the challenging Pascal VOC 2012 segmentation benchmark."
821,74,74,2015,Recurrent Convolutional Neural Networks for Text Classification,"Siwei Lai, Liheng Xu, Kang Liu, Jun Zhao",AAAI Conference on Artificial Intelligence,2015-01-25,2533,188,269.811,Natural Language Processing and Knowledge,metadata-ranked,machine-learning; nlp,Text classification is a foundational task in many NLP applications.,"high citation signal (2,533); influential citation signal (188); recognized venue; open-access PDF metadata","Benchmark scores can hide brittle reasoning, retrieval failures, hallucination, and domain transfer issues.; Language coverage is often uneven, with English and high-resource domains overrepresented.; Evaluation can be sensitive to annotation protocols, prompt wording, and changing model APIs.",https://doi.org/10.1609/aaai.v29i1.9513,https://www.semanticscholar.org/paper/eba36ac75bf22edf9a1bfd33244d459c75b98305,https://ojs.aaai.org/index.php/AAAI/article/download/9513/9372,,10.1609/aaai.v29i1.9513,,,16756501,Computer Science,JournalArticle; Conference,foundation models; neural networks,2,citations=2533; influential=188; recognized venue; open PDF metadata; title AI matches=3; AI term matches=5; query hits=2,"Text classification is a foundational task in many NLP applications. Traditional text classifiers often rely on many human-designed features, such as dictionaries, knowledge bases and special tree kernels. In contrast to traditional methods, we introduce a recurrent convolutional neural network for text classification without human-designed features. In our model, we apply a recurrent structure to capture contextual information as far as possible when learning word representations, which may introduce considerably less noise compared to traditional window-based neural networks. We also employ a max-pooling layer that automatically judges which words play key roles in text classification to capture the key components in texts. We conduct experiments on four commonly used datasets. The experimental results show that the proposed method outperforms the state-of-the-art methods on several datasets, particularly on document-level datasets."
826,75,75,2015,Generating Sentences from a Continuous Space,"Samuel R. Bowman, L. Vilnis, O. Vinyals, Andrew M. Dai, R. Józefowicz, Samy Bengio",Conference on Computational Natural Language Learning,2015-11-19,2525,357,258.684,Foundation Models and Large Language Models,generative,machine-learning; foundation-models; generative-ai; nlp,The standard recurrent neural network language model (RNNLM) generates sentences one word at a time and does not work from an explicit global sentence representation.,"high citation signal (2,525); influential citation signal (357); open-access PDF metadata","Capability gains are difficult to separate from data scale, benchmark leakage, and evaluation prompt sensitivity.; Alignment and safety claims often need stronger real-world and multilingual validation.; Compute-intensive training can limit reproducibility and concentrate follow-up work around a small number of institutions.",https://doi.org/10.18653/v1/K16-1002,https://www.semanticscholar.org/paper/d82b55c35c8673774a708353838918346f6c006f,https://www.aclweb.org/anthology/K16-1002.pdf,,10.18653/v1/K16-1002,1511.06349,,748227,Computer Science; Mathematics,JournalArticle,neural networks,1,citations=2525; influential=357; open PDF metadata; AI term matches=3,"The standard recurrent neural network language model (RNNLM) generates sentences one word at a time and does not work from an explicit global sentence representation. In this work, we introduce and study an RNN-based variational autoencoder generative model that incorporates distributed latent representations of entire sentences. This factorization allows it to explicitly model holistic properties of sentences such as style, topic, and high-level syntactic features. Samples from the prior over these sentence representations remarkably produce diverse and well-formed sentences through simple deterministic decoding. By examining paths through this latent space, we are able to generate coherent novel sentences that interpolate between known sentences. We present techniques for solving the difficult learning problem presented by this model, demonstrate its effectiveness in imputing missing words, explore many interesting properties of the model's latent sentence space, and present negative results on the use of the model in language modeling."
842,76,76,2015,"ALVINN, an autonomous land vehicle in a neural network",D. Pomerleau,,,2490,122,246.42,General AI Methods and Systems,metadata-ranked,machine-learning,"Positions ALVINN, an autonomous land vehicle in a neural network within General AI Methods and Systems.","high citation signal (2,490); influential citation signal (122)","Survey and infrastructure papers can dominate citations while empirical evidence remains distributed across subfields.; Broad claims need careful mapping to specific tasks, datasets, and operational constraints.; Metadata-driven ranking cannot replace expert reading of full papers and experimental details.",https://www.semanticscholar.org/paper/7786bc6c25ba38ff0135f1bdad192f6b3c4ad0b3,https://www.semanticscholar.org/paper/7786bc6c25ba38ff0135f1bdad192f6b3c4ad0b3,,,,,,18420840,Computer Science; Engineering,,machine learning; neural networks; support vector machines,3,citations=2490; influential=122; open PDF metadata; title AI matches=1; AI term matches=1; query hits=3,
850,77,77,2015,Beyond short snippets: Deep networks for video classification,"Joe Yue-Hei Ng, Matthew J. Hausknecht, Sudheendra Vijayanarasimhan, O. Vinyals, R. Monga, G. Toderici",Computer Vision and Pattern Recognition,2015-03-30,2455,204,273.261,Vision and Multimodal Learning,benchmark/dataset; retrieval,machine-learning; vision,"Convolutional neural networks (CNNs) have been extensively applied for image recognition problems giving state-of-the-art results on recognition, detection, segmentation and retrieval.","high citation signal (2,455); influential citation signal (204); recognized venue; open-access PDF metadata","Large-scale benchmark success can overstate robustness under distribution shift, rare classes, and real deployment constraints.; Multimodal alignment may inherit biases and spurious correlations from web-scale data.; High-performing systems often require data and compute resources that are hard for smaller labs to reproduce.",https://doi.org/10.1109/CVPR.2015.7299101,https://www.semanticscholar.org/paper/5418b2a482720e013d487a385c26fae0f017c6a6,https://arxiv.org/pdf/1503.08909,,10.1109/CVPR.2015.7299101,1503.08909,,4245530,Computer Science,JournalArticle; Conference,neural networks,1,citations=2455; influential=204; recognized venue; survey/benchmark signal; resource signal; open PDF metadata; title AI matches=1; AI term matches=6,"Convolutional neural networks (CNNs) have been extensively applied for image recognition problems giving state-of-the-art results on recognition, detection, segmentation and retrieval. In this work we propose and evaluate several deep neural network architectures to combine image information across a video over longer time periods than previously attempted. We propose two methods capable of handling full length videos. The first method explores various convolutional temporal feature pooling architectures, examining the various design choices which need to be made when adapting a CNN for this task. The second proposed method explicitly models the video as an ordered sequence of frames. For this purpose we employ a recurrent neural network that uses Long Short-Term Memory (LSTM) cells which are connected to the output of the underlying CNN. Our best networks exhibit significant performance improvements over previously published results on the Sports 1 million dataset (73.1% vs. 60.9%) and the UCF-101 datasets with (88.6% vs. 88.0%) and without additional optical flow information (82.6% vs. 73.0%)."
