rank,yearRank,candidateRank,year,title,authors,venue,publicationDate,citationCount,influentialCitationCount,importanceScore,category,methodTags,keywordTags,keyIdea,strengths,limitations,url,semanticScholarUrl,openAccessPdf,githubUrl,doi,arxiv,pubmed,corpusId,fieldsOfStudy,publicationTypes,sourceQueries,queryHitCount,importanceReasons,abstract
1609,46,46,2024,Qwen2.5-Math Technical Report: Toward Mathematical Expert Model via Self-Improvement,"An Yang, Beichen Zhang, Binyuan Hui, Bofei Gao, Bowen Yu, Chengpeng Li, Dayiheng Liu, Jianhong Tu, et al.",arXiv.org,2024-09-18,1006,93,221.73,Foundation Models and Large Language Models,self-supervised; reinforcement-learning,foundation-models; reinforcement-learning,"In this report, we present a series of math-specific large language models: Qwen2.5-Math and Qwen2.5-Math-Instruct-1.5B/7B/72B.","high citation signal (1,006); influential citation signal (93)","Capability gains are difficult to separate from data scale, benchmark leakage, and evaluation prompt sensitivity.; Alignment and safety claims often need stronger real-world and multilingual validation.; Compute-intensive training can limit reproducibility and concentrate follow-up work around a small number of institutions.",https://doi.org/10.48550/arxiv.2409.12122,https://www.semanticscholar.org/paper/9fb201282f53a4ce89f28cbe5026af78912aa8c1,,,10.48550/arXiv.2409.12122,2409.12122,,272707652,Computer Science; Mathematics,JournalArticle,large language models; reinforcement learning,2,citations=1006; influential=93; open PDF metadata; AI term matches=3; query hits=2,"In this report, we present a series of math-specific large language models: Qwen2.5-Math and Qwen2.5-Math-Instruct-1.5B/7B/72B. The core innovation of the Qwen2.5 series lies in integrating the philosophy of self-improvement throughout the entire pipeline, from pre-training and post-training to inference: (1) During the pre-training phase, Qwen2-Math-Instruct is utilized to generate large-scale, high-quality mathematical data. (2) In the post-training phase, we develop a reward model (RM) by conducting massive sampling from Qwen2-Math-Instruct. This RM is then applied to the iterative evolution of data in supervised fine-tuning (SFT). With a stronger SFT model, it's possible to iteratively train and update the RM, which in turn guides the next round of SFT data iteration. On the final SFT model, we employ the ultimate RM for reinforcement learning, resulting in the Qwen2.5-Math-Instruct. (3) Furthermore, during the inference stage, the RM is used to guide sampling, optimizing the model's performance. Qwen2.5-Math-Instruct supports both Chinese and English, and possess advanced mathematical reasoning capabilities, including Chain-of-Thought (CoT) and Tool-Integrated Reasoning (TIR). We evaluate our models on 10 mathematics datasets in both English and Chinese, such as GSM8K, MATH, GaoKao, AMC23, and AIME24, covering a range of difficulties from grade school level to math competition problems."
1612,47,47,2024,RULER: What's the Real Context Size of Your Long-Context Language Models?,"Cheng-Ping Hsieh, Simeng Sun, Samuel Kriman, Shantanu Acharya, Dima Rekesh, Fei Jia, Boris Ginsburg",arXiv.org,2024-04-09,1000,244,241.01,Foundation Models and Large Language Models,benchmark/dataset; retrieval,generative-ai,"The needle-in-a-haystack (NIAH) test, which examines the ability to retrieve a piece of information (the""needle"") from long distractor texts (the""haystack""), has been widely adopted to evaluate long-context language models (LMs).","high citation signal (1,000); influential citation signal (244)","Capability gains are difficult to separate from data scale, benchmark leakage, and evaluation prompt sensitivity.; Alignment and safety claims often need stronger real-world and multilingual validation.; Compute-intensive training can limit reproducibility and concentrate follow-up work around a small number of institutions.",https://doi.org/10.48550/arxiv.2404.06654,https://www.semanticscholar.org/paper/ac5824e9ff924a937d9eef379d0b581de2417678,,https://github.com/hsiehjackson/ruler,10.48550/arXiv.2404.06654,2404.06654,,269032933,Computer Science; Linguistics,JournalArticle,large language models,1,citations=1000; influential=244; survey/benchmark signal; resource signal; open PDF metadata; title AI matches=1; AI term matches=1,"The needle-in-a-haystack (NIAH) test, which examines the ability to retrieve a piece of information (the""needle"") from long distractor texts (the""haystack""), has been widely adopted to evaluate long-context language models (LMs). However, this simple retrieval-based test is indicative of only a superficial form of long-context understanding. To provide a more comprehensive evaluation of long-context LMs, we create a new synthetic benchmark RULER with flexible configurations for customized sequence length and task complexity. RULER expands upon the vanilla NIAH test to encompass variations with diverse types and quantities of needles. Moreover, RULER introduces new task categories multi-hop tracing and aggregation to test behaviors beyond searching from context. We evaluate 17 long-context LMs with 13 representative tasks in RULER. Despite achieving nearly perfect accuracy in the vanilla NIAH test, almost all models exhibit large performance drops as the context length increases. While these models all claim context sizes of 32K tokens or greater, only half of them can maintain satisfactory performance at the length of 32K. Our analysis of Yi-34B, which supports context length of 200K, reveals large room for improvement as we increase input length and task complexity. We open source RULER to spur comprehensive evaluation of long-context LMs."
1616,48,48,2024,Large Language Models: A Survey,"Shervin Minaee, Tomáš Mikolov, Narjes Nikzad, M. Chenaghlu, R. Socher, Xavier Amatriain, Jianfeng Gao",arXiv.org,2024-02-09,997,44,218.22,Foundation Models and Large Language Models,survey/review; transformer,foundation-models; nlp,"Large Language Models (LLMs) have drawn a lot of attention due to their strong performance on a wide range of natural language tasks, since the release of ChatGPT in November 2022.",high citation signal (997); influential citation signal (44),"Capability gains are difficult to separate from data scale, benchmark leakage, and evaluation prompt sensitivity.; Alignment and safety claims often need stronger real-world and multilingual validation.; Compute-intensive training can limit reproducibility and concentrate follow-up work around a small number of institutions.",https://doi.org/10.48550/arxiv.2402.06196,https://www.semanticscholar.org/paper/a1f76db91c0debcf93ae9889736bce8470902113,,,10.48550/arXiv.2402.06196,2402.06196,,267617032,Computer Science; Linguistics,JournalArticle; Review,large language models,1,citations=997; influential=44; survey/benchmark signal; open PDF metadata; title AI matches=2; AI term matches=3,"Large Language Models (LLMs) have drawn a lot of attention due to their strong performance on a wide range of natural language tasks, since the release of ChatGPT in November 2022. LLMs' ability of general-purpose language understanding and generation is acquired by training billions of model's parameters on massive amounts of text data, as predicted by scaling laws \cite{kaplan2020scaling,hoffmann2022training}. The research area of LLMs, while very recent, is evolving rapidly in many different ways. In this paper, we review some of the most prominent LLMs, including three popular LLM families (GPT, LLaMA, PaLM), and discuss their characteristics, contributions and limitations. We also give an overview of techniques developed to build, and augment LLMs. We then survey popular datasets prepared for LLM training, fine-tuning, and evaluation, review widely used LLM evaluation metrics, and compare the performance of several popular LLMs on a set of representative benchmarks. Finally, we conclude the paper by discussing open challenges and future research directions."
1620,49,49,2024,What Is Qualitative Research? An Overview and Guidelines,Weng Marc Lim,Australasian Marketing Journal,2024-07-25,993,15,197.654,Natural Language Processing and Knowledge,survey/review,machine-learning; trustworthy-ai,"This guide explains the focus, rigor, and relevance of qualitative research, highlighting its role in dissecting complex social phenomena and providing in-depth, human-centered insights.",high citation signal (993); influential citation signal (15),"Benchmark scores can hide brittle reasoning, retrieval failures, hallucination, and domain transfer issues.; Language coverage is often uneven, with English and high-resource domains overrepresented.; Evaluation can be sensitive to annotation protocols, prompt wording, and changing model APIs.",https://doi.org/10.1177/14413582241264619,https://www.semanticscholar.org/paper/a052d88ba5e144bb86ffcd8656b40e4a7e05b7f8,,,10.1177/14413582241264619,,,271509517,Sociology,JournalArticle; Review,artificial intelligence; deep learning; machine learning,3,citations=993; influential=15; open PDF metadata; AI term matches=3; query hits=3,"This guide explains the focus, rigor, and relevance of qualitative research, highlighting its role in dissecting complex social phenomena and providing in-depth, human-centered insights. The guide also examines the rationale for employing qualitative methods, underscoring their critical importance. An exploration of the methodology’s strengths, such as its ability to offer contextual depth and holistic perspectives, is juxtaposed against challenges like constrained generalizability and potential researcher bias, accompanied by practical mitigation strategies. Covering a spectrum of qualitative approaches, including grounded theory, phenomenology, ethnography, action research, and general inquiry, the guide sheds light on diverse data collection and analysis techniques. Noteworthily, the guide underscores the crucial aspect of trustworthiness in qualitative research, detailing methods to establish credibility, dependability, confirmability, and transferability. The integration of technologies like recording and transcribing tools with data analysis software and the growing influence of artificial intelligence, machine learning, and deep learning are also explored. Concluding with a discussion on ethical considerations, from participant recruitment to data stewardship, this guide serves as an essential resource that offers insightful, actionable guidance for conducting effective and impactful qualitative research."
1628,50,50,2024,Intelligent Clinical Documentation: Harnessing Generative AI for Patient-Centric Clinical Note Generation,"Anjanava Biswas, Wrick Talukdar",International Journal of Innovative Science and Research Technology,2024-05-28,985,2,194.041,Foundation Models and Large Language Models,generative; trustworthy-ai; ai4science,foundation-models; generative-ai; nlp; trustworthy-ai; ai4science,"Comprehensive clinical documentation is crucial for effective healthcare delivery, yet it poses a significant burden on healthcare professionals, leading to burnout, increased medical errors, and compromised patient safety.",high citation signal (985); recognized venue; open-access PDF metadata,"Capability gains are difficult to separate from data scale, benchmark leakage, and evaluation prompt sensitivity.; Alignment and safety claims often need stronger real-world and multilingual validation.; Compute-intensive training can limit reproducibility and concentrate follow-up work around a small number of institutions.",https://doi.org/10.38124/ijisrt/ijisrt24may1483,https://www.semanticscholar.org/paper/9472e198f790cb396c088c8e98bd4c5f5134cf62,https://arxiv.org/pdf/2405.18346,,10.38124/ijisrt/IJISRT24MAY1483,2405.18346,,270067898,Computer Science; Medicine,JournalArticle,artificial intelligence; large language models; natural language processing,3,citations=985; influential=2; recognized venue; translation/trustworthiness signal; open PDF metadata; title AI matches=1; AI term matches=8; query hits=3,"Comprehensive clinical documentation is crucial for effective healthcare delivery, yet it poses a significant burden on healthcare professionals, leading to burnout, increased medical errors, and compromised patient safety. This paper explores the potential of generative AI (Artificial Intelligence) to streamline the clinical documentation process, specifically focusing on generating SOAP (Subjective, Objective, Assessment, Plan) and BIRP (Behavior, Intervention, Response, Plan) notes. We present a case study demonstrating the application of natural language processing (NLP) and automatic speech recognition (ASR) technologies to transcribe patient-clinician interactions, coupled with advanced prompting techniques to generate draft clinical notes using large language models (LLMs). The study highlights the benefits of this approach, including time savings, improved documentation quality, and enhanced patient-centered care. Additionally, we discuss ethical considerations, such as maintaining patient confidentiality and addressing model biases, underscoring the need for responsible deployment of generative AI in healthcare settings. The findings suggest that generative AI has the potential to revolutionize clinical documentation practices, alleviating administrative burdens and enabling healthcare professionals to focus more on direct patient care."
1636,51,51,2024,A Survey on Large Language Models for Code Generation,"Juyong Jiang, Fan Wang, Jiasi Shen, Sungju Kim, Sunghun Kim",ACM Transactions on Software Engineering and Methodology,2024-06-01,977,39,223.126,Foundation Models and Large Language Models,survey/review,foundation-models; nlp,"Large Language Models (LLMs) have garnered remarkable advancements across diverse code-related tasks, known as Code LLMs, particularly in code generation that generates source code with LLM from natural language descriptions.",high citation signal (977); influential citation signal (39),"Capability gains are difficult to separate from data scale, benchmark leakage, and evaluation prompt sensitivity.; Alignment and safety claims often need stronger real-world and multilingual validation.; Compute-intensive training can limit reproducibility and concentrate follow-up work around a small number of institutions.",https://doi.org/10.1145/3747588,https://www.semanticscholar.org/paper/c8b18682965ff9dccc0130dab3d679f78cefa617,,,10.1145/3747588,2406.00515,,270214176,Computer Science,JournalArticle; Review,large language models; natural language processing,2,citations=977; influential=39; survey/benchmark signal; resource signal; open PDF metadata; title AI matches=2; AI term matches=5; query hits=2,"Large Language Models (LLMs) have garnered remarkable advancements across diverse code-related tasks, known as Code LLMs, particularly in code generation that generates source code with LLM from natural language descriptions. This burgeoning field has captured significant interest from both academic researchers and industry professionals due to its practical significance in software development, e.g., GitHub Copilot. Despite the active exploration of LLMs for a variety of code tasks, either from the perspective of Natural Language Processing (NLP) or Software Engineering (SE) or both, there is a noticeable absence of a comprehensive and up-to-date literature review dedicated to LLM for code generation. In this survey, we aim to bridge this gap by providing a systematic literature review that serves as a valuable reference for researchers investigating the cutting-edge progress in LLMs for code generation. We introduce a taxonomy to categorize and discuss the recent developments in LLMs for code generation, covering aspects such as data curation, latest advances, performance evaluation, ethical implications, environmental impact, and real-world applications. In addition, we present a historical overview of the evolution of LLMs for code generation and provide a quantitative and qualitative comparative analysis of experimental results of code LLMs, sourced from their original papers to ensure a fair comparison on the HumanEval, MBPP, and BigCodeBench benchmarks, across various levels of difficulty and types of programming tasks, to highlight the progressive enhancements in LLM capabilities for code generation. We identify critical challenges and promising opportunities regarding the gap between academia and practical development. Furthermore, we have established a dedicated resource GitHub page (https://github.com/juyongjiang/CodeLLMSurvey) to continuously document and disseminate the most recent advances in the field."
1637,52,52,2024,Large Language Model based Multi-Agents: A Survey of Progress and Challenges,"Taicheng Guo, Xiuying Chen, Yaqi Wang, Ruidi Chang, Shichao Pei, N. Chawla, Olaf Wiest, Xiangliang Zhang",International Joint Conference on Artificial Intelligence,2024-01-21,976,48,232.944,Foundation Models and Large Language Models,survey/review; reinforcement-learning,foundation-models; nlp; reinforcement-learning,Large Language Models (LLMs) have achieved remarkable success across a wide array of tasks.,high citation signal (976); influential citation signal (48); recognized venue,"Capability gains are difficult to separate from data scale, benchmark leakage, and evaluation prompt sensitivity.; Alignment and safety claims often need stronger real-world and multilingual validation.; Compute-intensive training can limit reproducibility and concentrate follow-up work around a small number of institutions.",https://doi.org/10.48550/arxiv.2402.01680,https://www.semanticscholar.org/paper/8f070e301979732e0dd73f6aa6170309cf73aa7d,,https://github.com/taichengguo/llm_multiagents_survey_papers,10.48550/arXiv.2402.01680,2402.01680,,267412980,Computer Science,JournalArticle; Conference; Review,large language models,1,citations=976; influential=48; recognized venue; survey/benchmark signal; resource signal; open PDF metadata; title AI matches=2; AI term matches=4,"Large Language Models (LLMs) have achieved remarkable success across a wide array of tasks. Due to their notable capabilities in planning and reasoning, LLMs have been utilized as autonomous agents for the automatic execution of various tasks. Recently, LLM-based agent systems have rapidly evolved from single-agent planning or decision-making to operating as multi-agent systems, enhancing their ability in complex problem-solving and world simulation. To offer an overview of this dynamic field, we present this survey to offer an in-depth discussion on the essential aspects and challenges of LLM-based multi-agent (LLM-MA) systems. Our objective is to provide readers with an in-depth understanding of these key points: the domains and settings where LLM-MA systems operate or simulate; the profiling and communication methods of these agents; and the means by which these agents develop their skills. For those interested in delving into this field, we also summarize the commonly used datasets or benchmarks. To keep researchers updated on the latest studies, we maintain an open-source GitHub repository (github.com/taichengguo/LLM_MultiAgents_Survey_Papers), dedicated to outlining the research of LLM-MA research."
1651,53,53,2024,A visual-language foundation model for computational pathology,"Ming Y. Lu, Bowen Chen, Drew F. K. Williamson, Richard J. Chen, Ivy Liang, Tong Ding, Guillaume Jaume, Igor Odintsov, et al.",Nature Medicine,2024-03-01,961,119,243.143,Foundation Models and Large Language Models,self-supervised; generative; retrieval; trustworthy-ai; ai4science,machine-learning; foundation-models; generative-ai; nlp; vision; trustworthy-ai; ai4science,The accelerated adoption of digital pathology and advances in deep learning have enabled the development of robust models for various pathology tasks across a diverse array of diseases and patient cohorts.,high citation signal (961); influential citation signal (119); recognized venue,"Capability gains are difficult to separate from data scale, benchmark leakage, and evaluation prompt sensitivity.; Alignment and safety claims often need stronger real-world and multilingual validation.; Compute-intensive training can limit reproducibility and concentrate follow-up work around a small number of institutions.",https://doi.org/10.1038/s41591-024-02856-4,https://www.semanticscholar.org/paper/0746410e1250576cc1b9621ef602e4bceb1c07ca,,,10.1038/s41591-024-02856-4,,38504017,268535283,Computer Science; Medicine,JournalArticle,deep learning; foundation models; machine learning,3,citations=961; influential=119; recognized venue; translation/trustworthiness signal; open PDF metadata; title AI matches=1; AI term matches=6; query hits=3,"The accelerated adoption of digital pathology and advances in deep learning have enabled the development of robust models for various pathology tasks across a diverse array of diseases and patient cohorts. However, model training is often difficult due to label scarcity in the medical domain, and a model’s usage is limited by the specific task and disease for which it is trained. Additionally, most models in histopathology leverage only image data, a stark contrast to how humans teach each other and reason about histopathologic entities. We introduce CONtrastive learning from Captions for Histopathology (CONCH), a visual-language foundation model developed using diverse sources of histopathology images, biomedical text and, notably, over 1.17 million image–caption pairs through task-agnostic pretraining. Evaluated on a suite of 14 diverse benchmarks, CONCH can be transferred to a wide range of downstream tasks involving histopathology images and/or text, achieving state-of-the-art performance on histology image classification, segmentation, captioning, and text-to-image and image-to-text retrieval. CONCH represents a substantial leap over concurrent visual-language pretrained systems for histopathology, with the potential to directly facilitate a wide array of machine learning-based workflows requiring minimal or no further supervised fine-tuning. Developed using diverse sources of histopathology images, biomedical text and over 1.17 million image–caption pairs, evaluated on a suite of 14 diverse benchmarks, a visual-language foundation model achieves state-of-the-art performance on a wide array of clinically relevant pathology tasks."
1663,54,54,2024,A review of convolutional neural networks in computer vision,"Xia Zhao, Limin Wang, Yufei Zhang, Xuming Han, Muhammet Deveci, M. Parmar",Artificial Intelligence Review,2024-03-23,946,22,228.669,Vision and Multimodal Learning,survey/review,machine-learning; vision,"In computer vision, a series of exemplary advances have been made in several areas involving image classification, semantic segmentation, object detection, and image super-resolution reconstruction with the rapid development of deep convolutional neural network (CNN).",high citation signal (946); influential citation signal (22); recognized venue; open-access PDF metadata,"Large-scale benchmark success can overstate robustness under distribution shift, rare classes, and real deployment constraints.; Multimodal alignment may inherit biases and spurious correlations from web-scale data.; High-performing systems often require data and compute resources that are hard for smaller labs to reproduce.",https://doi.org/10.1007/s10462-024-10721-6,https://www.semanticscholar.org/paper/ad06c8a5fd292af518f878c7ced132b61739cdd8,https://link.springer.com/content/pdf/10.1007/s10462-024-10721-6.pdf,,10.1007/s10462-024-10721-6,,,268673911,Computer Science,JournalArticle; Review,computer vision; deep learning; machine learning; neural networks,4,citations=946; influential=22; recognized venue; survey/benchmark signal; open PDF metadata; title AI matches=3; AI term matches=10; query hits=4,"In computer vision, a series of exemplary advances have been made in several areas involving image classification, semantic segmentation, object detection, and image super-resolution reconstruction with the rapid development of deep convolutional neural network (CNN). The CNN has superior features for autonomous learning and expression, and feature extraction from original input data can be realized by means of training CNN models that match practical applications. Due to the rapid progress in deep learning technology, the structure of CNN is becoming more and more complex and diverse. Consequently, it gradually replaces the traditional machine learning methods. This paper presents an elementary understanding of CNN components and their functions, including input layers, convolution layers, pooling layers, activation functions, batch normalization, dropout, fully connected layers, and output layers. On this basis, this paper gives a comprehensive overview of the past and current research status of the applications of CNN models in computer vision fields, e.g., image classification, object detection, and video prediction. In addition, we summarize the challenges and solutions of the deep CNN, and future research directions are also discussed."
