rank,yearRank,candidateRank,year,title,authors,venue,publicationDate,citationCount,influentialCitationCount,importanceScore,category,methodTags,keywordTags,keyIdea,strengths,limitations,url,semanticScholarUrl,openAccessPdf,githubUrl,doi,arxiv,pubmed,corpusId,fieldsOfStudy,publicationTypes,sourceQueries,queryHitCount,importanceReasons,abstract
999,21,21,2009,MetaboAnalyst: a web server for metabolomic data analysis and interpretation,"J. Xia, N. Psychogios, N. Young, D. Wishart",Nucleic Acids Res.,2009-05-08,2082,243,248.075,Generative Models and Synthetic Media,metadata-ranked,machine-learning,"Metabolomics is a newly emerging field of ‘omics’ research that is concerned with characterizing large numbers of metabolites using NMR, chromatography and mass spectrometry.","high citation signal (2,082); influential citation signal (243); open-access PDF metadata","Image and media quality metrics may not capture factuality, controllability, provenance, or downstream harms.; Training data provenance and copyright constraints can be under-specified in highly cited generation work.; Robust evaluation across cultures, modalities, and adversarial uses remains difficult.",https://doi.org/10.1093/nar/gkp356,https://www.semanticscholar.org/paper/94549a171a61039ed1f9b5954ce42181c574ccc3,https://doi.org/10.1093/nar/gkp356,,10.1093/nar/gkp356,,19429898,13516900,Biology; Chemistry; Computer Science; Medicine,JournalArticle,machine learning,1,citations=2082; influential=243; open PDF metadata; AI term matches=2,"Metabolomics is a newly emerging field of ‘omics’ research that is concerned with characterizing large numbers of metabolites using NMR, chromatography and mass spectrometry. It is frequently used in biomarker identification and the metabolic profiling of cells, tissues or organisms. The data processing challenges in metabolomics are quite unique and often require specialized (or expensive) data analysis software and a detailed knowledge of cheminformatics, bioinformatics and statistics. In an effort to simplify metabolomic data analysis while at the same time improving user accessibility, we have developed a freely accessible, easy-to-use web server for metabolomic data analysis called MetaboAnalyst. Fundamentally, MetaboAnalyst is a web-based metabolomic data processing tool not unlike many of today's web-based microarray analysis packages. It accepts a variety of input data (NMR peak lists, binned spectra, MS peak lists, compound/concentration data) in a wide variety of formats. It also offers a number of options for metabolomic data processing, data normalization, multivariate statistical analysis, graphing, metabolite identification and pathway mapping. In particular, MetaboAnalyst supports such techniques as: fold change analysis, t-tests, PCA, PLS-DA, hierarchical clustering and a number of more sophisticated statistical or machine learning methods. It also employs a large library of reference spectra to facilitate compound identification from most kinds of input spectra. MetaboAnalyst guides users through a step-by-step analysis pipeline using a variety of menus, information hyperlinks and check boxes. Upon completion, the server generates a detailed report describing each method used, embedded with graphical and tabular outputs. MetaboAnalyst is capable of handling most kinds of metabolomic data and was designed to perform most of the common kinds of metabolomic data analyses. MetaboAnalyst is accessible at http://www.metaboanalyst.ca"
1012,22,22,2009,Transfer Learning for Reinforcement Learning Domains: A Survey,"Matthew E. Taylor, P. Stone",Journal of machine learning research,2009-12-01,2048,118,256.66,Reinforcement Learning and Agents,survey/review; reinforcement-learning,machine-learning; reinforcement-learning,Positions Transfer Learning for Reinforcement Learning Domains: A Survey within Reinforcement Learning and Agents.,"high citation signal (2,048); influential citation signal (118); recognized venue","Sample efficiency, reward misspecification, simulator bias, and safety under exploration remain persistent barriers.; Benchmark performance may not transfer to physical robots, human-facing tools, or open-ended environments.; Agentic systems need stronger evidence on reliability, recovery from errors, and long-horizon oversight.",https://doi.org/10.5555/1577069.1755839,https://www.semanticscholar.org/paper/467568f1777bc51a15a5100516cd4fe8de62b9ab,,,10.5555/1577069.1755839,,,17216004,Computer Science,JournalArticle; Review,machine learning; reinforcement learning,2,citations=2048; influential=118; recognized venue; survey/benchmark signal; open PDF metadata; title AI matches=1; AI term matches=2; query hits=2,
1047,23,23,2009,Learning Bayesian Networks with the bnlearn R Package,M. Scutari,,2009-08-26,1979,160,242.138,Generative Models and Synthetic Media,generative,generative-ai,bnlearn is an R package (R Development Core Team 2010) which includes several algorithms for learning the structure of Bayesian networks with either discrete or continuous variables.,"high citation signal (1,979); influential citation signal (160); open-access PDF metadata","Image and media quality metrics may not capture factuality, controllability, provenance, or downstream harms.; Training data provenance and copyright constraints can be under-specified in highly cited generation work.; Robust evaluation across cultures, modalities, and adversarial uses remains difficult.",https://doi.org/10.18637/JSS.V035.I03,https://www.semanticscholar.org/paper/6a324ff29bca5cb4584ca869a9bab987fc8bed3f,https://doi.org/10.18637/jss.v035.i03,,10.18637/JSS.V035.I03,0908.3817,,61360696,Computer Science; Mathematics,,bayesian networks,1,citations=1979; influential=160; open PDF metadata; title AI matches=1; AI term matches=1,"bnlearn is an R package (R Development Core Team 2010) which includes several algorithms for learning the structure of Bayesian networks with either discrete or continuous variables. Both constraint-based and score-based algorithms are implemented, and can use the functionality provided by the snow package (Tierney et al. 2008) to improve their performance via parallel computing. Several network scores and conditional independence algorithms are available for both the learning algorithms and independent use. Advanced plotting options are provided by the Rgraphviz package (Gentry et al. 2010)."
1094,24,24,2009,Matrix Completion With Noise,"E. Candès, Y. Plan",Proceedings of the IEEE,2009-03-18,1853,166,242.204,Vision and Multimodal Learning,metadata-ranked,machine-learning; vision; reinforcement-learning; ai4science,"On the heels of compressed sensing, a new field has very recently emerged.","high citation signal (1,853); influential citation signal (166); open-access PDF metadata","Large-scale benchmark success can overstate robustness under distribution shift, rare classes, and real deployment constraints.; Multimodal alignment may inherit biases and spurious correlations from web-scale data.; High-performing systems often require data and compute resources that are hard for smaller labs to reproduce.",https://doi.org/10.1109/JPROC.2009.2035722,https://www.semanticscholar.org/paper/d13e466cbd7c8ac764b3dfd3e3a12c7e8736412f,https://authors.library.caltech.edu/records/txy5j-yct41/files/Candes2010p10178P_Ieee.pdf?download=1,,10.1109/JPROC.2009.2035722,0903.3131,,109721,Computer Science; Engineering; Mathematics,JournalArticle; Review,computer vision; machine learning,2,citations=1853; influential=166; open PDF metadata; AI term matches=2; query hits=2,"On the heels of compressed sensing, a new field has very recently emerged. This field addresses a broad range of problems of significant practical interest, namely, the recovery of a data matrix from what appears to be incomplete, and perhaps even corrupted, information. In its simplest form, the problem is to recover a matrix from a small sample of its entries. It comes up in many areas of science and engineering, including collaborative filtering, machine learning, control, remote sensing, and computer vision, to name a few. This paper surveys the novel literature on matrix completion, which shows that under some suitable conditions, one can recover an unknown low-rank matrix from a nearly minimal set of entries by solving a simple convex optimization problem, namely, nuclear-norm minimization subject to data constraints. Further, this paper introduces novel results showing that matrix completion is provably accurate even when the few observed entries are corrupted with a small amount of noise. A typical result is that one can recover an unknown matrix of low rank from just about log noisy samples with an error that is proportional to the noise level. We present numerical results that complement our quantitative analysis and show that, in practice, nuclear-norm minimization accurately fills in the many missing entries of large low-rank matrices from just a few noisy samples. Some analogies between matrix completion and compressed sensing are discussed throughout."
1106,25,25,2009,MACHINE LEARNING An Artificial Intelligence Approach,"R. Michalski, Tom M Mitchell, Jack Mostow, Bernard Nudel, Michael Rychener, R. Quinlan, H. Simon, D. Sleeman, et al.",,,1828,46,228.156,General AI Methods and Systems,metadata-ranked,machine-learning,Positions MACHINE LEARNING An Artificial Intelligence Approach within General AI Methods and Systems.,"high citation signal (1,828); influential citation signal (46)","Survey and infrastructure papers can dominate citations while empirical evidence remains distributed across subfields.; Broad claims need careful mapping to specific tasks, datasets, and operational constraints.; Metadata-driven ranking cannot replace expert reading of full papers and experimental details.",https://www.semanticscholar.org/paper/b6df5c2ac2f91d71b1d08d76135e2a470ac1ad1e,https://www.semanticscholar.org/paper/b6df5c2ac2f91d71b1d08d76135e2a470ac1ad1e,,,,,,3065629,Computer Science,Review,artificial intelligence; machine learning,2,citations=1828; influential=46; open PDF metadata; title AI matches=2; AI term matches=2; query hits=2,
1209,26,26,2009,Differentially Private Empirical Risk Minimization,"Kamalika Chaudhuri, C. Monteleoni, A. Sarwate",Journal of machine learning research,2009-11-30,1605,186,263.629,"AI for Science, Healthcare, and Robotics",benchmark/dataset; trustworthy-ai; ai4science,machine-learning; trustworthy-ai; ai4science,"Privacy-preserving machine learning algorithms are crucial for the increasingly common setting in which personal data, such as medical or financial records, are analyzed.","high citation signal (1,605); influential citation signal (186); recognized venue","External validation, prospective testing, and domain expert review are often more important than retrospective benchmark scores.; Clinical, biological, or robotic deployment can fail when data collection protocols differ from training assumptions.; Safety, interpretability, uncertainty, and regulatory evidence remain essential for translation.",https://doi.org/10.5555/1953048.2021036,https://www.semanticscholar.org/paper/b57c54350769ffa59ff57f79ee5aad918844d298,,,10.5555/1953048.2021036,0912.0071,21892342,1578541,Computer Science; Mathematics; Medicine,JournalArticle,machine learning; support vector machines,2,citations=1605; influential=186; recognized venue; survey/benchmark signal; resource signal; translation/trustworthiness signal; open PDF metadata; AI term matches=4; query hits=2,"Privacy-preserving machine learning algorithms are crucial for the increasingly common setting in which personal data, such as medical or financial records, are analyzed. We provide general techniques to produce privacy-preserving approximations of classifiers learned via (regularized) empirical risk minimization (ERM). These algorithms are private under the ε-differential privacy definition due to Dwork et al. (2006). First we apply the output perturbation ideas of Dwork et al. (2006), to ERM classification. Then we propose a new method, objective perturbation, for privacy-preserving machine learning algorithm design. This method entails perturbing the objective function before optimizing over classifiers. If the loss and regularizer satisfy certain convexity and differentiability criteria, we prove theoretical results showing that our algorithms preserve privacy, and provide generalization bounds for linear and nonlinear kernels. We further present a privacy-preserving technique for tuning the parameters in general machine learning algorithms, thereby providing end-to-end privacy guarantees for the training process. We apply these results to produce privacy-preserving analogues of regularized logistic regression and support vector machines. We obtain encouraging results from evaluating their performance on real demographic and benchmark data sets. Our results show that both theoretically and empirically, objective perturbation is superior to the previous state-of-the-art, output perturbation, in managing the inherent tradeoff between privacy and learning performance."
1215,27,27,2009,The State of Educational Data Mining in 2009: A Review and Future Visions.,"R. Baker, K. Yacef",Educational Data Mining,2009-10-01,1601,62,229.342,General AI Methods and Systems,survey/review,machine-learning,Positions The State of Educational Data Mining in 2009: A Review and Future Visions. within General AI Methods and Systems.,"high citation signal (1,601); influential citation signal (62)","Survey and infrastructure papers can dominate citations while empirical evidence remains distributed across subfields.; Broad claims need careful mapping to specific tasks, datasets, and operational constraints.; Metadata-driven ranking cannot replace expert reading of full papers and experimental details.",https://doi.org/10.5281/ZENODO.3554657,https://www.semanticscholar.org/paper/438cd004c7fa0a5ed74acc28bff1ac3d11b8c80a,,,10.5281/ZENODO.3554657,,,60832273,Computer Science; Education; Engineering,Review,data mining,1,citations=1601; influential=62; survey/benchmark signal; open PDF metadata; title AI matches=1; AI term matches=1,
1216,28,28,2009,"Book Review: Natural Language Processing with Python by Steven Bird, Ewan Klein, and Edward Loper",Michael Elhadad,International Conference on Computational Logic,2009-06-12,1597,104,238.439,Natural Language Processing and Knowledge,survey/review,nlp,"Positions Book Review: Natural Language Processing with Python by Steven Bird, Ewan Klein, and Edward Loper within Natural Language Processing and Knowledge.","high citation signal (1,597); influential citation signal (104); open-access PDF metadata","Benchmark scores can hide brittle reasoning, retrieval failures, hallucination, and domain transfer issues.; Language coverage is often uneven, with English and high-resource domains overrepresented.; Evaluation can be sensitive to annotation protocols, prompt wording, and changing model APIs.",https://doi.org/10.1162/coli_r_00022,https://www.semanticscholar.org/paper/3673bccde93025e05431a2bcac4e8ff18c9c273a,https://direct.mit.edu/coli/article-pdf/36/4/767/1810205/coli_r_00022.pdf,,10.1162/coli_r_00022,,,264266192,Art; Computer Science; Linguistics,JournalArticle; Review,artificial intelligence; natural language processing,2,citations=1597; influential=104; survey/benchmark signal; open PDF metadata; title AI matches=1; AI term matches=1; query hits=2,
1221,29,29,2009,Online actor critic algorithm to solve the continuous-time infinite horizon optimal control problem,"K. Vamvoudakis, F. Lewis",2009 International Joint Conference on Neural Networks,2009-06-14,1590,160,236.326,Reinforcement Learning and Agents,metadata-ranked,reinforcement-learning,Positions Online actor critic algorithm to solve the continuous-time infinite horizon optimal control problem within Reinforcement Learning and Agents.,"high citation signal (1,590); influential citation signal (160)","Sample efficiency, reward misspecification, simulator bias, and safety under exploration remain persistent barriers.; Benchmark performance may not transfer to physical robots, human-facing tools, or open-ended environments.; Agentic systems need stronger evidence on reliability, recovery from errors, and long-horizon oversight.",https://doi.org/10.1016/j.automatica.2010.02.018,https://www.semanticscholar.org/paper/894e0bb5b42294f6b89b4f5b9498fd86139c96f9,,,10.1016/j.automatica.2010.02.018,,,11521287,Computer Science; Engineering; Mathematics,JournalArticle; Conference,neural networks,1,citations=1590; influential=160; open PDF metadata; AI term matches=2,
1237,30,30,2009,"Web Data Mining: Exploring Hyperlinks, Contents, and Usage Data. Second Edition",B. Liu,Data-Centric Systems and Applications,2009-01-21,1564,136,236.704,General AI Methods and Systems,metadata-ranked,machine-learning,"Positions Web Data Mining: Exploring Hyperlinks, Contents, and Usage Data. Second Edition within General AI Methods and Systems.","high citation signal (1,564); influential citation signal (136)","Survey and infrastructure papers can dominate citations while empirical evidence remains distributed across subfields.; Broad claims need careful mapping to specific tasks, datasets, and operational constraints.; Metadata-driven ranking cannot replace expert reading of full papers and experimental details.",https://doi.org/10.1007/978-3-642-19460-3,https://www.semanticscholar.org/paper/3055134761ca2e7748d7d5325d70231d3391d847,,,10.1007/978-3-642-19460-3,,,22596877,Computer Science,,data mining; machine learning,2,citations=1564; influential=136; open PDF metadata; title AI matches=1; AI term matches=1; query hits=2,
1279,31,31,2009,Modeling wine preferences by data mining from physicochemical properties,"P. Cortez, A. Cerdeira, Fernando Almeida, Telmo Matos, J. Reis",Decision Support Systems,2009-11-01,1503,99,242.422,General AI Methods and Systems,benchmark/dataset,machine-learning,We propose a data mining approach to predict human wine taste preferences that is based on easily available analytical tests at the certification step.,"high citation signal (1,503); influential citation signal (99); open-access PDF metadata","Survey and infrastructure papers can dominate citations while empirical evidence remains distributed across subfields.; Broad claims need careful mapping to specific tasks, datasets, and operational constraints.; Metadata-driven ranking cannot replace expert reading of full papers and experimental details.",https://doi.org/10.1016/j.dss.2009.05.016,https://www.semanticscholar.org/paper/bf15a0ccc14ac1deb5cea570c870389c16be019c,https://repositorium.sdum.uminho.pt/bitstream/1822/10029/1/wine5.pdf,,10.1016/j.dss.2009.05.016,,,2996254,Chemistry; Computer Science; Environmental Science,JournalArticle,data mining; neural networks; support vector machines,3,citations=1503; influential=99; survey/benchmark signal; resource signal; open PDF metadata; title AI matches=1; AI term matches=3; query hits=3,"We propose a data mining approach to predict human wine taste preferences that is based on easily available analytical tests at the certification step. A large dataset (when compared to other studies in this domain) is considered, with white and red vinho verde samples (from Portugal). Three regression techniques were applied, under a computationally efficient procedure that performs simultaneous variable and model selection. The support vector machine achieved promising results, outperforming the multiple regression and neural network methods. Such model is useful to support the oenologist wine tasting evaluations and improve wine production. Furthermore, similar techniques can help in target marketing by modeling consumer tastes from niche markets."
1280,32,32,2009,Pedestrian detection: A benchmark,"Piotr Dollár, C. Wojek, B. Schiele, P. Perona",2009 IEEE Conference on Computer Vision and Pattern Recognition,2009-06-20,1502,184,255.02,Vision and Multimodal Learning,benchmark/dataset,machine-learning; vision,Positions Pedestrian detection: A benchmark within Vision and Multimodal Learning.,"high citation signal (1,502); influential citation signal (184); recognized venue; open-access PDF metadata","Large-scale benchmark success can overstate robustness under distribution shift, rare classes, and real deployment constraints.; Multimodal alignment may inherit biases and spurious correlations from web-scale data.; High-performing systems often require data and compute resources that are hard for smaller labs to reproduce.",https://doi.org/10.1109/CVPR.2009.5206631,https://www.semanticscholar.org/paper/3e083dc8aeb7983a5cdff146985363d38caf0886,https://authors.library.caltech.edu/records/wfmsc-r0526/files/05206631.pdf?download=1,,10.1109/CVPR.2009.5206631,,,2451341,Computer Science,JournalArticle; Conference; Review,computer vision,1,citations=1502; influential=184; recognized venue; survey/benchmark signal; resource signal; open PDF metadata; AI term matches=2,
1312,33,33,2009,Functional atlas of emotional faces processing: a voxel-based meta-analysis of 105 functional magnetic resonance imaging studies.,"P. Fusar-Poli, A. Placentino, F. Carletti, P. Landi, P. Allen, S. Surguladze, F. Benedetti, Marta Abbamonte, et al.",Journal of Psychiatry & Neuroscience,2009-11-01,1445,98,240.416,"AI for Science, Healthcare, and Robotics",ai4science,vision; ai4science,BACKGROUND Most of our social interactions involve perception of emotional information from the faces of other people.,"high citation signal (1,445); influential citation signal (98); recognized venue","External validation, prospective testing, and domain expert review are often more important than retrospective benchmark scores.; Clinical, biological, or robotic deployment can fail when data collection protocols differ from training assumptions.; Safety, interpretability, uncertainty, and regulatory evidence remain essential for translation.",https://doi.org/10.1139/jpn.0953,https://www.semanticscholar.org/paper/85b73447455cfe511e3df3b1befa93fedd9ed46a,,,10.1139/jpn.0953,,19949718,18270808,Medicine; Psychology,Review; MetaAnalysis; JournalArticle,neural networks,1,citations=1445; influential=98; recognized venue; translation/trustworthiness signal; open PDF metadata; AI term matches=2,"BACKGROUND Most of our social interactions involve perception of emotional information from the faces of other people. Furthermore, such emotional processes are thought to be aberrant in a range of clinical disorders, including psychosis and depression. However, the exact neurofunctional maps underlying emotional facial processing are not well defined. METHODS Two independent researchers conducted separate comprehensive PubMed (1990 to May 2008) searches to find all functional magnetic resonance imaging (fMRI) studies using a variant of the emotional faces paradigm in healthy participants. The search terms were: ""fMRI AND happy faces,"" ""fMRI AND sad faces,"" ""fMRI AND fearful faces,"" ""fMRI AND angry faces,"" ""fMRI AND disgusted faces"" and ""fMRI AND neutral faces."" We extracted spatial coordinates and inserted them in an electronic database. We performed activation likelihood estimation analysis for voxel-based meta-analyses. RESULTS Of the originally identified studies, 105 met our inclusion criteria. The overall database consisted of 1785 brain coordinates that yielded an overall sample of 1600 healthy participants. Quantitative voxel-based meta-analysis of brain activation provided neurofunctional maps for 1) main effect of human faces; 2) main effect of emotional valence; and 3) modulatory effect of age, sex, explicit versus implicit processing and magnetic field strength. Processing of emotional faces was associated with increased activation in a number of visual, limbic, temporoparietal and prefrontal areas; the putamen; and the cerebellum. Happy, fearful and sad faces specifically activated the amygdala, whereas angry or disgusted faces had no effect on this brain region. Furthermore, amygdala sensitivity was greater for fearful than for happy or sad faces. Insular activation was selectively reported during processing of disgusted and angry faces. However, insular sensitivity was greater for disgusted than for angry faces. Conversely, neural response in the visual cortex and cerebellum was observable across all emotional conditions. LIMITATIONS Although the activation likelihood estimation approach is currently one of the most powerful and reliable meta-analytical methods in neuroimaging research, it is insensitive to effect sizes. CONCLUSION Our study has detailed neurofunctional maps to use as normative references in future fMRI studies of emotional facial processing in psychiatric populations. We found selective differences between neural networks underlying the basic emotions in limbic and insular brain regions."
