rank,yearRank,candidateRank,year,title,authors,venue,publicationDate,citationCount,influentialCitationCount,importanceScore,category,methodTags,keywordTags,keyIdea,strengths,limitations,url,semanticScholarUrl,openAccessPdf,githubUrl,doi,arxiv,pubmed,corpusId,fieldsOfStudy,publicationTypes,sourceQueries,queryHitCount,importanceReasons,abstract
70,1,1,2024,The Llama 3 Herd of Models,"Abhimanyu Dubey, Abhinav Jauhri, Abhinav Pandey, Abhishek Kadian, Ahmad Al-Dahle, Aiesha Letman, Akhil Mathur, A. Schelten, et al.",,2024-07-31,16216,3038,337.534,Foundation Models and Large Language Models,transformer; trustworthy-ai,foundation-models; nlp; vision; trustworthy-ai,Modern artificial intelligence (AI) systems are powered by foundation models.,"high citation signal (16,216); influential citation signal (3,038)","Capability gains are difficult to separate from data scale, benchmark leakage, and evaluation prompt sensitivity.; Alignment and safety claims often need stronger real-world and multilingual validation.; Compute-intensive training can limit reproducibility and concentrate follow-up work around a small number of institutions.",https://arxiv.org/abs/2407.21783,https://www.semanticscholar.org/paper/40e8af970329135ec95057d73e239dab805ad128,,,,2407.21783,,271571434,Computer Science; Linguistics,,artificial intelligence; foundation models,2,citations=16216; influential=3038; translation/trustworthiness signal; open PDF metadata; AI term matches=6; query hits=2,"Modern artificial intelligence (AI) systems are powered by foundation models. This paper presents a new set of foundation models, called Llama 3. It is a herd of language models that natively support multilinguality, coding, reasoning, and tool usage. Our largest model is a dense Transformer with 405B parameters and a context window of up to 128K tokens. This paper presents an extensive empirical evaluation of Llama 3. We find that Llama 3 delivers comparable quality to leading language models such as GPT-4 on a plethora of tasks. We publicly release Llama 3, including pre-trained and post-trained versions of the 405B parameter language model and our Llama Guard 3 model for input and output safety. The paper also presents the results of experiments in which we integrate image, video, and speech capabilities into Llama 3 via a compositional approach. We observe this approach performs competitively with the state-of-the-art on image, video, and speech recognition tasks. The resulting models are not yet being broadly released as they are still under development."
391,2,2,2024,GPT-4o System Card,"OpenAI Aaron Hurst, Adam Lerer, Adam P. Goucher, Adam Perelman, Aditya Ramesh, Aidan Clark, AJ Ostrow, Akila Welihinda, et al.",,2024-10-25,4341,880,288.209,Foundation Models and Large Language Models,transformer; trustworthy-ai,machine-learning; foundation-models; nlp; vision; trustworthy-ai,"GPT-4o is an autoregressive omni model that accepts as input any combination of text, audio, image, and video, and generates any combination of text, audio, and image outputs.","high citation signal (4,341); influential citation signal (880)","Capability gains are difficult to separate from data scale, benchmark leakage, and evaluation prompt sensitivity.; Alignment and safety claims often need stronger real-world and multilingual validation.; Compute-intensive training can limit reproducibility and concentrate follow-up work around a small number of institutions.",https://arxiv.org/abs/2410.21276,https://www.semanticscholar.org/paper/7943ec4a67151a559b25cd34369e661c9a7924c8,,,,2410.21276,,273662196,Computer Science; Engineering,,neural networks,1,citations=4341; influential=880; resource signal; translation/trustworthiness signal; open PDF metadata; AI term matches=2,"GPT-4o is an autoregressive omni model that accepts as input any combination of text, audio, image, and video, and generates any combination of text, audio, and image outputs. It's trained end-to-end across text, vision, and audio, meaning all inputs and outputs are processed by the same neural network. GPT-4o can respond to audio inputs in as little as 232 milliseconds, with an average of 320 milliseconds, which is similar to human response time in conversation. It matches GPT-4 Turbo performance on text in English and code, with significant improvement on text in non-English languages, while also being much faster and 50\% cheaper in the API. GPT-4o is especially better at vision and audio understanding compared to existing models. In line with our commitment to building AI safely and consistent with our voluntary commitments to the White House, we are sharing the GPT-4o System Card, which includes our Preparedness Framework evaluations. In this System Card, we provide a detailed look at GPT-4o's capabilities, limitations, and safety evaluations across multiple categories, focusing on speech-to-speech while also evaluating text and image capabilities, and measures we've implemented to ensure the model is safe and aligned. We also include third-party assessments on dangerous capabilities, as well as discussion of potential societal impacts of GPT-4o's text and vision capabilities."
392,3,3,2024,Qwen2-VL: Enhancing Vision-Language Model's Perception of the World at Any Resolution,"Peng Wang, Shuai Bai, Sinan Tan, Shijie Wang, Zhihao Fan, Jinze Bai, Ke-Yang Chen, Xuejing Liu, et al.",arXiv.org,2024-09-18,4318,590,280.503,Foundation Models and Large Language Models,transformer,foundation-models; multimodal; nlp; vision,"We present the Qwen2-VL Series, an advanced upgrade of the previous Qwen-VL models that redefines the conventional predetermined-resolution approach in visual processing.","high citation signal (4,318); influential citation signal (590)","Capability gains are difficult to separate from data scale, benchmark leakage, and evaluation prompt sensitivity.; Alignment and safety claims often need stronger real-world and multilingual validation.; Compute-intensive training can limit reproducibility and concentrate follow-up work around a small number of institutions.",https://doi.org/10.48550/arxiv.2409.12191,https://www.semanticscholar.org/paper/a22b23b65cdbc0335b872ed7c7a7206c710f8997,,https://github.com/QwenLM/Qwen2-VL,10.48550/arXiv.2409.12191,2409.12191,,272704132,Computer Science,JournalArticle,large language models,1,citations=4318; influential=590; resource signal; open PDF metadata; title AI matches=1; AI term matches=1,"We present the Qwen2-VL Series, an advanced upgrade of the previous Qwen-VL models that redefines the conventional predetermined-resolution approach in visual processing. Qwen2-VL introduces the Naive Dynamic Resolution mechanism, which enables the model to dynamically process images of varying resolutions into different numbers of visual tokens. This approach allows the model to generate more efficient and accurate visual representations, closely aligning with human perceptual processes. The model also integrates Multimodal Rotary Position Embedding (M-RoPE), facilitating the effective fusion of positional information across text, images, and videos. We employ a unified paradigm for processing both images and videos, enhancing the model's visual perception capabilities. To explore the potential of large multimodal models, Qwen2-VL investigates the scaling laws for large vision-language models (LVLMs). By scaling both the model size-with versions at 2B, 8B, and 72B parameters-and the amount of training data, the Qwen2-VL Series achieves highly competitive performance. Notably, the Qwen2-VL-72B model achieves results comparable to leading models such as GPT-4o and Claude3.5-Sonnet across various multimodal benchmarks, outperforming other generalist models. Code is available at https://github.com/QwenLM/Qwen2-VL ."
406,4,4,2024,Qwen2.5 Technical Report,"Qwen An Yang, Baosong Yang, Beichen Zhang, Binyuan Hui, Bo Zheng, Bowen Yu, Chengyuan Li, Dayiheng Liu, et al.",arXiv.org,2024-12-19,4243,582,281.926,Foundation Models and Large Language Models,transformer; self-supervised; reinforcement-learning,foundation-models; multimodal; nlp; reinforcement-learning,"In this report, we introduce Qwen2.5, a comprehensive series of large language models (LLMs) designed to meet diverse needs.","high citation signal (4,243); influential citation signal (582)","Capability gains are difficult to separate from data scale, benchmark leakage, and evaluation prompt sensitivity.; Alignment and safety claims often need stronger real-world and multilingual validation.; Compute-intensive training can limit reproducibility and concentrate follow-up work around a small number of institutions.",https://doi.org/10.48550/arxiv.2412.15115,https://www.semanticscholar.org/paper/88aa6b1f37d1fd8e0a40499ce9bb87873f03aaa8,,https://github.com/qwenlm/qwen2.5,10.48550/arXiv.2412.15115,2412.15115,,274859421,Computer Science,JournalArticle,foundation models; large language models; multimodal learning; reinforcement learning,4,citations=4243; influential=582; open PDF metadata; AI term matches=4; query hits=4,"In this report, we introduce Qwen2.5, a comprehensive series of large language models (LLMs) designed to meet diverse needs. Compared to previous iterations, Qwen 2.5 has been significantly improved during both the pre-training and post-training stages. In terms of pre-training, we have scaled the high-quality pre-training datasets from the previous 7 trillion tokens to 18 trillion tokens. This provides a strong foundation for common sense, expert knowledge, and reasoning capabilities. In terms of post-training, we implement intricate supervised finetuning with over 1 million samples, as well as multistage reinforcement learning. Post-training techniques enhance human preference, and notably improve long text generation, structural data analysis, and instruction following. To handle diverse and varied use cases effectively, we present Qwen2.5 LLM series in rich sizes. Open-weight offerings include base and instruction-tuned models, with quantized versions available. In addition, for hosted solutions, the proprietary models currently include two mixture-of-experts (MoE) variants: Qwen2.5-Turbo and Qwen2.5-Plus, both available from Alibaba Cloud Model Studio. Qwen2.5 has demonstrated top-tier performance on a wide range of benchmarks evaluating language understanding, reasoning, mathematics, coding, human preference alignment, etc. Specifically, the open-weight flagship Qwen2.5-72B-Instruct outperforms a number of open and proprietary models and demonstrates competitive performance to the state-of-the-art open-weight model, Llama-3-405B-Instruct, which is around 5 times larger. Qwen2.5-Turbo and Qwen2.5-Plus offer superior cost-effectiveness while performing competitively against GPT-4o-mini and GPT-4o respectively. Additionally, as the foundation, Qwen2.5 models have been instrumental in training specialized models such as Qwen2.5-Math, Qwen2.5-Coder, QwQ, and multimodal models."
462,5,5,2024,YOLOv9: Learning What You Want to Learn Using Programmable Gradient Information,"Chien-Yao Wang, I-Hau Yeh, Hongpeng Liao",European Conference on Computer Vision,2024-02-21,3870,256,271.435,Vision and Multimodal Learning,benchmark/dataset,vision; reinforcement-learning,Today's deep learning methods focus on how to design the most appropriate objective functions so that the prediction results of the model can be closest to the ground truth.,"high citation signal (3,870); influential citation signal (256)","Large-scale benchmark success can overstate robustness under distribution shift, rare classes, and real deployment constraints.; Multimodal alignment may inherit biases and spurious correlations from web-scale data.; High-performing systems often require data and compute resources that are hard for smaller labs to reproduce.",https://doi.org/10.48550/arxiv.2402.13616,https://www.semanticscholar.org/paper/cf70392a3b1ae92fdb1b70448aaddcbd03726d3d,,https://github.com/WongKinYiu/yolov9,10.48550/arXiv.2402.13616,2402.13616,,267770251,Computer Science,JournalArticle; Conference,deep learning,1,citations=3870; influential=256; survey/benchmark signal; resource signal; open PDF metadata; AI term matches=3,"Today's deep learning methods focus on how to design the most appropriate objective functions so that the prediction results of the model can be closest to the ground truth. Meanwhile, an appropriate architecture that can facilitate acquisition of enough information for prediction has to be designed. Existing methods ignore a fact that when input data undergoes layer-by-layer feature extraction and spatial transformation, large amount of information will be lost. This paper will delve into the important issues of data loss when data is transmitted through deep networks, namely information bottleneck and reversible functions. We proposed the concept of programmable gradient information (PGI) to cope with the various changes required by deep networks to achieve multiple objectives. PGI can provide complete input information for the target task to calculate objective function, so that reliable gradient information can be obtained to update network weights. In addition, a new lightweight network architecture -- Generalized Efficient Layer Aggregation Network (GELAN), based on gradient path planning is designed. GELAN's architecture confirms that PGI has gained superior results on lightweight models. We verified the proposed GELAN and PGI on MS COCO dataset based object detection. The results show that GELAN only uses conventional convolution operators to achieve better parameter utilization than the state-of-the-art methods developed based on depth-wise convolution. PGI can be used for variety of models from lightweight to large. It can be used to obtain complete information, so that train-from-scratch models can achieve better results than state-of-the-art models pre-trained using large datasets, the comparison results are shown in Figure 1. The source codes are at: https://github.com/WongKinYiu/yolov9."
489,6,6,2024,Gemini 1.5: Unlocking multimodal understanding across millions of tokens of context,"Machel Reid, N. Savinov, Denis Teplyashin, Dmitry Lepikhin, T. Lillicrap, Jean-Baptiste Alayrac, Radu Soricut, Angeliki Lazaridou, et al.",arXiv.org,2024-03-08,3706,806,277.502,Foundation Models and Large Language Models,transformer; retrieval,foundation-models; multimodal; vision,"duce the Gemini 1.5 family of models, representing the next generation of highly compute-efficient multimodal models capable of recalling and reasoning over fine-grained information from millions of tokens of context, including multiple long documents and hours of video and audio.","high citation signal (3,706); influential citation signal (806)","Capability gains are difficult to separate from data scale, benchmark leakage, and evaluation prompt sensitivity.; Alignment and safety claims often need stronger real-world and multilingual validation.; Compute-intensive training can limit reproducibility and concentrate follow-up work around a small number of institutions.",https://arxiv.org/abs/2403.05530,https://www.semanticscholar.org/paper/c811bedbe8f4c21d0cba9f9175f7c2eb203284a7,,,,2403.05530,,268297180,Computer Science,JournalArticle,large language models,1,citations=3706; influential=806; open PDF metadata; AI term matches=2,"In this report, we introduce the Gemini 1.5 family of models, representing the next generation of highly compute-efficient multimodal models capable of recalling and reasoning over fine-grained information from millions of tokens of context, including multiple long documents and hours of video and audio. The family includes two new models: (1) an updated Gemini 1.5 Pro, which exceeds the February version on the great majority of capabilities and benchmarks; (2) Gemini 1.5 Flash, a more lightweight variant designed for efficiency with minimal regression in quality. Gemini 1.5 models achieve near-perfect recall on long-context retrieval tasks across modalities, improve the state-of-the-art in long-document QA, long-video QA and long-context ASR, and match or surpass Gemini 1.0 Ultra's state-of-the-art performance across a broad set of benchmarks. Studying the limits of Gemini 1.5's long-context ability, we find continued improvement in next-token prediction and near-perfect retrieval (>99%) up to at least 10M tokens, a generational leap over existing models such as Claude 3.0 (200k) and GPT-4 Turbo (128k). Finally, we highlight real-world use cases, such as Gemini 1.5 collaborating with professionals on completing their tasks achieving 26 to 75% time savings across 10 different job categories, as well as surprising new capabilities of large language models at the frontier; when given a grammar manual for Kalamang, a language with fewer than 200 speakers worldwide, the model learns to translate English to Kalamang at a similar level to a person who learned from the same content."
533,7,7,2024,SAM 2: Segment Anything in Images and Videos,"Nikhila Ravi, Valentin Gabeur, Yuan-Ting Hu, Ronghang Hu, Chaitanya K. Ryali, Tengyu Ma, Haitham Khedr, Roman Rädle, et al.",International Conference on Learning Representations,2024-08-01,3469,504,278.486,Foundation Models and Large Language Models,benchmark/dataset; transformer,foundation-models; vision,"We present Segment Anything Model 2 (SAM 2), a foundation model towards solving promptable visual segmentation in images and videos.","high citation signal (3,469); influential citation signal (504)","Capability gains are difficult to separate from data scale, benchmark leakage, and evaluation prompt sensitivity.; Alignment and safety claims often need stronger real-world and multilingual validation.; Compute-intensive training can limit reproducibility and concentrate follow-up work around a small number of institutions.",https://doi.org/10.48550/arxiv.2408.00714,https://www.semanticscholar.org/paper/92a09cdfc19f3f582d89c28c1b4f386299cc69e1,,https://github.com/facebookresearch/sam2,10.48550/arXiv.2408.00714,2408.00714,,271601113,Computer Science,JournalArticle,foundation models,1,citations=3469; influential=504; survey/benchmark signal; resource signal; open PDF metadata; AI term matches=3,"We present Segment Anything Model 2 (SAM 2), a foundation model towards solving promptable visual segmentation in images and videos. We build a data engine, which improves model and data via user interaction, to collect the largest video segmentation dataset to date. Our model is a simple transformer architecture with streaming memory for real-time video processing. SAM 2 trained on our data provides strong performance across a wide range of tasks. In video segmentation, we observe better accuracy, using 3x fewer interactions than prior approaches. In image segmentation, our model is more accurate and 6x faster than the Segment Anything Model (SAM). We believe that our data, model, and insights will serve as a significant milestone for video segmentation and related perception tasks. We are releasing our main model, dataset, as well as code for model training and our demo."
703,8,8,2024,YOLOv11: An Overview of the Key Architectural Enhancements,"Rahima Khanam, Muhammad Hussain",arXiv.org,2024-10-23,2854,222,258.751,Vision and Multimodal Learning,survey/review; transformer,vision,"This study presents an architectural analysis of YOLOv11, the latest iteration in the YOLO (You Only Look Once) series of object detection models.","high citation signal (2,854); influential citation signal (222)","Large-scale benchmark success can overstate robustness under distribution shift, rare classes, and real deployment constraints.; Multimodal alignment may inherit biases and spurious correlations from web-scale data.; High-performing systems often require data and compute resources that are hard for smaller labs to reproduce.",https://doi.org/10.48550/arxiv.2410.17725,https://www.semanticscholar.org/paper/adccc00dbd0fe63e4e34bc3445a29bc2ec910cbc,,,10.48550/arXiv.2410.17725,2410.17725,,273532028,Computer Science,JournalArticle; Review,computer vision,1,citations=2854; influential=222; survey/benchmark signal; open PDF metadata; AI term matches=2,"This study presents an architectural analysis of YOLOv11, the latest iteration in the YOLO (You Only Look Once) series of object detection models. We examine the models architectural innovations, including the introduction of the C3k2 (Cross Stage Partial with kernel size 2) block, SPPF (Spatial Pyramid Pooling - Fast), and C2PSA (Convolutional block with Parallel Spatial Attention) components, which contribute in improving the models performance in several ways such as enhanced feature extraction. The paper explores YOLOv11's expanded capabilities across various computer vision tasks, including object detection, instance segmentation, pose estimation, and oriented object detection (OBB). We review the model's performance improvements in terms of mean Average Precision (mAP) and computational efficiency compared to its predecessors, with a focus on the trade-off between parameter count and accuracy. Additionally, the study discusses YOLOv11's versatility across different model sizes, from nano to extra-large, catering to diverse application needs from edge devices to high-performance computing environments. Our research provides insights into YOLOv11's position within the broader landscape of object detection and its potential impact on real-time computer vision applications."
856,9,9,2024,VMamba: Visual State Space Model,"Yue Liu, Yunjie Tian, Yuzhong Zhao, Hongtian Yu, Lingxi Xie, Yaowei Wang, Qixiang Ye, Yunfan Liu",Neural Information Processing Systems,2024-01-18,2430,344,264.323,Foundation Models and Large Language Models,benchmark/dataset,foundation-models; nlp; vision,Designing computationally efficient network architectures remains an ongoing necessity in computer vision.,"high citation signal (2,430); influential citation signal (344)","Capability gains are difficult to separate from data scale, benchmark leakage, and evaluation prompt sensitivity.; Alignment and safety claims often need stronger real-world and multilingual validation.; Compute-intensive training can limit reproducibility and concentrate follow-up work around a small number of institutions.",https://doi.org/10.48550/arxiv.2401.10166,https://www.semanticscholar.org/paper/b24e899ec0f77eef2fc87a9b8e50516367aa1f97,,https://github.com/MzeroMiko/VMamba,10.48550/arXiv.2401.10166,2401.10166,,267035250,Computer Science,JournalArticle,computer vision,1,citations=2430; influential=344; survey/benchmark signal; resource signal; open PDF metadata; AI term matches=2,"Designing computationally efficient network architectures remains an ongoing necessity in computer vision. In this paper, we adapt Mamba, a state-space language model, into VMamba, a vision backbone with linear time complexity. At the core of VMamba is a stack of Visual State-Space (VSS) blocks with the 2D Selective Scan (SS2D) module. By traversing along four scanning routes, SS2D bridges the gap between the ordered nature of 1D selective scan and the non-sequential structure of 2D vision data, which facilitates the collection of contextual information from various sources and perspectives. Based on the VSS blocks, we develop a family of VMamba architectures and accelerate them through a succession of architectural and implementation enhancements. Extensive experiments demonstrate VMamba's promising performance across diverse visual perception tasks, highlighting its superior input scaling efficiency compared to existing benchmark models. Source code is available at https://github.com/MzeroMiko/VMamba."
