rank,yearRank,candidateRank,year,title,authors,venue,publicationDate,citationCount,influentialCitationCount,importanceScore,category,methodTags,keywordTags,keyIdea,strengths,limitations,url,semanticScholarUrl,openAccessPdf,githubUrl,doi,arxiv,pubmed,corpusId,fieldsOfStudy,publicationTypes,sourceQueries,queryHitCount,importanceReasons,abstract
1936,71,71,2009,Spectral–Spatial Classification of Hyperspectral Imagery Based on Partitional Clustering Techniques,"Y. Tarabalka, J. Benediktsson, J. Chanussot",IEEE Transactions on Geoscience and Remote Sensing,2009-04-24,755,37,213.743,Vision and Multimodal Learning,metadata-ranked,machine-learning,Positions Spectral–Spatial Classification of Hyperspectral Imagery Based on Partitional Clustering Techniques within Vision and Multimodal Learning.,high citation signal (755); influential citation signal (37); recognized venue,"Large-scale benchmark success can overstate robustness under distribution shift, rare classes, and real deployment constraints.; Multimodal alignment may inherit biases and spurious correlations from web-scale data.; High-performing systems often require data and compute resources that are hard for smaller labs to reproduce.",https://doi.org/10.1109/TGRS.2009.2016214,https://www.semanticscholar.org/paper/f19122b082188e626ff8355cfcaa432e68509272,,,10.1109/TGRS.2009.2016214,,,10574569,Computer Science; Environmental Science,JournalArticle,support vector machines,1,citations=755; influential=37; recognized venue; open PDF metadata; title AI matches=2; AI term matches=2,
1943,72,72,2009,"Multi-Task Feature Learning Via Efficient l2, 1-Norm Minimization","Jun Liu, Shuiwang Ji, Jieping Ye",Conference on Uncertainty in Artificial Intelligence,2009-06-18,753,55,215.114,"AI for Science, Healthcare, and Robotics",trustworthy-ai,vision; trustworthy-ai; ai4science,The problem of joint feature selection across a group of related tasks has applications in many areas including biomedical informatics and computer vision.,high citation signal (753); influential citation signal (55); recognized venue,"External validation, prospective testing, and domain expert review are often more important than retrospective benchmark scores.; Clinical, biological, or robotic deployment can fail when data collection protocols differ from training assumptions.; Safety, interpretability, uncertainty, and regulatory evidence remain essential for translation.",https://www.semanticscholar.org/paper/e99e6cdb3d3667a6192250586d19f50438206cef,https://www.semanticscholar.org/paper/e99e6cdb3d3667a6192250586d19f50438206cef,,,,1205.2631,,51985230,Computer Science; Mathematics,JournalArticle; Conference,computer vision,1,citations=753; influential=55; recognized venue; open PDF metadata; AI term matches=2,"The problem of joint feature selection across a group of related tasks has applications in many areas including biomedical informatics and computer vision. We consider the l2, 1-norm regularized regression model for joint feature selection from multiple tasks, which can be derived in the probabilistic framework by assuming a suitable prior from the exponential family. One appealing feature of the l2, 1-norm regularization is that it encourages multiple predictors to share similar sparsity patterns. However, the resulting optimization problem is challenging to solve due to the non-smoothness of the l2, 1-norm regularization. In this paper, we propose to accelerate the computation by reformulating it as two equivalent smooth convex optimization problems which are then solved via the Nesterov's method---an optimal first-order black-box method for smooth convex optimization. A key building block in solving the reformulations is the Euclidean projection. We show that the Euclidean projection for the first reformulation can be analytically computed, while the Euclidean projection for the second one can be computed in linear time. Empirical evaluations on several data sets verify the efficiency of the proposed algorithms."
2006,73,73,2009,The Top Ten Algorithms in Data Mining,"Xindong Wu, Vipin Kumar",,2009-04-09,720,52,204.358,General AI Methods and Systems,metadata-ranked,machine-learning,Positions The Top Ten Algorithms in Data Mining within General AI Methods and Systems.,high citation signal (720); influential citation signal (52),"Survey and infrastructure papers can dominate citations while empirical evidence remains distributed across subfields.; Broad claims need careful mapping to specific tasks, datasets, and operational constraints.; Metadata-driven ranking cannot replace expert reading of full papers and experimental details.",https://doi.org/10.1201/9781420089653,https://www.semanticscholar.org/paper/85f57aa4b0bc3a443bbd076ed352106721f4a5cc,,,10.1201/9781420089653,,,53880748,Computer Science; Mathematics,Review,data mining,1,citations=720; influential=52; open PDF metadata; title AI matches=1; AI term matches=1,
2031,74,74,2009,Parallel K-Means Clustering Based on MapReduce,"Weizhong Zhao, Huifang Ma, Qing He",International Conference on Cloud Computing,2009-11-22,705,36,198.864,General AI Methods and Systems,metadata-ranked,machine-learning,Positions Parallel K-Means Clustering Based on MapReduce within General AI Methods and Systems.,high citation signal (705); influential citation signal (36),"Survey and infrastructure papers can dominate citations while empirical evidence remains distributed across subfields.; Broad claims need careful mapping to specific tasks, datasets, and operational constraints.; Metadata-driven ranking cannot replace expert reading of full papers and experimental details.",https://doi.org/10.1007/978-3-642-10665-1_71,https://www.semanticscholar.org/paper/23db2d9c5a97f36f1b63ea249402b4be0919ebc9,,,10.1007/978-3-642-10665-1_71,,,18462610,Computer Science,JournalArticle,data mining,1,citations=705; influential=36; open PDF metadata; title AI matches=1; AI term matches=1,
2043,75,75,2009,A kernel functions analysis for support vector machines for land cover classification,"T. Kavzoglu, I. Colkesen",International Journal of Applied Earth Observation and Geoinformation,2009-10-01,701,30,199.262,"Graph Learning, Recommendation, and Core Methods",metadata-ranked,machine-learning,"Positions A kernel functions analysis for support vector machines for land cover classification within Graph Learning, Recommendation, and Core Methods.",high citation signal (701); influential citation signal (30),"Graph and recommender benchmarks can contain temporal leakage, popularity bias, or unrealistic train/test splits.; Algorithmic gains may be sensitive to hyperparameter budgets and implementation details.; Core methods need careful ablations before broad claims about generality or efficiency are accepted.",https://doi.org/10.1016/j.jag.2009.06.002,https://www.semanticscholar.org/paper/53dd4141f85857c366766c1ac5f78c2b7392372e,,,10.1016/j.jag.2009.06.002,,,11625727,Computer Science; Environmental Science; Geography,JournalArticle,support vector machines,1,citations=701; influential=30; open PDF metadata; title AI matches=2; AI term matches=2,
2049,76,76,2009,A study of statistical techniques and performance measures for genetics-based machine learning: accuracy and interpretability,"S. García, Alberto Fernández, Julián Luengo, F. Herrera","Soft Computing - A Fusion of Foundations, Methodologies and Applications",2009-04-02,699,18,192.346,"Trustworthy, Explainable, and Responsible AI",trustworthy-ai,machine-learning; trustworthy-ai,"Positions A study of statistical techniques and performance measures for genetics-based machine learning: accuracy and interpretability within Trustworthy, Explainable, and Responsible AI.",high citation signal (699); influential citation signal (18),"Explanations can be persuasive without being faithful to model internals or decision processes.; Fairness, robustness, privacy, and safety metrics can conflict and require domain-specific tradeoffs.; Responsible AI results often need stronger deployment evidence beyond benchmark or synthetic settings.",https://doi.org/10.1007/S00500-008-0392-Y,https://www.semanticscholar.org/paper/79217fc643a2ee73b2d36c12f97dbd3b8d85be45,,,10.1007/S00500-008-0392-Y,,,10478272,Biology; Computer Science; Mathematics,JournalArticle,machine learning,1,citations=699; influential=18; translation/trustworthiness signal; open PDF metadata; title AI matches=1; AI term matches=1,
2069,77,77,2009,Sentiment classification of online reviews to travel destinations by supervised machine learning approaches,"Q. Ye, Ziqiong Zhang, R. Law",Expert systems with applications,2009-04-01,688,32,199.726,General AI Methods and Systems,metadata-ranked,machine-learning,Positions Sentiment classification of online reviews to travel destinations by supervised machine learning approaches within General AI Methods and Systems.,high citation signal (688); influential citation signal (32); open-access PDF metadata,"Survey and infrastructure papers can dominate citations while empirical evidence remains distributed across subfields.; Broad claims need careful mapping to specific tasks, datasets, and operational constraints.; Metadata-driven ranking cannot replace expert reading of full papers and experimental details.",https://doi.org/10.1016/j.eswa.2008.07.035,https://www.semanticscholar.org/paper/ed98884e807148fa957cc5ca21b43ae4a5502871,http://hdl.handle.net/10397/13420,,10.1016/j.eswa.2008.07.035,,,36684925,Computer Science,JournalArticle; Review,machine learning,1,citations=688; influential=32; open PDF metadata; title AI matches=2; AI term matches=2,
2088,78,78,2009,What can Natural Language Processing do for Clinical Decision Support?,"Dina Demner-Fushman, W. Chapman, C. McDonald",Journal of Biomedical Informatics,2009-08-13,677,14,194.334,"AI for Science, Healthcare, and Robotics",survey/review; ai4science,nlp; ai4science,Computerized Clinical Decision Support (CDS) aims to aid decision making of health care providers and the public by providing easily accessible health-related information at the point and time it is needed.,high citation signal (677); influential citation signal (14); open-access PDF metadata,"External validation, prospective testing, and domain expert review are often more important than retrospective benchmark scores.; Clinical, biological, or robotic deployment can fail when data collection protocols differ from training assumptions.; Safety, interpretability, uncertainty, and regulatory evidence remain essential for translation.",https://doi.org/10.1016/j.jbi.2009.08.007,https://www.semanticscholar.org/paper/5b73be2f2373f9f6bf3d3137bcdc7b8065901746,https://europepmc.org/articles/pmc2757540?pdf=render,,10.1016/j.jbi.2009.08.007,,19683066,13780041,Computer Science; Medicine,Review; JournalArticle,natural language processing,1,citations=677; influential=14; survey/benchmark signal; translation/trustworthiness signal; open PDF metadata; title AI matches=1; AI term matches=2,"Computerized Clinical Decision Support (CDS) aims to aid decision making of health care providers and the public by providing easily accessible health-related information at the point and time it is needed. Natural Language Processing (NLP) is instrumental in using free-text information to drive CDS, representing clinical knowledge and CDS interventions in standardized formats, and leveraging clinical narrative. The early innovative NLP research of clinical narrative was followed by a period of stable research conducted at the major clinical centers and a shift of mainstream interest to biomedical NLP. This review primarily focuses on the recently renewed interest in development of fundamental NLP methods and advances in the NLP systems for CDS. The current solutions to challenges posed by distinct sublanguages, intended user groups, and support goals are discussed."
2126,79,79,2009,Moments and Moment Invariants in Pattern Recognition,"J. Flusser, B. Zitová, T. Suk",,2009-12-14,659,37,199.755,General AI Methods and Systems,metadata-ranked,machine-learning,Positions Moments and Moment Invariants in Pattern Recognition within General AI Methods and Systems.,high citation signal (659); influential citation signal (37); open-access PDF metadata,"Survey and infrastructure papers can dominate citations while empirical evidence remains distributed across subfields.; Broad claims need careful mapping to specific tasks, datasets, and operational constraints.; Metadata-driven ranking cannot replace expert reading of full papers and experimental details.",https://doi.org/10.1002/9780470684757,https://www.semanticscholar.org/paper/db176bcafb749ada615f719e7f89b5eea69b6e82,https://onlinelibrary.wiley.com/doi/pdf/10.1002/9780470684757.fmatter,,10.1002/9780470684757,,,117480013,Computer Science; Mathematics,Review,computer vision; pattern recognition,2,citations=659; influential=37; open PDF metadata; title AI matches=1; AI term matches=1; query hits=2,
2134,80,80,2009,Neural Network for Graphs: A Contextual Constructive Approach,A. Micheli,IEEE Transactions on Neural Networks,2009-03-01,658,17,200.261,Natural Language Processing and Knowledge,metadata-ranked,machine-learning,Positions Neural Network for Graphs: A Contextual Constructive Approach within Natural Language Processing and Knowledge.,high citation signal (658); influential citation signal (17); recognized venue,"Benchmark scores can hide brittle reasoning, retrieval failures, hallucination, and domain transfer issues.; Language coverage is often uneven, with English and high-resource domains overrepresented.; Evaluation can be sensitive to annotation protocols, prompt wording, and changing model APIs.",https://doi.org/10.1109/TNN.2008.2010350,https://www.semanticscholar.org/paper/ec2b2569b3a0d70a5b45d48b041dec9060d85eb7,,,10.1109/TNN.2008.2010350,,19193509,17486263,Computer Science; Medicine,JournalArticle,graph neural networks; neural networks,2,citations=658; influential=17; recognized venue; open PDF metadata; title AI matches=1; AI term matches=2; query hits=2,
2146,81,81,2009,Artificial neural network modeling of the river water quality—A case study,"Kunwar P. Singh, Ankita Basant, A. Malik, Gunja Jain",,2009-03-24,653,18,187.851,General AI Methods and Systems,metadata-ranked,machine-learning,Positions Artificial neural network modeling of the river water quality—A case study within General AI Methods and Systems.,high citation signal (653); influential citation signal (18),"Survey and infrastructure papers can dominate citations while empirical evidence remains distributed across subfields.; Broad claims need careful mapping to specific tasks, datasets, and operational constraints.; Metadata-driven ranking cannot replace expert reading of full papers and experimental details.",https://doi.org/10.1016/J.ECOLMODEL.2009.01.004,https://www.semanticscholar.org/paper/184ee75ed2f7c0cde7338be47a9f2f3a446079e8,,,10.1016/J.ECOLMODEL.2009.01.004,,,84459423,Computer Science; Environmental Science; Mathematics,,neural networks,1,citations=653; influential=18; open PDF metadata; title AI matches=1; AI term matches=1,
2156,82,82,2009,Effective diagnosis of heart disease through neural networks ensembles,"Resul Das, I. Türkoglu, A. Şengür",Expert systems with applications,2009-05-01,647,46,203.328,"Graph Learning, Recommendation, and Core Methods",metadata-ranked,graph-learning,"Positions Effective diagnosis of heart disease through neural networks ensembles within Graph Learning, Recommendation, and Core Methods.",high citation signal (647); influential citation signal (46),"Graph and recommender benchmarks can contain temporal leakage, popularity bias, or unrealistic train/test splits.; Algorithmic gains may be sensitive to hyperparameter budgets and implementation details.; Core methods need careful ablations before broad claims about generality or efficiency are accepted.",https://doi.org/10.1016/j.eswa.2008.09.013,https://www.semanticscholar.org/paper/17cd447e313b8405b65be57785fd7c6bea51379e,,,10.1016/j.eswa.2008.09.013,,,7991646,Computer Science; Medicine,JournalArticle,neural networks,1,citations=647; influential=46; open PDF metadata; title AI matches=2; AI term matches=2,
2158,83,83,2009,A generic method for assignment of reliability scores applied to solvent accessibility predictions,"Bent Petersen, T. Petersen, P. Andersen, Morten Nielsen, C. Lundegaard",BMC Structural Biology,2009-07-31,646,59,203.712,"AI for Science, Healthcare, and Robotics",ai4science,machine-learning; ai4science,BackgroundEstimation of the reliability of specific real value predictions is nontrivial and the efficacy of this is often questionable.,high citation signal (646); influential citation signal (59); open-access PDF metadata,"External validation, prospective testing, and domain expert review are often more important than retrospective benchmark scores.; Clinical, biological, or robotic deployment can fail when data collection protocols differ from training assumptions.; Safety, interpretability, uncertainty, and regulatory evidence remain essential for translation.",https://doi.org/10.1186/1472-6807-9-51,https://www.semanticscholar.org/paper/079c2926db5caa9adfef1303f54c38f11e982b2b,https://bmcstructbiol.biomedcentral.com/counter/pdf/10.1186/1472-6807-9-51,,10.1186/1472-6807-9-51,,19646261,11778054,Biology; Chemistry; Medicine,JournalArticle,neural networks,1,citations=646; influential=59; open PDF metadata; AI term matches=3,"BackgroundEstimation of the reliability of specific real value predictions is nontrivial and the efficacy of this is often questionable. It is important to know if you can trust a given prediction and therefore the best methods associate a prediction with a reliability score or index. For discrete qualitative predictions, the reliability is conventionally estimated as the difference between output scores of selected classes. Such an approach is not feasible for methods that predict a biological feature as a single real value rather than a classification. As a solution to this challenge, we have implemented a method that predicts the relative surface accessibility of an amino acid and simultaneously predicts the reliability for each prediction, in the form of a Z-score.ResultsAn ensemble of artificial neural networks has been trained on a set of experimentally solved protein structures to predict the relative exposure of the amino acids. The method assigns a reliability score to each surface accessibility prediction as an inherent part of the training process. This is in contrast to the most commonly used procedures where reliabilities are obtained by post-processing the output.ConclusionThe performance of the neural networks was evaluated on a commonly used set of sequences known as the CB513 set. An overall Pearson's correlation coefficient of 0.72 was obtained, which is comparable to the performance of the currently best public available method, Real-SPINE. Both methods associate a reliability score with the individual predictions. However, our implementation of reliability scores in the form of a Z-score is shown to be the more informative measure for discriminating good predictions from bad ones in the entire range from completely buried to fully exposed amino acids. This is evident when comparing the Pearson's correlation coefficient for the upper 20% of predictions sorted according to reliability. For this subset, values of 0.79 and 0.74 are obtained using our and the compared method, respectively. This tendency is true for any selected subset."
2165,84,84,2009,Neural network approach to continuous-time direct adaptive optimal control for partially unknown nonlinear systems,"D. Vrabie, F. Lewis",Neural Networks,2009-04-01,642,33,198.624,Reinforcement Learning and Agents,metadata-ranked,machine-learning; reinforcement-learning,Positions Neural network approach to continuous-time direct adaptive optimal control for partially unknown nonlinear systems within Reinforcement Learning and Agents.,high citation signal (642); influential citation signal (33),"Sample efficiency, reward misspecification, simulator bias, and safety under exploration remain persistent barriers.; Benchmark performance may not transfer to physical robots, human-facing tools, or open-ended environments.; Agentic systems need stronger evidence on reliability, recovery from errors, and long-horizon oversight.",https://doi.org/10.1016/j.neunet.2009.03.008,https://www.semanticscholar.org/paper/f056b896ef139385e0e9e9a5105357cb44a1cda2,,,10.1016/j.neunet.2009.03.008,,19362449,25829402,Computer Science; Engineering; Mathematics; Medicine,JournalArticle,neural networks; reinforcement learning,2,citations=642; influential=33; open PDF metadata; title AI matches=1; AI term matches=2; query hits=2,
2180,85,85,2009,Error Minimized Extreme Learning Machine With Growth of Hidden Nodes and Incremental Learning,"Guorui Feng, G. Huang, Qingping Lin, R. Gay",IEEE Transactions on Neural Networks,2009-08-01,634,33,206.349,General AI Methods and Systems,metadata-ranked,machine-learning,Positions Error Minimized Extreme Learning Machine With Growth of Hidden Nodes and Incremental Learning within General AI Methods and Systems.,high citation signal (634); influential citation signal (33); recognized venue,"Survey and infrastructure papers can dominate citations while empirical evidence remains distributed across subfields.; Broad claims need careful mapping to specific tasks, datasets, and operational constraints.; Metadata-driven ranking cannot replace expert reading of full papers and experimental details.",https://doi.org/10.1109/TNN.2009.2024147,https://www.semanticscholar.org/paper/f2642db17084b14068d56f332de2f2d5a1622c5a,,,10.1109/TNN.2009.2024147,,19596632,17292559,Computer Science; Medicine,JournalArticle,machine learning; neural networks,2,citations=634; influential=33; recognized venue; open PDF metadata; AI term matches=2; query hits=2,
2187,86,86,2009,Neural-Network-Based Near-Optimal Control for a Class of Discrete-Time Affine Nonlinear Systems With Control Constraints,"Huaguang Zhang, Yanhong Luo, Derong Liu",IEEE Transactions on Neural Networks,2009-09-01,632,13,191.857,Reinforcement Learning and Agents,metadata-ranked,reinforcement-learning,Positions Neural-Network-Based Near-Optimal Control for a Class of Discrete-Time Affine Nonlinear Systems With Control Constraints within Reinforcement Learning and Agents.,high citation signal (632); influential citation signal (13); recognized venue,"Sample efficiency, reward misspecification, simulator bias, and safety under exploration remain persistent barriers.; Benchmark performance may not transfer to physical robots, human-facing tools, or open-ended environments.; Agentic systems need stronger evidence on reliability, recovery from errors, and long-horizon oversight.",https://doi.org/10.1109/TNN.2009.2027233,https://www.semanticscholar.org/paper/cde66ff34b934d0eb6a33263a036a410a89159bc,,,10.1109/TNN.2009.2027233,,19661001,1149692,Computer Science; Engineering; Mathematics; Medicine,JournalArticle,neural networks,1,citations=632; influential=13; recognized venue; open PDF metadata; AI term matches=2,
2190,87,87,2009,Bayesian Regularization of Neural Networks,"F. Burden, D. Winkler",Artificial Neural Networks,,630,18,192.063,"Graph Learning, Recommendation, and Core Methods",metadata-ranked,graph-learning,"Positions Bayesian Regularization of Neural Networks within Graph Learning, Recommendation, and Core Methods.",high citation signal (630); influential citation signal (18),"Graph and recommender benchmarks can contain temporal leakage, popularity bias, or unrealistic train/test splits.; Algorithmic gains may be sensitive to hyperparameter budgets and implementation details.; Core methods need careful ablations before broad claims about generality or efficiency are accepted.",https://doi.org/10.1007/978-1-60327-101-1_3,https://www.semanticscholar.org/paper/7630724e68a1ea5a7d270eb4d3de53007f600bb6,,,10.1007/978-1-60327-101-1_3,,19065804,23387485,Chemistry; Computer Science; Medicine,Review; JournalArticle,bayesian networks; neural networks,2,citations=630; influential=18; open PDF metadata; title AI matches=2; AI term matches=2; query hits=2,
2191,88,88,2009,Decentralized Robust Adaptive Control for the Multiagent System Consensus Problem Using Neural Networks,"Z. Hou, Long Cheng, M. Tan","IEEE Transactions on Systems, Man, and Cybernetics, Part B (Cybernetics)",2009-06-01,629,45,215.407,Reinforcement Learning and Agents,trustworthy-ai,reinforcement-learning; trustworthy-ai,Positions Decentralized Robust Adaptive Control for the Multiagent System Consensus Problem Using Neural Networks within Reinforcement Learning and Agents.,high citation signal (629); influential citation signal (45); recognized venue,"Sample efficiency, reward misspecification, simulator bias, and safety under exploration remain persistent barriers.; Benchmark performance may not transfer to physical robots, human-facing tools, or open-ended environments.; Agentic systems need stronger evidence on reliability, recovery from errors, and long-horizon oversight.",https://doi.org/10.1109/TSMCB.2008.2007810,https://www.semanticscholar.org/paper/1ba585c374ba84cb7a6ca53d36a7641627d9397b,,,10.1109/TSMCB.2008.2007810,,19174350,206793411,Computer Science; Engineering; Medicine,JournalArticle,neural networks,1,citations=629; influential=45; recognized venue; translation/trustworthiness signal; open PDF metadata; title AI matches=2; AI term matches=2,
