rank,yearRank,candidateRank,year,title,authors,venue,publicationDate,citationCount,influentialCitationCount,importanceScore,category,methodTags,keywordTags,keyIdea,strengths,limitations,url,semanticScholarUrl,openAccessPdf,doi,arxiv,pubmed,corpusId,fieldsOfStudy,publicationTypes,sourceQueries,queryHitCount,importanceReasons,abstract
371,77,77,2021,A survey on security and privacy of federated learning,"Viraaji Mothukuri, R. Parizi, Seyedamin Pouriyeh, Yan-ping Huang, A. Dehghantanha, Gautam Srivastava",Future generations computer systems,2021-02-01,1359,43,228.714,Natural Language Processing and Knowledge,survey/review; trustworthy-ai,trustworthy-ai,Abstract Federated learning (FL) is a new breed of Artificial Intelligence (AI) that builds upon decentralized data and training that brings learning to the edge or directly on-device.,"high citation signal (1,359); influential citation signal (43)","Benchmark scores can hide brittle reasoning, retrieval failures, hallucination, and domain transfer issues.; Language coverage is often uneven, with English and high-resource domains overrepresented.; Evaluation can be sensitive to annotation protocols, prompt wording, and changing model APIs.",https://doi.org/10.1016/j.future.2020.10.007,https://www.semanticscholar.org/paper/478df2ddc7159853d0da9c9d6fc2211077edbe80,,10.1016/j.future.2020.10.007,,,225140677,Computer Science,JournalArticle; Review,artificial intelligence,1,citations=1359; influential=43; survey/benchmark signal; translation/trustworthiness signal; open PDF metadata; title AI matches=2; AI term matches=4,"Abstract Federated learning (FL) is a new breed of Artificial Intelligence (AI) that builds upon decentralized data and training that brings learning to the edge or directly on-device. FL is a new research area often referred to as a new dawn in AI, is in its infancy, and has not yet gained much trust in the community, mainly because of its (unknown) security and privacy implications. To advance the state of the research in this area and to realize extensive utilization of the FL approach and its mass adoption, its security and privacy concerns must be first identified, evaluated, and documented. FL is preferred in use-cases where security and privacy are the key concerns and having a clear view and understanding of risk factors enable an implementer/adopter of FL to successfully build a secure environment and gives researchers a clear vision on possible research areas. This paper aims to provide a comprehensive study concerning FL’s security and privacy aspects that can help bridge the gap between the current state of federated AI and a future in which mass adoption is possible. We present an illustrative description of approaches and various implementation styles with an examination of the current challenges in FL and establish a detailed review of security and privacy concerns that need to be considered in a thorough and clear context. Findings from our study suggest that overall there are fewer privacy-specific threats associated with FL compared to security threats. The most specific security threats currently are communication bottlenecks, poisoning, and backdoor attacks while inference-based attacks are the most critical to the privacy of FL. We conclude the paper with much needed future research directions to make FL adaptable in realistic scenarios."
372,78,78,2021,Federated Learning for Internet of Things: A Comprehensive Survey,"Dinh C. Nguyen, Ming Ding, P. Pathirana, A. Seneviratne, Jun Li, F. I. H. Vincent Poor",IEEE Communications Surveys and Tutorials,2021-04-16,1357,47,227.9,"AI for Science, Healthcare, and Robotics",survey/review; trustworthy-ai; ai4science,trustworthy-ai; ai4science,The Internet of Things (IoT) is penetrating many facets of our daily life with the proliferation of intelligent services and applications empowered by artificial intelligence (AI).,"high citation signal (1,357); influential citation signal (47); open-access PDF metadata","External validation, prospective testing, and domain expert review are often more important than retrospective benchmark scores.; Clinical, biological, or robotic deployment can fail when data collection protocols differ from training assumptions.; Safety, interpretability, uncertainty, and regulatory evidence remain essential for translation.",https://doi.org/10.1109/COMST.2021.3075439,https://www.semanticscholar.org/paper/f03333b06c1b2e356dcc03f6bd3ef3d849d531e5,https://ieeexplore.ieee.org/ielx7/9739/9520094/09415623.pdf,10.1109/COMST.2021.3075439,2104.07914,,233289549,Computer Science; Education; Engineering,JournalArticle; Review,artificial intelligence,1,citations=1357; influential=47; survey/benchmark signal; translation/trustworthiness signal; open PDF metadata; title AI matches=1; AI term matches=4,"The Internet of Things (IoT) is penetrating many facets of our daily life with the proliferation of intelligent services and applications empowered by artificial intelligence (AI). Traditionally, AI techniques require centralized data collection and processing that may not be feasible in realistic application scenarios due to the high scalability of modern IoT networks and growing data privacy concerns. Federated Learning (FL) has emerged as a distributed collaborative AI approach that can enable many intelligent IoT applications, by allowing for AI training at distributed IoT devices without the need for data sharing. In this article, we provide a comprehensive survey of the emerging applications of FL in IoT networks, beginning from an introduction to the recent advances in FL and IoT to a discussion of their integration. Particularly, we explore and analyze the potential of FL for enabling a wide range of IoT services, including IoT data sharing, data offloading and caching, attack detection, localization, mobile crowdsensing, and IoT privacy and security. We then provide an extensive survey of the use of FL in various key IoT applications such as smart healthcare, smart transportation, Unmanned Aerial Vehicles (UAVs), smart cities, and smart industry. The important lessons learned from this review of the FL-IoT services and applications are also highlighted. We complete this survey by highlighting the current challenges and possible directions for future research in this booming area."
374,79,79,2021,MetaFormer is Actually What You Need for Vision,"Weihao Yu, Romy Mi Luo, Pan Zhou, Chenyang Si, Yichen Zhou, Xinchao Wang, Jiashi Feng, Shuicheng Yan",Computer Vision and Pattern Recognition,2021-11-22,1355,144,241.345,Vision and Multimodal Learning,transformer,vision,Transformers have shown great potential in computer vision tasks.,"high citation signal (1,355); influential citation signal (144); recognized venue; open-access PDF metadata","Large-scale benchmark success can overstate robustness under distribution shift, rare classes, and real deployment constraints.; Multimodal alignment may inherit biases and spurious correlations from web-scale data.; High-performing systems often require data and compute resources that are hard for smaller labs to reproduce.",https://doi.org/10.1109/CVPR52688.2022.01055,https://www.semanticscholar.org/paper/57150ca7d793d6f784cf82da1c349edf7beb6bc2,http://arxiv.org/pdf/2111.11418,10.1109/CVPR52688.2022.01055,2111.11418,,244478080,Computer Science,JournalArticle; Conference,computer vision,1,citations=1355; influential=144; recognized venue; open PDF metadata; AI term matches=2,"Transformers have shown great potential in computer vision tasks. A common belief is their attention-based token mixer module contributes most to their competence. However, recent works show the attention-based module in transformers can be replaced by spatial MLPs and the resulted models still perform quite well. Based on this observation, we hypothesize that the general architecture of the transformers, instead of the specific token mixer module, is more essential to the model's performance. To verify this, we deliberately replace the attention module in transformers with an embarrassingly simple spatial pooling operator to conduct only basic token mixing. Surprisingly, we observe that the derived model, termed as PoolFormer, achieves competitive performance on multiple computer vision tasks. For example, on ImageNet-1K, PoolFormer achieves 82.1 % top-1 accuracy, surpassing well-tuned vision transformer/MLP-like baselines DeiT-B/ResMLP-B24 by 0.3%/1.1% accuracy with 35%/52% fewer parameters and 49%/61% fewer MACs. The effectiveness of Pool-Former verifies our hypothesis and urges us to initiate the concept of “MetaFormer”, a general architecture abstracted from transformers without specifying the token mixer. Based on the extensive experiments, we argue that MetaFormer is the key player in achieving superior results for recent transformer and MLP-like models on vision tasks. This work calls for more future research dedicated to improving MetaFormer instead of focusing on the token mixer modules. Additionally, our proposed PoolFormer could serve as a starting baseline for future MetaFormer architecture design."
376,80,80,2021,SpectralFormer: Rethinking Hyperspectral Image Classification With Transformers,"D. Hong, Zhu Han, Jing Yao, Lianru Gao, Bing Zhang, A. Plaza, J. Chanussot",IEEE Transactions on Geoscience and Remote Sensing,2021-07-07,1345,107,242.057,Vision and Multimodal Learning,metadata-ranked,vision,"Hyperspectral (HS) images are characterized by approximately contiguous spectral information, enabling the fine identification of materials by capturing subtle spectral discrepancies.","high citation signal (1,345); influential citation signal (107); recognized venue; open-access PDF metadata","Large-scale benchmark success can overstate robustness under distribution shift, rare classes, and real deployment constraints.; Multimodal alignment may inherit biases and spurious correlations from web-scale data.; High-performing systems often require data and compute resources that are hard for smaller labs to reproduce.",https://doi.org/10.1109/TGRS.2021.3130716,https://www.semanticscholar.org/paper/e38dc0554dd89745bb17039a4d4ee9d714cf77f1,https://arxiv.org/pdf/2107.02988,10.1109/TGRS.2021.3130716,2107.02988,,235755242,Computer Science; Engineering; Materials Science,JournalArticle,deep learning,1,citations=1345; influential=107; recognized venue; open PDF metadata; title AI matches=2; AI term matches=3,"Hyperspectral (HS) images are characterized by approximately contiguous spectral information, enabling the fine identification of materials by capturing subtle spectral discrepancies. Due to their excellent locally contextual modeling ability, convolutional neural networks (CNNs) have been proven to be a powerful feature extractor in HS image classification. However, CNNs fail to mine and represent the sequence attributes of spectral signatures well due to the limitations of their inherent network backbone. To solve this issue, we rethink HS image classification from a sequential perspective with transformers and propose a novel backbone network called SpectralFormer. Beyond bandwise representations in classic transformers, SpectralFormer is capable of learning spectrally local sequence information from neighboring bands of HS images, yielding groupwise spectral embeddings. More significantly, to reduce the possibility of losing valuable information in the layerwise propagation process, we devise a cross-layer skip connection to convey memory-like components from shallow to deep layers by adaptively learning to fuse “soft” residuals across layers. It is worth noting that the proposed SpectralFormer is a highly flexible backbone network, which can be applicable to both pixelwise and patchwise inputs. We evaluate the classification performance of the proposed SpectralFormer on three HS datasets by conducting extensive experiments, showing the superiority over classic transformers and achieving a significant improvement in comparison with state-of-the-art backbone networks. The codes of this work will be available at https://github.com/danfenghong/IEEE_TGRS_SpectralFormer for the sake of reproducibility."
377,81,81,2021,MedMNIST v2 - A large-scale lightweight benchmark for 2D and 3D biomedical image classification,"Jiancheng Yang, Rui Shi, D. Wei, Zequan Liu, Lin Zhao, B. Ke, H. Pfister, Bingbing Ni",Scientific Data,2021-10-27,1341,145,245.213,"AI for Science, Healthcare, and Robotics",benchmark/dataset,vision; ai4science,"Measurement(s) supervised machine learning Technology Type(s) machine learning We introduce MedMNIST v2 , a large-scale MNIST-like dataset collection of standardized biomedical images, including 12 datasets for 2D and 6 datasets for 3D.","high citation signal (1,341); influential citation signal (145); open-access PDF metadata","External validation, prospective testing, and domain expert review are often more important than retrospective benchmark scores.; Clinical, biological, or robotic deployment can fail when data collection protocols differ from training assumptions.; Safety, interpretability, uncertainty, and regulatory evidence remain essential for translation.",https://doi.org/10.1038/s41597-022-01721-8,https://www.semanticscholar.org/paper/a66606a0bb11a1d5a7a14ec09df8a3481121ad6c,https://www.nature.com/articles/s41597-022-01721-8.pdf,10.1038/s41597-022-01721-8,2110.14795,36658144,240070756,Computer Science; Engineering; Medicine,JournalArticle,computer vision; machine learning,2,citations=1341; influential=145; survey/benchmark signal; resource signal; open PDF metadata; title AI matches=1; AI term matches=4; query hits=2,"Measurement(s) supervised machine learning Technology Type(s) machine learning We introduce MedMNIST v2 , a large-scale MNIST-like dataset collection of standardized biomedical images, including 12 datasets for 2D and 6 datasets for 3D. All images are pre-processed into a small size of 28 × 28 (2D) or 28 × 28 × 28 (3D) with the corresponding classification labels so that no background knowledge is required for users. Covering primary data modalities in biomedical images, MedMNIST v2 is designed to perform classification on lightweight 2D and 3D images with various dataset scales (from 100 to 100,000) and diverse tasks (binary/multi-class, ordinal regression, and multi-label). The resulting dataset, consisting of 708,069 2D images and 9,998 3D images in total, could support numerous research/educational purposes in biomedical image analysis, computer vision, and machine learning. We benchmark several baseline methods on MedMNIST v2, including 2D/3D neural networks and open-source/commercial AutoML tools. The data and code are publicly available at https://medmnist.com/ ."
381,82,82,2021,A survey on deep learning and its applications,"S. Dong, Ping Wang, Khushnood Abbas",Computer Science Review,2021-05-01,1337,18,228.599,"AI for Science, Healthcare, and Robotics",survey/review; ai4science,nlp; vision; ai4science,"Abstract Deep learning, a branch of machine learning, is a frontier for artificial intelligence, aiming to be closer to its primary goal—artificial intelligence.","high citation signal (1,337); influential citation signal (18); recognized venue","External validation, prospective testing, and domain expert review are often more important than retrospective benchmark scores.; Clinical, biological, or robotic deployment can fail when data collection protocols differ from training assumptions.; Safety, interpretability, uncertainty, and regulatory evidence remain essential for translation.",https://doi.org/10.1016/J.COSREV.2021.100379,https://www.semanticscholar.org/paper/3af679c9c4f727dd4e6dc69dfde22a871e85da1e,,10.1016/J.COSREV.2021.100379,,,233547699,Computer Science,JournalArticle; Review,artificial intelligence; computer vision; deep learning; machine learning; natural language processing,5,citations=1337; influential=18; recognized venue; survey/benchmark signal; open PDF metadata; title AI matches=1; AI term matches=6; query hits=5,"Abstract Deep learning, a branch of machine learning, is a frontier for artificial intelligence, aiming to be closer to its primary goal—artificial intelligence. This paper mainly adopts the summary and the induction methods of deep learning. Firstly, it introduces the global development and the current situation of deep learning. Secondly, it describes the structural principle, the characteristics, and some kinds of classic models of deep learning, such as stacked auto encoder, deep belief network, deep Boltzmann machine, and convolutional neural network. Thirdly, it presents the latest developments and applications of deep learning in many fields such as speech processing, computer vision, natural language processing, and medical applications. Finally, it puts forward the problems and the future research directions of deep learning."
383,83,83,2021,Rich feature hierarchies for accurate object detection and semantic segmentation,"A.Y. Virasova, D. Klimov, O.E. Khromov, I. R. Gubaidullin, V. V. Oreshko",Radioengineering,,1331,163,238.676,Vision and Multimodal Learning,metadata-ranked,vision,"Formulation of the problem. Over the past few years, there has been little progress in object detection techniques.","high citation signal (1,331); influential citation signal (163)","Large-scale benchmark success can overstate robustness under distribution shift, rare classes, and real deployment constraints.; Multimodal alignment may inherit biases and spurious correlations from web-scale data.; High-performing systems often require data and compute resources that are hard for smaller labs to reproduce.",https://doi.org/10.18127/j00338486-202109-11,https://www.semanticscholar.org/paper/cd773d9b82f8331f5b2910ec2f52388aafb6dbfd,,10.18127/j00338486-202109-11,,,239533166,Computer Science; Engineering,,artificial intelligence,1,citations=1331; influential=163; open PDF metadata; title AI matches=2; AI term matches=4,"Formulation of the problem. Over the past few years, there has been little progress in object detection techniques. The most efficient are complex computational ensemble methods, which usually combine several low-level image properties with high-level properties. However, every day interest in artificial intelligence is growing, and the idea of using neural networks on board a spacecraft, with the possibility of making decisions and issuing one-time commands, is very promising, since it makes it possible to analyze a large data stream in real time without resorting to ground station, thereby not losing information when transmitting a packet. The purpose of the work is to conduct research on the possibility of effective use of modern models of neural networks, to develop a methodology for their use in the problem of object detection and analysis of the element base for hardware implementation with the possibility of using convolutional neural networks for thermovideotelemetry on board a spacecraft. Results of work. An approach has been formulated that combines two key ideas: 1) application of high-throughput convolutional neural networks for downward processing of image regions in order to localize and segment objects; 2) preliminary training for the auxiliary task, followed by fine tuning of the domain, which gives a significant increase in performance in the case when the training data is insufficient. The analysis of the element base for the possibility of hardware implementation of neural networks on board a spacecraft using electrical radio products of domestic and foreign production is carried out. Practical significance. The efficiency of preliminary network training for an auxiliary task is shown, followed by fine tuning of the subject area. A technique is described that makes it possible to increase the average accuracy of detecting objects in an image by more than 30%. The analysis of the existing element base, the possibility of hardware implementation of neural networks on board the spacecraft using electrical radio products of domestic and foreign production, as well as the criteria for selecting key elements."
384,84,84,2021,Twins: Revisiting the Design of Spatial Attention in Vision Transformers,"Xiangxiang Chu, Zhi Tian, Yuqing Wang, Bo Zhang, Haibing Ren, Xiaolin Wei, Huaxia Xia, Chunhua Shen",Neural Information Processing Systems,2021-04-28,1329,122,233.615,Vision and Multimodal Learning,transformer,vision,"Very recently, a variety of vision transformer architectures for dense prediction tasks have been proposed and they show that the design of spatial attention is critical to their success in these tasks.","high citation signal (1,329); influential citation signal (122)","Large-scale benchmark success can overstate robustness under distribution shift, rare classes, and real deployment constraints.; Multimodal alignment may inherit biases and spurious correlations from web-scale data.; High-performing systems often require data and compute resources that are hard for smaller labs to reproduce.",https://www.semanticscholar.org/paper/6709d5583f658f589ae6a2184805933aceb18849,https://www.semanticscholar.org/paper/6709d5583f658f589ae6a2184805933aceb18849,,,2104.13840,,234364557,Computer Science,JournalArticle,deep learning,1,citations=1329; influential=122; resource signal; open PDF metadata; title AI matches=1; AI term matches=2,"Very recently, a variety of vision transformer architectures for dense prediction tasks have been proposed and they show that the design of spatial attention is critical to their success in these tasks. In this work, we revisit the design of the spatial attention and demonstrate that a carefully-devised yet simple spatial attention mechanism performs favourably against the state-of-the-art schemes. As a result, we propose two vision transformer architectures, namely, Twins-PCPVT and Twins-SVT. Our proposed architectures are highly-efficient and easy to implement, only involving matrix multiplications that are highly optimized in modern deep learning frameworks. More importantly, the proposed architectures achieve excellent performance on a wide range of visual tasks, including image level classification as well as dense detection and segmentation. The simplicity and strong performance suggest that our proposed architectures may serve as stronger backbones for many vision tasks. Our code is released at https://github.com/Meituan-AutoML/Twins ."
386,85,85,2021,Prompt Programming for Large Language Models: Beyond the Few-Shot Paradigm,"Laria Reynolds, Kyle McDonell",CHI Extended Abstracts,2021-02-15,1326,50,226.24,Foundation Models and Large Language Models,transformer; generative,foundation-models; generative-ai; nlp,Prevailing methods for mapping large generative language models to supervised tasks may fail to sufficiently probe models’ novel capabilities.,"high citation signal (1,326); influential citation signal (50); open-access PDF metadata","Capability gains are difficult to separate from data scale, benchmark leakage, and evaluation prompt sensitivity.; Alignment and safety claims often need stronger real-world and multilingual validation.; Compute-intensive training can limit reproducibility and concentrate follow-up work around a small number of institutions.",https://doi.org/10.1145/3411763.3451760,https://www.semanticscholar.org/paper/ac3cdb50606f7770eef8e4cd951840a4f71287a0,http://arxiv.org/pdf/2102.07350,10.1145/3411763.3451760,2102.07350,,231925131,Computer Science,Book; JournalArticle,large language models,1,citations=1326; influential=50; open PDF metadata; title AI matches=4; AI term matches=4,"Prevailing methods for mapping large generative language models to supervised tasks may fail to sufficiently probe models’ novel capabilities. Using GPT-3 as a case study, we show that 0-shot prompts can significantly outperform few-shot prompts. We suggest that the function of few-shot examples in these cases is better described as locating an already learned task rather than meta-learning. This analysis motivates rethinking the role of prompts in controlling and evaluating powerful language models. We discuss methods of prompt programming, emphasizing the usefulness of considering prompts through the lens of natural language. We explore techniques for exploiting the capacity of narratives and cultural anchors to encode nuanced intentions and techniques for encouraging deconstruction of a problem into components before producing a verdict. Informed by this more encompassing theory of prompt programming, we also introduce the idea of a metaprompt that seeds the model to generate its own natural language prompts for a range of tasks. Finally, we discuss how these more general methods of interacting with language models can be incorporated into existing and future benchmarks and practical applications."
