rank,yearRank,candidateRank,year,title,authors,venue,publicationDate,citationCount,influentialCitationCount,importanceScore,category,methodTags,keywordTags,keyIdea,strengths,limitations,url,semanticScholarUrl,openAccessPdf,githubUrl,doi,arxiv,pubmed,corpusId,fieldsOfStudy,publicationTypes,sourceQueries,queryHitCount,importanceReasons,abstract
1821,73,73,2024,AI models collapse when trained on recursively generated data,"Ilia Shumailov, Zakhar Shumaylov, Yiren Zhao, Nicolas Papernot, Ross Anderson, Yarin Gal",Nature,2024-07-01,828,51,225.162,Foundation Models and Large Language Models,transformer; generative,foundation-models; generative-ai; nlp; vision,Stable diffusion revolutionized image creation from descriptive text.,high citation signal (828); influential citation signal (51); recognized venue; open-access PDF metadata,"Capability gains are difficult to separate from data scale, benchmark leakage, and evaluation prompt sensitivity.; Alignment and safety claims often need stronger real-world and multilingual validation.; Compute-intensive training can limit reproducibility and concentrate follow-up work around a small number of institutions.",https://doi.org/10.1038/s41586-024-07566-y,https://www.semanticscholar.org/paper/603d3f90fc40f79ff51258f0295de3ec5107f73e,https://www.nature.com/articles/s41586-024-07566-y.pdf,,10.1038/s41586-024-07566-y,,39048682,271448069,Computer Science; Medicine,JournalArticle,artificial intelligence; generative AI diffusion models; large language models,3,citations=828; influential=51; recognized venue; open PDF metadata; title AI matches=1; AI term matches=6; query hits=3,"Stable diffusion revolutionized image creation from descriptive text. GPT-2 (ref. 1), GPT-3(.5) (ref. 2) and GPT-4 (ref. 3) demonstrated high performance across a variety of language tasks. ChatGPT introduced such language models to the public. It is now clear that generative artificial intelligence (AI) such as large language models (LLMs) is here to stay and will substantially change the ecosystem of online text and images. Here we consider what may happen to GPT-{n} once LLMs contribute much of the text found online. We find that indiscriminate use of model-generated content in training causes irreversible defects in the resulting models, in which tails of the original content distribution disappear. We refer to this effect as ‘model collapse’ and show that it can occur in LLMs as well as in variational autoencoders (VAEs) and Gaussian mixture models (GMMs). We build theoretical intuition behind the phenomenon and portray its ubiquity among all learned generative models. We demonstrate that it must be taken seriously if we are to sustain the benefits of training from large-scale data scraped from the web. Indeed, the value of data collected about genuine human interactions with systems will be increasingly valuable in the presence of LLM-generated content in data crawled from the Internet. Analysis shows that indiscriminately training generative artificial intelligence on real and generated content, usually done by scraping data from the Internet, can lead to a collapse in the ability of the models to generate diverse high-quality output."
1825,74,74,2024,DeepSeek-VL: Towards Real-World Vision-Language Understanding,"Haoyu Lu, Wen Liu, Bo Zhang, Bing-Li Wang, Kai Dong, Bo Liu, Jingxiang Sun, Tongzheng Ren, et al.",arXiv.org,2024-03-08,825,90,225.917,Foundation Models and Large Language Models,benchmark/dataset; trustworthy-ai,foundation-models; multimodal; nlp; vision; trustworthy-ai,"We present DeepSeek-VL, an open-source Vision-Language (VL) Model designed for real-world vision and language understanding applications.",high citation signal (825); influential citation signal (90),"Capability gains are difficult to separate from data scale, benchmark leakage, and evaluation prompt sensitivity.; Alignment and safety claims often need stronger real-world and multilingual validation.; Compute-intensive training can limit reproducibility and concentrate follow-up work around a small number of institutions.",https://doi.org/10.48550/arxiv.2403.05525,https://www.semanticscholar.org/paper/b14e5138d4d1f3577b2390541dc7b730a41bb651,,https://github.com/deepseek-ai/deepseek-vl,10.48550/arXiv.2403.05525,2403.05525,,268297008,Computer Science,JournalArticle,foundation models,1,citations=825; influential=90; survey/benchmark signal; resource signal; translation/trustworthiness signal; open PDF metadata; AI term matches=3,"We present DeepSeek-VL, an open-source Vision-Language (VL) Model designed for real-world vision and language understanding applications. Our approach is structured around three key dimensions: We strive to ensure our data is diverse, scalable, and extensively covers real-world scenarios including web screenshots, PDFs, OCR, charts, and knowledge-based content, aiming for a comprehensive representation of practical contexts. Further, we create a use case taxonomy from real user scenarios and construct an instruction tuning dataset accordingly. The fine-tuning with this dataset substantially improves the model's user experience in practical applications. Considering efficiency and the demands of most real-world scenarios, DeepSeek-VL incorporates a hybrid vision encoder that efficiently processes high-resolution images (1024 x 1024), while maintaining a relatively low computational overhead. This design choice ensures the model's ability to capture critical semantic and detailed information across various visual tasks. We posit that a proficient Vision-Language Model should, foremost, possess strong language abilities. To ensure the preservation of LLM capabilities during pretraining, we investigate an effective VL pretraining strategy by integrating LLM training from the beginning and carefully managing the competitive dynamics observed between vision and language modalities. The DeepSeek-VL family (both 1.3B and 7B models) showcases superior user experiences as a vision-language chatbot in real-world applications, achieving state-of-the-art or competitive performance across a wide range of visual-language benchmarks at the same model size while maintaining robust performance on language-centric benchmarks. We have made both 1.3B and 7B models publicly accessible to foster innovations based on this foundation model."
1863,75,75,2024,Chronos: Learning the Language of Time Series,"Abdul Fatir Ansari, Lorenzo Stella, Caner Turkmen, Xiyuan Zhang, Pedro Mercado, Huibin Shen, Oleksandr Shchur, Syama Sundar Rangapuram, et al.",Trans. Mach. Learn. Res.,2024-03-12,796,163,233.377,Foundation Models and Large Language Models,benchmark/dataset; transformer,foundation-models; generative-ai; nlp,"We introduce Chronos, a simple yet effective framework for pretrained probabilistic time series models.",high citation signal (796); influential citation signal (163),"Capability gains are difficult to separate from data scale, benchmark leakage, and evaluation prompt sensitivity.; Alignment and safety claims often need stronger real-world and multilingual validation.; Compute-intensive training can limit reproducibility and concentrate follow-up work around a small number of institutions.",https://doi.org/10.48550/arxiv.2403.07815,https://www.semanticscholar.org/paper/02fa77e4f355198cb4270f6d4a07517bf09c46dd,,https://github.com/SalesforceAIResearch/uni2ts,10.48550/arXiv.2403.07815,2403.07815,,268363551,Computer Science; Linguistics,JournalArticle,deep learning; large language models,2,citations=796; influential=163; survey/benchmark signal; resource signal; open PDF metadata; AI term matches=4; query hits=2,"We introduce Chronos, a simple yet effective framework for pretrained probabilistic time series models. Chronos tokenizes time series values using scaling and quantization into a fixed vocabulary and trains existing transformer-based language model architectures on these tokenized time series via the cross-entropy loss. We pretrained Chronos models based on the T5 family (ranging from 20M to 710M parameters) on a large collection of publicly available datasets, complemented by a synthetic dataset that we generated via Gaussian processes to improve generalization. In a comprehensive benchmark consisting of 42 datasets, and comprising both classical local models and deep learning methods, we show that Chronos models: (a) significantly outperform other methods on datasets that were part of the training corpus; and (b) have comparable and occasionally superior zero-shot performance on new datasets, relative to methods that were trained specifically on them. Our results demonstrate that Chronos models can leverage time series data from diverse domains to improve zero-shot accuracy on unseen forecasting tasks, positioning pretrained models as a viable tool to greatly simplify forecasting pipelines."
1884,76,76,2024,"Artificial intelligence, firm growth, and product innovation","T. Babina, A. Fedyk, A. He, James Hodson",Journal of Financial Economics,2024-01-01,783,21,194.892,General AI Methods and Systems,metadata-ranked,machine-learning,We study the use and economic impact of AI technologies among U.S.,high citation signal (783); influential citation signal (21); open-access PDF metadata,"Survey and infrastructure papers can dominate citations while empirical evidence remains distributed across subfields.; Broad claims need careful mapping to specific tasks, datasets, and operational constraints.; Metadata-driven ranking cannot replace expert reading of full papers and experimental details.",https://doi.org/10.1016/j.jfineco.2023.103745,https://www.semanticscholar.org/paper/de0cd1cb27ab7a8774b61cb0ee7d6795cb99c690,,,10.1016/j.jfineco.2023.103745,,,252879591,Business; Computer Science; Economics,JournalArticle,artificial intelligence,1,citations=783; influential=21; open PDF metadata; title AI matches=1; AI term matches=2,"We study the use and economic impact of AI technologies among U.S. firms. We propose a new measure of firm-level AI investments, using a unique combination of worker resume and job postings datasets. Our measure reveals a stark increase in AI investments across sectors. AI-investing firms see increased growth in sales, employment, and market valuations. This growth comes primarily through increased product innovation, reflected in trademarks, product patents, and product updates. AI-powered growth concentrates among ex-ante larger firms, leading to higher industry concentration and reinforcing winner-take-most dynamics. Our results highlight that new technologies can contribute to growth through product innovation."
1901,77,77,2024,Refusal in Language Models Is Mediated by a Single Direction,"Andy Arditi, Oscar Obeso, Aaquib Syed, Daniel Paleka, Nina Rimsky, Wes Gurnee, Neel Nanda",Neural Information Processing Systems,2024-06-17,773,156,229.122,Foundation Models and Large Language Models,trustworthy-ai,foundation-models; trustworthy-ai,"Conversational large language models are fine-tuned for both instruction-following and safety, resulting in models that obey benign requests but refuse harmful ones.",high citation signal (773); influential citation signal (156),"Capability gains are difficult to separate from data scale, benchmark leakage, and evaluation prompt sensitivity.; Alignment and safety claims often need stronger real-world and multilingual validation.; Compute-intensive training can limit reproducibility and concentrate follow-up work around a small number of institutions.",https://doi.org/10.48550/arxiv.2406.11717,https://www.semanticscholar.org/paper/88f9af8b0a28e14c42d4f70ce2d911b51a06cd16,,https://github.com/andyrdt/refusal_direction,10.48550/arXiv.2406.11717,2406.11717,,270560489,Computer Science,JournalArticle,large language models,1,citations=773; influential=156; resource signal; translation/trustworthiness signal; open PDF metadata; title AI matches=1; AI term matches=3,"Conversational large language models are fine-tuned for both instruction-following and safety, resulting in models that obey benign requests but refuse harmful ones. While this refusal behavior is widespread across chat models, its underlying mechanisms remain poorly understood. In this work, we show that refusal is mediated by a one-dimensional subspace, across 13 popular open-source chat models up to 72B parameters in size. Specifically, for each model, we find a single direction such that erasing this direction from the model's residual stream activations prevents it from refusing harmful instructions, while adding this direction elicits refusal on even harmless instructions. Leveraging this insight, we propose a novel white-box jailbreak method that surgically disables refusal with minimal effect on other capabilities. Finally, we mechanistically analyze how adversarial suffixes suppress propagation of the refusal-mediating direction. Our findings underscore the brittleness of current safety fine-tuning methods. More broadly, our work showcases how an understanding of model internals can be leveraged to develop practical methods for controlling model behavior."
1903,78,78,2024,VideoLLaMA 2: Advancing Spatial-Temporal Modeling and Audio Understanding in Video-LLMs,"Zesen Cheng, Sicong Leng, Hang Zhang, Yifei Xin, Xin Li, Guanzheng Chen, Yongxin Zhu, Wenqi Zhang, et al.",arXiv.org,2024-06-11,771,145,222.048,Foundation Models and Large Language Models,metadata-ranked,foundation-models; multimodal; nlp; vision,"In this paper, we present the VideoLLaMA 2, a set of Video Large Language Models (Video-LLMs) designed to enhance spatial-temporal modeling and audio understanding in video and audio-oriented tasks.",high citation signal (771); influential citation signal (145),"Capability gains are difficult to separate from data scale, benchmark leakage, and evaluation prompt sensitivity.; Alignment and safety claims often need stronger real-world and multilingual validation.; Compute-intensive training can limit reproducibility and concentrate follow-up work around a small number of institutions.",https://doi.org/10.48550/arxiv.2406.07476,https://www.semanticscholar.org/paper/c6dd31c40836d616b50feab17aff569591c4262e,,https://github.com/damo-nlp-sg/videollama2,10.48550/arXiv.2406.07476,2406.07476,,270380326,Computer Science,JournalArticle,large language models,1,citations=771; influential=145; resource signal; open PDF metadata; AI term matches=2,"In this paper, we present the VideoLLaMA 2, a set of Video Large Language Models (Video-LLMs) designed to enhance spatial-temporal modeling and audio understanding in video and audio-oriented tasks. Building upon its predecessor, VideoLLaMA 2 incorporates a tailor-made Spatial-Temporal Convolution (STC) connector, which effectively captures the intricate spatial and temporal dynamics of video data. Additionally, we integrate an Audio Branch into the model through joint training, thereby enriching the multimodal understanding capabilities of the model by seamlessly incorporating audio cues. Comprehensive evaluations on multiple-choice video question answering (MC-VQA), open-ended video question answering (OE-VQA), and video captioning (VC) tasks demonstrate that VideoLLaMA 2 consistently achieves competitive results among open-source models and even gets close to some proprietary models on several benchmarks. Furthermore, VideoLLaMA 2 exhibits reasonable improvements in audio-only and audio-video question-answering (AQA&OE-AVQA) benchmarks over existing models. These advancements underline VideoLLaMA 2's superior performance in multimodal comprehension, setting a new standard for intelligent video analysis systems. All models are public to facilitate further research."
1912,79,79,2024,DeepSeek LLM: Scaling Open-Source Language Models with Longtermism,"DeepSeek-AI Xiao Bi, Deli Chen, Guanting Chen, Shanhuang Chen, Damai Dai, C. Deng, Honghui Ding, Kai Dong, et al.",arXiv.org,2024-01-05,768,69,221.671,Foundation Models and Large Language Models,benchmark/dataset; transformer; self-supervised,foundation-models,The rapid development of open-source large language models (LLMs) has been truly remarkable.,high citation signal (768); influential citation signal (69),"Capability gains are difficult to separate from data scale, benchmark leakage, and evaluation prompt sensitivity.; Alignment and safety claims often need stronger real-world and multilingual validation.; Compute-intensive training can limit reproducibility and concentrate follow-up work around a small number of institutions.",https://arxiv.org/abs/2401.02954,https://www.semanticscholar.org/paper/7260442ef9c0448f07ce3803efd49cebaffcebe9,,,,2401.02954,,266818336,Computer Science,JournalArticle,large language models,1,citations=768; influential=69; survey/benchmark signal; resource signal; open PDF metadata; title AI matches=2; AI term matches=3,"The rapid development of open-source large language models (LLMs) has been truly remarkable. However, the scaling law described in previous literature presents varying conclusions, which casts a dark cloud over scaling LLMs. We delve into the study of scaling laws and present our distinctive findings that facilitate scaling of large scale models in two commonly used open-source configurations, 7B and 67B. Guided by the scaling laws, we introduce DeepSeek LLM, a project dedicated to advancing open-source language models with a long-term perspective. To support the pre-training phase, we have developed a dataset that currently consists of 2 trillion tokens and is continuously expanding. We further conduct supervised fine-tuning (SFT) and Direct Preference Optimization (DPO) on DeepSeek LLM Base models, resulting in the creation of DeepSeek Chat models. Our evaluation results demonstrate that DeepSeek LLM 67B surpasses LLaMA-2 70B on various benchmarks, particularly in the domains of code, mathematics, and reasoning. Furthermore, open-ended evaluations reveal that DeepSeek LLM 67B Chat exhibits superior performance compared to GPT-3.5."
1914,80,80,2024,Eyes Wide Shut? Exploring the Visual Shortcomings of Multimodal LLMs,"Shengbang Tong, Zhuang Liu, Yuexiang Zhai, Yi Ma, Yann LeCun, Saining Xie",Computer Vision and Pattern Recognition,2024-01-11,767,97,237.353,Foundation Models and Large Language Models,benchmark/dataset; transformer; self-supervised,machine-learning; foundation-models; multimodal; vision,Is vision good enough for language? Recent advancements in multimodal models primarily stem from the powerful reasoning abilities of large language models (LLMs).,high citation signal (767); influential citation signal (97); recognized venue; open-access PDF metadata,"Capability gains are difficult to separate from data scale, benchmark leakage, and evaluation prompt sensitivity.; Alignment and safety claims often need stronger real-world and multilingual validation.; Compute-intensive training can limit reproducibility and concentrate follow-up work around a small number of institutions.",https://doi.org/10.1109/cvpr52733.2024.00914,https://www.semanticscholar.org/paper/ca00f4056f9039d3c1a4c3a113f5ee0527149b66,https://arxiv.org/pdf/2401.06209,,10.1109/CVPR52733.2024.00914,2401.06209,,266976992,Computer Science,JournalArticle; Conference,large language models; multimodal learning,2,citations=767; influential=97; recognized venue; survey/benchmark signal; resource signal; open PDF metadata; AI term matches=6; query hits=2,"Is vision good enough for language? Recent advancements in multimodal models primarily stem from the powerful reasoning abilities of large language models (LLMs). However, the visual component typically depends only on the instance-level contrastive language-image pre-training (CLIP). Our research reveals that the visual capabilities in recent MultiModal LLMs (MLLMs) still exhibit systematic shortcomings. To understand the roots of these errors, we explore the gap between the visual embedding space of CLIP and vision-only self-supervised learning. We identify “CLIP-blind pairs”- images that CLIP perceives as similar despite their clear visual differences. With these pairs, we construct the Multimodal Visual Patterns (MMVP) benchmark. MMVP exposes areas where state-of-the-art systems, including GPT-4V, struggle with straightforward questions across nine basic visual patterns, often providing incorrect answers and hallucinated explanations. We further evaluate various CLIP-based vision-and-language models and found a notable correlation between visual patterns that challenge CLIP models and those problematic for multimodal LLMs. As an initial effort to address these issues, we propose a Mixture of Features (MoF) approach, demonstrating that integrating vision self-supervised learning features with MLLMs can significantly enhance their visual grounding capabilities. Together, our research suggests visual representation learning remains an open challenge, and accurate visual grounding is crucial for future successful multimodal systems."
1935,81,81,2024,Artificial intelligence in education: A systematic literature review,"Shan Wang, Fang Wang, Zhenzhou Zhu, Jingxuan Wang, T. Tran, Zhao Du",Expert systems with applications,2024-10-01,755,45,208.418,General AI Methods and Systems,survey/review,machine-learning,Positions Artificial intelligence in education: A systematic literature review within General AI Methods and Systems.,high citation signal (755); influential citation signal (45); open-access PDF metadata,"Survey and infrastructure papers can dominate citations while empirical evidence remains distributed across subfields.; Broad claims need careful mapping to specific tasks, datasets, and operational constraints.; Metadata-driven ranking cannot replace expert reading of full papers and experimental details.",https://doi.org/10.1016/j.eswa.2024.124167,https://www.semanticscholar.org/paper/a21ab8824cdba6f16324e93efc15551445ed34b6,,,10.1016/j.eswa.2024.124167,,,264875945,Computer Science; Education,JournalArticle; Review,artificial intelligence,1,citations=755; influential=45; survey/benchmark signal; open PDF metadata; title AI matches=1; AI term matches=1,
1938,82,82,2024,MambaIR: A Simple Baseline for Image Restoration with State-Space Model,"Hang Guo, Jinmin Li, Tao Dai, Zhihao Ouyang, Xudong Ren, Shu-Tao Xia",European Conference on Computer Vision,2024-02-23,754,101,218.537,Vision and Multimodal Learning,transformer,vision,"Recent years have seen significant advancements in image restoration, largely attributed to the development of modern deep neural networks, such as CNNs and Transformers.",high citation signal (754); influential citation signal (101),"Large-scale benchmark success can overstate robustness under distribution shift, rare classes, and real deployment constraints.; Multimodal alignment may inherit biases and spurious correlations from web-scale data.; High-performing systems often require data and compute resources that are hard for smaller labs to reproduce.",https://doi.org/10.48550/arxiv.2402.15648,https://www.semanticscholar.org/paper/e730beb44042499763d36214c0498434e470dfd5,,,10.48550/arXiv.2402.15648,2402.15648,,267938238,Computer Science,JournalArticle; Conference,neural networks,1,citations=754; influential=101; resource signal; open PDF metadata; AI term matches=4,"Recent years have seen significant advancements in image restoration, largely attributed to the development of modern deep neural networks, such as CNNs and Transformers. However, existing restoration backbones often face the dilemma between global receptive fields and efficient computation, hindering their application in practice. Recently, the Selective Structured State Space Model, especially the improved version Mamba, has shown great potential for long-range dependency modeling with linear complexity, which offers a way to resolve the above dilemma. However, the standard Mamba still faces certain challenges in low-level vision such as local pixel forgetting and channel redundancy. In this work, we introduce a simple but effective baseline, named MambaIR, which introduces both local enhancement and channel attention to improve the vanilla Mamba. In this way, our MambaIR takes advantage of the local pixel similarity and reduces the channel redundancy. Extensive experiments demonstrate the superiority of our method, for example, MambaIR outperforms SwinIR by up to 0.45dB on image SR, using similar computational cost but with a global receptive field. Code is available at \url{https://github.com/csguoh/MambaIR}."
