rank,yearRank,candidateRank,year,title,authors,venue,publicationDate,citationCount,influentialCitationCount,importanceScore,category,methodTags,keywordTags,keyIdea,strengths,limitations,url,semanticScholarUrl,openAccessPdf,doi,arxiv,pubmed,corpusId,fieldsOfStudy,publicationTypes,sourceQueries,queryHitCount,importanceReasons,abstract
97,21,21,2022,Self-Instruct: Aligning Language Models with Self-Generated Instructions,"Yizhong Wang, Yeganeh Kordi, Swaroop Mishra, Alisa Liu, Noah A. Smith, Daniel Khashabi, Hannaneh Hajishirzi",Annual Meeting of the Association for Computational Linguistics,2022-12-20,3340,275,270.194,Foundation Models and Large Language Models,benchmark/dataset,foundation-models; generative-ai; nlp,"Large “instruction-tuned” language models (i.e., finetuned to respond to instructions) have demonstrated a remarkable ability to generalize zero-shot to new tasks.","high citation signal (3,340); influential citation signal (275); open-access PDF metadata","Capability gains are difficult to separate from data scale, benchmark leakage, and evaluation prompt sensitivity.; Alignment and safety claims often need stronger real-world and multilingual validation.; Compute-intensive training can limit reproducibility and concentrate follow-up work around a small number of institutions.",https://doi.org/10.48550/arXiv.2212.10560,https://www.semanticscholar.org/paper/e65b346d442e9962a4276dc1c1af2956d9d5f1eb,http://arxiv.org/pdf/2212.10560,10.48550/arXiv.2212.10560,2212.10560,,254877310,Computer Science,JournalArticle; Conference,large language models,1,citations=3340; influential=275; survey/benchmark signal; resource signal; open PDF metadata; title AI matches=1; AI term matches=2,"Large “instruction-tuned” language models (i.e., finetuned to respond to instructions) have demonstrated a remarkable ability to generalize zero-shot to new tasks. Nevertheless, they depend heavily on human-written instruction data that is often limited in quantity, diversity, and creativity, therefore hindering the generality of the tuned model. We introduce Self-Instruct, a framework for improving the instruction-following capabilities of pretrained language models by bootstrapping off their own generations. Our pipeline generates instructions, input, and output samples from a language model, then filters invalid or similar ones before using them to finetune the original model. Applying our method to the vanilla GPT3, we demonstrate a 33% absolute improvement over the original model on Super-NaturalInstructions, on par with the performance of InstructGPT-001, which was trained with private user data and human annotations. For further evaluation, we curate a set of expert-written instructions for novel tasks, and show through human evaluation that tuning GPT3 with Self-Instruct outperforms using existing public instruction datasets by a large margin, leaving only a 5% absolute gap behind InstructGPT-001. Self-Instruct provides an almost annotation-free method for aligning pre-trained language models with instructions, and we release our large synthetic dataset to facilitate future studies on instruction tuning."
102,22,22,2022,"Do As I Can, Not As I Say: Grounding Language in Robotic Affordances","Michael Ahn, Anthony Brohan, Noah Brown, Yevgen Chebotar, Omar Cortes, Byron David, Chelsea Finn, K. Gopalakrishnan, et al.",Conference on Robot Learning,2022-04-04,3239,201,255.149,Foundation Models and Large Language Models,ai4science; reinforcement-learning,foundation-models; nlp; vision; reinforcement-learning,Large language models can encode a wealth of semantic knowledge about the world.,"high citation signal (3,239); influential citation signal (201)","Capability gains are difficult to separate from data scale, benchmark leakage, and evaluation prompt sensitivity.; Alignment and safety claims often need stronger real-world and multilingual validation.; Compute-intensive training can limit reproducibility and concentrate follow-up work around a small number of institutions.",https://www.semanticscholar.org/paper/cb5e3f085caefd1f3d5e08637ab55d39e61234fc,https://www.semanticscholar.org/paper/cb5e3f085caefd1f3d5e08637ab55d39e61234fc,,,2204.01691,,247939706,Computer Science; Engineering,JournalArticle,large language models,1,citations=3239; influential=201; open PDF metadata; AI term matches=2,"Large language models can encode a wealth of semantic knowledge about the world. Such knowledge could be extremely useful to robots aiming to act upon high-level, temporally extended instructions expressed in natural language. However, a significant weakness of language models is that they lack real-world experience, which makes it difficult to leverage them for decision making within a given embodiment. For example, asking a language model to describe how to clean a spill might result in a reasonable narrative, but it may not be applicable to a particular agent, such as a robot, that needs to perform this task in a particular environment. We propose to provide real-world grounding by means of pretrained skills, which are used to constrain the model to propose natural language actions that are both feasible and contextually appropriate. The robot can act as the language model's""hands and eyes,""while the language model supplies high-level semantic knowledge about the task. We show how low-level skills can be combined with large language models so that the language model provides high-level knowledge about the procedures for performing complex and temporally-extended instructions, while value functions associated with these skills provide the grounding necessary to connect this knowledge to a particular physical environment. We evaluate our method on a number of real-world robotic tasks, where we show the need for real-world grounding and that this approach is capable of completing long-horizon, abstract, natural language instructions on a mobile manipulator. The project's website and the video can be found at https://say-can.github.io/."
105,23,23,2022,Constitutional AI: Harmlessness from AI Feedback,"Yuntao Bai, Saurav Kadavath, Sandipan Kundu, Amanda Askell, John Kernion, Andy Jones, A. Chen, Anna Goldie, et al.",arXiv.org,2022-12-15,3186,237,267.082,Reinforcement Learning and Agents,benchmark/dataset; reinforcement-learning,reinforcement-learning,"As AI systems become more capable, we would like to enlist their help to supervise other AIs.","high citation signal (3,186); influential citation signal (237); open-access PDF metadata","Sample efficiency, reward misspecification, simulator bias, and safety under exploration remain persistent barriers.; Benchmark performance may not transfer to physical robots, human-facing tools, or open-ended environments.; Agentic systems need stronger evidence on reliability, recovery from errors, and long-horizon oversight.",https://doi.org/10.48550/arXiv.2212.08073,https://www.semanticscholar.org/paper/3936fd3c6187f606c6e4e2e20b196dbc41cc4654,http://arxiv.org/pdf/2212.08073,10.48550/arXiv.2212.08073,2212.08073,,254823489,Computer Science; Law,JournalArticle,reinforcement learning,1,citations=3186; influential=237; survey/benchmark signal; resource signal; open PDF metadata; title AI matches=1; AI term matches=2,"As AI systems become more capable, we would like to enlist their help to supervise other AIs. We experiment with methods for training a harmless AI assistant through self-improvement, without any human labels identifying harmful outputs. The only human oversight is provided through a list of rules or principles, and so we refer to the method as 'Constitutional AI'. The process involves both a supervised learning and a reinforcement learning phase. In the supervised phase we sample from an initial model, then generate self-critiques and revisions, and then finetune the original model on revised responses. In the RL phase, we sample from the finetuned model, use a model to evaluate which of the two samples is better, and then train a preference model from this dataset of AI preferences. We then train with RL using the preference model as the reward signal, i.e. we use 'RL from AI Feedback' (RLAIF). As a result we are able to train a harmless but non-evasive AI assistant that engages with harmful queries by explaining its objections to them. Both the SL and RL methods can leverage chain-of-thought style reasoning to improve the human-judged performance and transparency of AI decision making. These methods make it possible to control AI behavior more precisely and with far fewer human labels."
110,24,24,2022,InstructPix2Pix: Learning to Follow Image Editing Instructions,"Tim Brooks, Aleksander Holynski, Alexei A. Efros",Computer Vision and Pattern Recognition,2022-11-17,3068,492,285.447,Foundation Models and Large Language Models,benchmark/dataset; transformer; generative,foundation-models; generative-ai; nlp; vision,"We propose a method for editing images from human instructions: given an input image and a written instruction that tells the model what to do, our model follows these instructions to edit the image.","high citation signal (3,068); influential citation signal (492); recognized venue; open-access PDF metadata","Capability gains are difficult to separate from data scale, benchmark leakage, and evaluation prompt sensitivity.; Alignment and safety claims often need stronger real-world and multilingual validation.; Compute-intensive training can limit reproducibility and concentrate follow-up work around a small number of institutions.",https://doi.org/10.1109/CVPR52729.2023.01764,https://www.semanticscholar.org/paper/a2d2bbe4c542173662a444b33b76c66992697830,https://arxiv.org/pdf/2211.09800,10.1109/CVPR52729.2023.01764,2211.09800,,253581213,Computer Science,JournalArticle; Conference,large language models,1,citations=3068; influential=492; recognized venue; survey/benchmark signal; resource signal; open PDF metadata; AI term matches=3,"We propose a method for editing images from human instructions: given an input image and a written instruction that tells the model what to do, our model follows these instructions to edit the image. To obtain training data for this problem, we combine the knowledge of two large pretrained models—a language model (GPT-3) and a text-to-image model (Stable Diffusion)—to generate a large dataset of image editing examples. Our conditional diffusion model, InstructPix2Pix, is trained on our generated data, and generalizes to real images and user-written instructions at inference time. Since it performs edits in the forward pass and does not require per-example fine-tuning or inversion, our model edits images quickly, in a matter of seconds. We show compelling editing results for a diverse collection of input images and written instructions."
118,25,25,2022,BLOOM: A 176B-Parameter Open-Access Multilingual Language Model,"Teven Le Scao, Angela Fan, Christopher Akiki, Ellie Pavlick, Suzana Ili'c, Daniel Hesslow, Roman Castagn'e, A. Luccioni, et al.",arXiv.org,2022-11-09,2948,272,270.295,Foundation Models and Large Language Models,benchmark/dataset; transformer,foundation-models; nlp; trustworthy-ai,Large language models (LLMs) have been shown to be able to perform new tasks based on a few demonstrations or natural language instructions.,"high citation signal (2,948); influential citation signal (272)","Capability gains are difficult to separate from data scale, benchmark leakage, and evaluation prompt sensitivity.; Alignment and safety claims often need stronger real-world and multilingual validation.; Compute-intensive training can limit reproducibility and concentrate follow-up work around a small number of institutions.",https://www.semanticscholar.org/paper/964bd39b546f0f6625ff3b9ef1083f797807ef2e,https://www.semanticscholar.org/paper/964bd39b546f0f6625ff3b9ef1083f797807ef2e,,,2211.05100,,253420279,Computer Science; Linguistics,JournalArticle,large language models,1,citations=2948; influential=272; survey/benchmark signal; resource signal; open PDF metadata; title AI matches=1; AI term matches=5,"Large language models (LLMs) have been shown to be able to perform new tasks based on a few demonstrations or natural language instructions. While these capabilities have led to widespread adoption, most LLMs are developed by resource-rich organizations and are frequently kept from the public. As a step towards democratizing this powerful technology, we present BLOOM, a 176B-parameter open-access language model designed and built thanks to a collaboration of hundreds of researchers. BLOOM is a decoder-only Transformer language model that was trained on the ROOTS corpus, a dataset comprising hundreds of sources in 46 natural and 13 programming languages (59 in total). We find that BLOOM achieves competitive performance on a wide variety of benchmarks, with stronger results after undergoing multitask prompted finetuning. To facilitate future research and applications using LLMs, we publicly release our models and code under the Responsible AI License."
130,26,26,2022,Design and Development of Cost-Effective Child Surveillance System using Computer Vision Technology,"Vedavyas Peddiraju, Ramchandar Rao Pamulaparthi, Chakaradhar Adupa, Laxman Raju Thoutam","2022 International Conference on Recent Trends in Microelectronics, Automation, Computing and Communications Systems (ICMACC)",2022-12-28,2744,186,254.421,Vision and Multimodal Learning,trustworthy-ai; ai4science,vision; reinforcement-learning; trustworthy-ai,"The project's primary goal is to ensure child surveillance, continuous monitor and alert system for safety.","high citation signal (2,744); influential citation signal (186)","Large-scale benchmark success can overstate robustness under distribution shift, rare classes, and real deployment constraints.; Multimodal alignment may inherit biases and spurious correlations from web-scale data.; High-performing systems often require data and compute resources that are hard for smaller labs to reproduce.",https://doi.org/10.1109/ICMACC54824.2022.10093561,https://www.semanticscholar.org/paper/290f40b6e5ad78a7f5c2cb226e48f98132843d9f,,10.1109/ICMACC54824.2022.10093561,,,218760367,Computer Science; Engineering,Conference,computer vision,1,citations=2744; influential=186; translation/trustworthiness signal; open PDF metadata; title AI matches=1; AI term matches=1,"The project's primary goal is to ensure child surveillance, continuous monitor and alert system for safety. Pre-defined navigation is one of the primary challenges in the robotic industry. Many technologies have been developed to overcome these problems. The project utilizes a high-quality night vision camera that is installed on a navigation robot that moves in the pre-defined path. The night vision camera captures the image and video of child activity, and transmits the data to the main system. The navigation robot is also equipped with the passive infrared (PIR) sensor to monitor any unauthorized human face intervention for child abuduction, and sound sensor for cry detection. The sound sensor detects the crying of the child and gives alert to the parent for immediate assistance.re will be developed using Python in the Google Colab."
136,27,27,2022,Visual Prompt Tuning,"Menglin Jia, Luming Tang, Bor-Chun Chen, C. Cardie, Serge J. Belongie, Bharath Hariharan, S. Lim",European Conference on Computer Vision,2022-03-23,2655,419,266.024,Foundation Models and Large Language Models,transformer,foundation-models; vision,"The current modus operandi in adapting pre-trained models involves updating all the backbone parameters, ie, full fine-tuning.","high citation signal (2,655); influential citation signal (419); open-access PDF metadata","Capability gains are difficult to separate from data scale, benchmark leakage, and evaluation prompt sensitivity.; Alignment and safety claims often need stronger real-world and multilingual validation.; Compute-intensive training can limit reproducibility and concentrate follow-up work around a small number of institutions.",https://doi.org/10.48550/arXiv.2203.12119,https://www.semanticscholar.org/paper/adb272fbdea3631059cf88ab764bb6c2ce29f965,http://arxiv.org/pdf/2203.12119,10.48550/arXiv.2203.12119,2203.12119,,247618727,Computer Science,JournalArticle; Conference,large language models,1,citations=2655; influential=419; open PDF metadata; title AI matches=1; AI term matches=5,"The current modus operandi in adapting pre-trained models involves updating all the backbone parameters, ie, full fine-tuning. This paper introduces Visual Prompt Tuning (VPT) as an efficient and effective alternative to full fine-tuning for large-scale Transformer models in vision. Taking inspiration from recent advances in efficiently tuning large language models, VPT introduces only a small amount (less than 1% of model parameters) of trainable parameters in the input space while keeping the model backbone frozen. Via extensive experiments on a wide variety of downstream recognition tasks, we show that VPT achieves significant performance gains compared to other parameter efficient tuning protocols. Most importantly, VPT even outperforms full fine-tuning in many cases across model capacities and training data scales, while reducing per-task storage cost."
148,28,28,2022,Beyond the Imitation Game: Quantifying and extrapolating the capabilities of language models,"Aarohi Srivastava, Abhinav Rastogi, Abhishek Rao, Abu Awal Md Shoeb, Abubakar Abid, Adam Fisch, Adam R. Brown, Adam Santoro, et al.",arXiv.org,2022-06-09,2513,180,259.031,Foundation Models and Large Language Models,benchmark/dataset; transformer; ai4science,foundation-models; reinforcement-learning; trustworthy-ai; ai4science,Language models demonstrate both quantitative improvement and new qualitative capabilities with increasing scale.,"high citation signal (2,513); influential citation signal (180)","Capability gains are difficult to separate from data scale, benchmark leakage, and evaluation prompt sensitivity.; Alignment and safety claims often need stronger real-world and multilingual validation.; Compute-intensive training can limit reproducibility and concentrate follow-up work around a small number of institutions.",https://www.semanticscholar.org/paper/bd1331b233e84bab7eba503abc60b31ac08e7881,https://www.semanticscholar.org/paper/bd1331b233e84bab7eba503abc60b31ac08e7881,,,2206.04615,,263625818,Computer Science; Linguistics; Mathematics,JournalArticle,large language models,1,citations=2513; influential=180; survey/benchmark signal; resource signal; open PDF metadata; title AI matches=1; AI term matches=3,"Language models demonstrate both quantitative improvement and new qualitative capabilities with increasing scale. Despite their potentially transformative impact, these new capabilities are as yet poorly characterized. In order to inform future research, prepare for disruptive new model capabilities, and ameliorate socially harmful effects, it is vital that we understand the present and near-future capabilities and limitations of language models. To address this challenge, we introduce the Beyond the Imitation Game benchmark (BIG-bench). BIG-bench currently consists of 204 tasks, contributed by 450 authors across 132 institutions. Task topics are diverse, drawing problems from linguistics, childhood development, math, common-sense reasoning, biology, physics, social bias, software development, and beyond. BIG-bench focuses on tasks that are believed to be beyond the capabilities of current language models. We evaluate the behavior of OpenAI's GPT models, Google-internal dense transformer architectures, and Switch-style sparse transformers on BIG-bench, across model sizes spanning millions to hundreds of billions of parameters. In addition, a team of human expert raters performed all tasks in order to provide a strong baseline. Findings include: model performance and calibration both improve with scale, but are poor in absolute terms (and when compared with rater performance); performance is remarkably similar across model classes, though with benefits from sparsity; tasks that improve gradually and predictably commonly involve a large knowledge or memorization component, whereas tasks that exhibit""breakthrough""behavior at a critical scale often involve multiple steps or components, or brittle metrics; social bias typically increases with scale in settings with ambiguous context, but this can be improved with prompting."
157,29,29,2022,Learn to Explain: Multimodal Reasoning via Thought Chains for Science Question Answering,"Pan Lu, Swaroop Mishra, Tony Xia, Liang Qiu, Kai-Wei Chang, Song-Chun Zhu, Oyvind Tafjord, Peter Clark, et al.",Neural Information Processing Systems,2022-09-20,2400,266,268.462,Foundation Models and Large Language Models,benchmark/dataset; transformer; trustworthy-ai,foundation-models; multimodal; nlp; trustworthy-ai; ai4science,"When answering a question, humans utilize the information available across different modalities to synthesize a consistent and complete chain of thought (CoT).","high citation signal (2,400); influential citation signal (266); open-access PDF metadata","Capability gains are difficult to separate from data scale, benchmark leakage, and evaluation prompt sensitivity.; Alignment and safety claims often need stronger real-world and multilingual validation.; Compute-intensive training can limit reproducibility and concentrate follow-up work around a small number of institutions.",https://doi.org/10.48550/arXiv.2209.09513,https://www.semanticscholar.org/paper/d3135733aa39dec20ce72aa138589dda27c8406d,http://arxiv.org/pdf/2209.09513,10.48550/arXiv.2209.09513,2209.09513,,252383606,Computer Science,JournalArticle,deep learning; large language models; multimodal learning,3,citations=2400; influential=266; survey/benchmark signal; resource signal; translation/trustworthiness signal; open PDF metadata; AI term matches=4; query hits=3,"When answering a question, humans utilize the information available across different modalities to synthesize a consistent and complete chain of thought (CoT). This process is normally a black box in the case of deep learning models like large-scale language models. Recently, science question benchmarks have been used to diagnose the multi-hop reasoning ability and interpretability of an AI system. However, existing datasets fail to provide annotations for the answers, or are restricted to the textual-only modality, small scales, and limited domain diversity. To this end, we present Science Question Answering (ScienceQA), a new benchmark that consists of ~21k multimodal multiple choice questions with a diverse set of science topics and annotations of their answers with corresponding lectures and explanations. We further design language models to learn to generate lectures and explanations as the chain of thought (CoT) to mimic the multi-hop reasoning process when answering ScienceQA questions. ScienceQA demonstrates the utility of CoT in language models, as CoT improves the question answering performance by 1.20% in few-shot GPT-3 and 3.99% in fine-tuned UnifiedQA. We also explore the upper bound for models to leverage explanations by feeding those in the input; we observe that it improves the few-shot performance of GPT-3 by 18.96%. Our analysis further shows that language models, similar to humans, benefit from explanations to learn from fewer data and achieve the same performance with just 40% of the data. The data and code are available at https://scienceqa.github.io."
